Unnamed: 0,term,pos,definition,domain,supplementary_info,obsolete,slang,dated,rare,vulgar,offensive,slur,astrology,mythology,jargon,euphemistic,informal,humorous,literary,literature,childish,folklore,colloquial,nonstandard,theology,abbreviation,abbreviation_for_term,plural,plural_for_term,misspelling,misspelling_for_term,acronym,acronym_for_term,synonym,synonym_for_term,antonym,antonym_for_term,attribute,property,process,matter,role,measure,units,body
791,ichthidin,Noun,A substance from the egg yolk of osseous fishes.,,,False,False,False,False,False,False,False,False,False,False,False,False,False,False,False,False,False,False,False,False,False,,False,,False,,False,,False,,False,,False,False,False,True,False,False,False,False
794,ichthulin,Noun,A substance from the yolk of salmon roe., organic chemistry,,False,False,False,False,False,False,False,False,False,False,False,False,False,False,False,False,False,False,False,False,False,,False,,False,,False,,False,,False,,False,False,False,True,False,False,False,False
5001,immunoregulator,Noun,A substance responsible for immunoregulation, immunology,,False,False,False,False,False,False,False,False,False,False,False,False,False,False,False,False,False,False,False,False,False,,False,,False,,False,,False,,False,,False,False,False,True,False,False,False,False
6228,impletion,Noun,"A substance which fills, a filling.",,,False,False,False,False,False,False,False,False,False,False,False,False,False,False,False,False,False,False,False,False,False,,False,,False,,False,,False,,False,,False,False,False,True,False,False,False,False
6994,improver,Noun,A substance added to cause improvement (especially to a foodstuff),,"2016, Wendyl Nissen, Who kneads so many ingredients? The New Zealand Herald, 6 August, 2016,[8] Soy flour is often added to bread as an improver. It helps the dough texture and can make the bread quite soft. 2017, Gardening: Get a taste of the Mediterranean, The Northern Star, 7 February, 2017,[9] When planting a new olive tree, mix organic soil improver and fertiliser into the planting hole and keep the soil moist while the olive establishes itself.",False,False,False,False,False,False,False,False,False,False,False,False,False,False,False,False,False,False,False,False,False,,False,,False,,False,,False,,False,,False,False,False,True,False,False,False,False
8309,incensole,Noun,A substance obtained from the bark of Boswellia dalzielii., organic chemistry,,False,False,False,False,False,False,False,False,False,False,False,False,False,False,False,False,False,False,False,False,False,,False,,False,,False,,False,,False,,False,False,False,True,False,False,False,False
9427,incrassative,Noun,"A substance which has the power to thicken; formerly, a medicine supposed to thicken the humours",,(Can we find and add a quotation of Harvey to this entry?),False,False,False,False,False,False,False,False,False,False,False,False,False,False,False,False,False,False,False,False,False,,False,,False,,False,,False,,False,,False,False,False,True,False,False,False,False
10744,indirubin,Noun,"A substance isomeric with, and resembling, indigo blue.", organic chemistry,,False,False,False,False,False,False,False,False,False,False,False,False,False,False,False,False,False,False,False,False,False,,False,,False,,False,,False,,False,,False,False,False,True,False,False,False,False
11020,indoin,Noun,"A substance resembling indigo blue, obtained artificially from certain isatogen compounds.", organic chemistry,,False,False,False,False,False,False,False,False,False,False,False,False,False,False,False,False,False,False,False,False,False,,False,,False,,False,,False,,False,,False,False,False,True,False,False,False,False
11725,inert,Noun,A substance that does not react chemically., chemistry,,False,False,False,False,False,False,False,False,False,False,False,False,False,False,False,False,False,False,False,False,False,,False,,False,,False,,False,,False,,False,False,False,True,False,False,False,False
12508,infiltrant,Noun,"A substance that penetrates an object to give it some property, such as waterproofing.",,,False,False,False,False,False,False,False,False,False,False,False,False,False,False,False,False,False,False,False,False,False,,False,,False,,False,,False,,False,,False,False,False,True,False,False,False,False
13776,ingo,Noun,A substance or thing that has gone in,,"1890, Annual Report of the U.S. Agricultural Experiment Station for Dakota:An accurate record was kept of all of the ingo, and all the outgo from the cows. 1912, The United States, Appellant, Vs. Forty Barrels and Twenty Kegs:It refers to the ingo and outgo and what takes place with the ingo, what becomes of it, how it is changed into the material that goes out, what is built up, what is assimilated, how the changes take place here and there. That is all metabolism. 2010, Stephen W. Reiss, Family, Farming and Freedom: Fifty-Five Years of Writings by Irv Reiss, ISBN:We have to get a better balance between our ingo and our outgo calories consumed and calories expended.",False,False,False,False,False,False,False,False,False,False,False,False,False,False,False,False,False,False,False,False,False,,False,,False,,False,,False,,False,,False,False,False,True,False,False,False,False
14360,initiator,Noun,A substance that initiates a chain reaction or polymerization., chemistry,,False,False,False,False,False,False,False,False,False,False,False,False,False,False,False,False,False,False,False,False,False,,False,,False,,False,,False,,False,,False,False,False,True,False,False,False,False
14382,injectant,Noun,A substance that is injected,,A variety of fatty injectants may be used to create artificial marbling in meat.,False,False,False,False,False,False,False,False,False,False,False,False,False,False,False,False,False,False,False,False,False,,False,,False,,False,,False,,False,,False,False,False,True,False,False,False,False
15714,insecticide,Noun,A substance used to kill insects,,"2009, Handbook of Pesticides: Methods of Pesticide Residues Analysis ISBN The dried seed powder of custard apple (Annona squamosa L; family: Annonaceae) has been used as an insecticide in India and many other tropical countries since ancient times.",False,False,False,False,False,False,False,False,False,False,False,False,False,False,False,False,False,False,False,False,False,,False,,False,,False,,False,,False,,False,False,False,True,False,False,False,False
15718,insectifuge,Noun,A substance that protects against insects.,,,False,False,False,False,False,False,False,False,False,False,False,False,False,False,False,False,False,False,False,False,False,,False,,False,,False,,False,,False,,False,False,False,True,False,False,False,False
17084,insulator,Noun,"A substance that does not transmit heat (thermal insulator), sound (acoustic insulator) or electricity (electrical insulator).",,,False,False,False,False,False,False,False,False,False,False,False,False,False,False,False,False,False,False,False,False,False,,False,,False,,False,,False,,False,,False,False,False,True,False,False,False,False
23487,inuloid,Noun,"A substance resembling inulin, found in the unripe bulbs of the dahlia.", organic chemistry,,False,False,False,False,False,False,False,False,False,False,False,False,False,False,False,False,False,False,False,False,False,,False,,False,,False,,False,,False,,False,False,False,True,False,False,False,False
26520,isobutylphenyl propionic acid,Noun,"A substance used as an anti-inflammatory painkiller, often shortened to ibuprofen.", pharmacology,,False,False,False,False,False,False,False,False,False,False,False,False,False,False,False,False,False,False,False,False,False,,False,,False,,False,,False,,False,,False,False,False,True,False,False,False,False
28424,ixodicide,Noun,A substance that kills ticks.,,,False,False,False,False,False,False,False,False,False,False,False,False,False,False,False,False,False,False,False,False,False,,False,,False,,False,,False,,False,,False,False,False,True,False,False,False,False
432,dadyl,Noun,A substance (of unknown composition) derived from turpentine, organic chemistry,,False,False,False,False,False,False,False,False,False,False,False,False,False,False,False,False,False,False,False,False,False,,False,,False,,False,,False,,False,,False,False,False,True,False,False,False,False
5699,debilitant,Noun,A substance which debilitates; a weakening agent; a remedy for excessive excitement., medicine,,False,False,False,False,False,False,False,False,False,False,False,False,False,False,False,False,False,False,False,False,False,,False,,False,,False,,False,,False,,False,False,False,True,False,False,False,False
6369,decaphosphate,Noun,A substance containing ten phosphate groups [(PO4)10] or [P10O40]., chemistry,,False,False,False,False,False,False,False,False,False,False,False,False,False,False,False,False,False,False,False,False,False,,False,,False,,False,,False,,False,,False,False,False,True,False,False,False,False
7688,decolorant,Noun,"A substance that removes colour, or bleaches.",,,False,False,False,False,False,False,False,False,False,False,False,False,False,False,False,False,False,False,False,False,False,,False,,False,,False,,False,,False,,False,False,False,True,False,False,False,False
11729,delayer,Noun,A substance that is used to slow the rate of combustion of a solid rocket fuel so as to make it more controllable,,,False,False,False,False,False,False,False,False,False,False,False,False,False,False,False,False,False,False,False,False,False,,False,,False,,False,,False,,False,,False,False,False,True,False,False,False,False
14046,denaturant,Noun,a substance used for denaturation,,,False,False,False,False,False,False,False,False,False,False,False,False,False,False,False,False,False,False,False,False,False,,False,,False,,False,,False,,False,,False,False,False,True,False,False,False,False
15001,deodorizer,Noun,A substance or device that removes or masks odors/odours.,,,False,False,False,False,False,False,False,False,False,False,False,False,False,False,False,False,False,False,False,False,False,,False,,False,,False,,False,,False,,False,False,False,True,False,False,False,False
18105,desiccant,Noun,A substance (such as calcium oxide or silica gel) that is used as a drying agent because of its high affinity for water.,,,False,False,False,False,False,False,False,False,False,False,False,False,False,False,False,False,False,False,False,False,False,,False,,False,,False,,False,,False,,False,False,False,True,False,False,False,False
18112,desiccate,Noun,"A substance which has been dessicated, that is, had its moisture removed",,"2011, Virgil A. Rhodius; Carol A. Gross, Using DNA Microarrays to Assay Part Function, in Christopher Voigt, editor, Methods in Enzymology, volume 497 (Synthetic Biology, Part A; Methods for Part/Device Characterization and Chassis Engineering), San Diego, Calif.: Academic Press, ISBN, ISSN 0076-6879, section 5.3 (Cy3/Cy5 Coupling), page 90:The Cy dyes are shipped as a desiccate in sealed packs.",False,False,False,False,False,False,False,False,False,False,False,False,False,False,False,False,False,False,False,False,False,,False,,False,,False,,False,,False,,False,False,False,True,False,False,False,False
18700,desorbent,Noun,A substance that can enable desorption., sciences,,False,False,False,False,False,False,False,False,False,False,False,False,False,False,False,False,False,False,False,False,False,,False,,False,,False,,False,,False,,False,False,False,True,False,False,False,False
19834,determinant,Noun,A substance that causes a cell to adopt a particular fate., biology,,False,False,False,False,False,False,False,False,False,False,False,False,False,False,False,False,False,False,False,False,False,,False,,False,,False,,False,,False,,False,False,False,True,False,False,False,False
25286,diffusant,Noun,A substance that diffuses through something.,,,False,False,False,False,False,False,False,False,False,False,False,False,False,False,False,False,False,False,False,False,False,,False,,False,,False,,False,,False,,False,False,False,True,False,False,False,False
25553,digestive,Noun,A substance that aids digestion.,,,False,False,False,False,False,False,False,False,False,False,False,False,False,False,False,False,False,False,False,False,False,,False,,False,,False,,False,,False,,False,False,False,True,False,False,False,False
26477,dilatant,Noun,A substance whose viscosity increases with rate of shear., physics,,False,False,False,False,False,False,False,False,False,False,False,False,False,False,False,False,False,False,False,False,False,,False,,False,,False,,False,,False,,False,False,False,True,False,False,False,False
26713,diluter,Noun,A substance used for diluting,,"John Quincy, Pharmacopia officinalis extemporanea Very little is prescribed in the Shops under this Intention, because the Kitchen so much better supplies all of this Kind, and furnishes the common Diluters, of which Sage Tea, Lemonade with a little Wine, and Wine and Water, are much the best []",False,False,False,False,False,False,False,False,False,False,False,False,False,False,False,False,False,False,False,False,False,,False,,False,,False,,False,,False,,False,False,False,True,False,False,False,False
32575,disinfectant,Noun,A substance that kills germs and/or viruses,,The scalpels were soaked in disinfectant before the operation so disease wouldn't be spread.,False,False,False,False,False,False,False,False,False,False,False,False,False,False,False,False,False,False,False,False,False,,False,,False,,False,,False,,False,,False,False,False,True,False,False,False,False
33657,disperser,Noun,A substance that stabilizes a dispersion; an emulsifier., chemistry,,False,False,False,False,False,False,False,False,False,False,False,False,False,False,False,False,False,False,False,False,False,,False,,False,,False,,False,,False,,False,False,False,True,False,False,False,False
34826,dissolvent,Noun,A substance which can dissolve or be dissolved into a liquid.,,,False,False,False,False,False,False,False,False,False,False,False,False,False,False,False,False,False,False,False,False,False,,False,,False,,False,,False,,False,,False,False,False,True,False,False,False,False
35184,distillation chaser,Noun,"A substance used to force a distillate in a distillation, as it has a boiling point more than that of the substance to be extracted and less than that of the impurities",,It is rarely used but mostly with fractional distillation when column packing is used. As it vapourises it heats the column packing and causes the trapped fluid to rise over.,False,False,False,False,False,False,False,False,False,False,False,False,False,False,False,False,False,False,False,False,False,,False,,False,,False,,False,,False,,False,False,False,True,False,False,False,False
35488,distribuend,Noun,A substance that is distributed between two immiscible liquids, chemistry,,False,False,False,False,False,False,False,False,False,False,False,False,False,False,False,False,False,False,False,False,False,,False,,False,,False,,False,,False,,False,False,False,True,False,False,False,False
40373,dopant,Noun,A substance added in small amounts to a pure semiconductor material to alter its conductive properties,,"1970, James W[alter] Mayer; Lennart Eriksson; John A[rthur] Davies, General Features of Ion Implantation, in Ion Implantation in Semiconductors: Silicon and Germanium, New York, N.Y.: Academic Press, OCLC 912401876, page 5:It should be noted that even though both types of disorder can be annealed at temperatures well below those where diffusion of the dopant species occurs, there are still defects present.",False,False,False,False,False,False,False,False,False,False,False,False,False,False,False,False,False,False,False,False,False,,False,,False,,False,,False,,False,,False,False,False,True,False,False,False,False
46989,drug,Noun,"A substance used to treat an illness, relieve a symptom, or modify a chemical process in the body for a specific purpose", pharmacology,"Aspirin is a drug that reduces pain, acts against inflammation and lowers body temperature. The revenues from both brand-name drugs and generic drugs have increased. (Can we date this quote?) John Milton whence merchants bring their spicy drugs",False,False,False,False,False,False,False,False,False,False,False,False,False,False,False,False,False,False,False,False,False,,False,,False,,False,,False,,False,,False,False,False,True,False,False,False,False
1528,obtundent,Noun,"A substance which sheathes a part, or blunts irritation, usually some bland, oily, or mucilaginous matter; nearly the same as demulcent.",,,False,False,False,False,False,False,False,False,False,False,False,False,False,False,False,False,False,False,False,False,False,,False,,False,,False,,False,,False,,False,False,False,True,False,False,False,False
4852,ointment,Noun,"A substance used to anoint, as in religious rituals.",,,False,False,False,False,False,False,False,False,False,False,False,False,False,False,False,False,False,False,False,False,False,,False,,False,,False,,False,,False,,False,False,False,True,False,False,False,False
9676,opioid,Noun,A substance that has effects similar to opium.,,,False,False,False,False,False,False,False,False,False,False,False,False,False,False,False,False,False,False,False,False,False,,False,,False,,False,,False,,False,,False,False,False,True,False,False,False,False
25614,oxylith,Noun,"A substance, containing sodium peroxide and other salts, which releases oxygen upon contact with water.",,,False,False,False,False,False,False,False,False,False,False,False,False,False,False,False,False,False,False,False,False,False,,False,,False,,False,,False,,False,,False,False,False,True,False,False,False,False
4182,water,Noun,"A substance (of molecular formula HO) found at room temperature and pressure as a clear liquid; it is present naturally as rain, and found in rivers, lakes and seas; its solid form is ice and its gaseous form is steam", uncountable,"By the action of electricity, the water was resolved into its two parts, oxygen and hydrogen. 2013 September-October, Katie L. Burke, In the News, in American Scientist:Oxygen levels on Earth skyrocketed 2.4 billion years ago, when cyanobacteria evolved photosynthesis: the ability to convert water and carbon dioxide into carbohydrates and waste oxygen using solar energy. (uncountable, in particular) The liquid form of this substance: liquid HO. May I have a glass of water? Your plants need more water. 1835, Sir John Ross, Sir James Clark Ross, Narrative of a Second Voyage in Search of a North-west Passage , Volume 1, pp.284-5 Towards the following morning, the thermometer fell to 5; and at daylight, there was not an atom of water to be seen in any direction. 2002, Arthur T. Hubbard, Encyclopedia of Surface and Colloid Science ISBN, page 4895: A water drop placed on the surface of ice can either spread or form a lens depending on the properties of the three phases involved in wetting, i.e., on the properties of the ice, water, and gas phases. 2013 May 11, The climate of Tibet: Pole-land, in The Economist, volume 407, number 8835, page 80:Of all the transitions brought about on the Earths surface by temperature change, the melting of ice into water is the starkest. It is binary. And for the land beneath, the air above and the life around, it changes everything. For more examples of usage of this term, see Citations:water. (countable) A serving of liquid water. 2006, Lori Foster, Erin McCarthy, Amy Garvey, Bad Boys of Summer, ISBN, page 91:Joe bustled back and offered her a glass of wine but she shook her head. Just a water, please.",False,False,False,False,False,False,False,False,False,False,False,False,False,False,False,False,False,False,False,False,False,,False,,False,,False,,False,,False,,False,False,False,True,False,False,False,False
5111,waterproof,Noun,"A substance or preparation for rendering cloth, leather, etc., impervious to water.",,,False,False,False,False,False,False,False,False,False,False,False,False,False,False,False,False,False,False,False,False,False,,False,,False,,False,,False,,False,,False,False,False,True,False,False,False,False
8936,wetting agent,Noun,"A substance, such as a surfactant, that reduces the surface tension of a liquid, allowing it to spread across and penetrate the surface of a solid.",,,False,False,False,False,False,False,False,False,False,False,False,False,False,False,False,False,False,False,False,False,False,,False,,False,,False,,False,,False,,False,False,False,True,False,False,False,False
11681,whitening,Noun,"A substance, such as a bleach, used to make something white or whiter",,"Whiting, a kind of fine white chalk.",False,False,False,False,False,False,False,False,False,False,False,False,False,False,False,False,False,False,False,False,False,,False,,False,,False,,False,,False,,False,False,False,True,False,False,False,False
17424,wood putty,Noun,"A substance, typically wood dust with a binder, used to fill imperfections in wood prior to finishing.",,,False,False,False,False,False,False,False,False,False,False,False,False,False,False,False,False,False,False,False,False,False,,False,,False,,False,,False,,False,,False,False,False,True,False,False,False,False
8630,base,Noun,A substance used as a mordant in dyeing,,(Can we find and add a quotation of Ure to this entry?),False,False,False,False,False,False,False,False,False,False,False,False,False,False,False,False,False,False,False,False,False,,False,,False,,False,,False,,False,,False,False,False,True,False,False,False,False
10014,bath,Noun,A substance or preparation in which something is immersed,,"a bath of heated sand, ashes, steam, or hot air 1879, Th Du Moncel, The Telephone, the Microphone and the Phonograph, Harper, page 166:He takes the prepared charcoal used by artists, brings it to a white heat, and suddenly plunges it in a bath of mercury, of which the globules instantly penetrate the pores of charcoal, and may be said to metallize it.",False,False,False,False,False,False,False,False,False,False,False,False,False,False,False,False,False,False,False,False,False,,False,,False,,False,,False,,False,,False,False,False,True,False,False,False,False
24999,biomarker,Noun,"A substance used as an indicator of a biological state, most commonly disease.", medicine,,False,False,False,False,False,False,False,False,False,False,False,False,False,False,False,False,False,False,False,False,False,,False,,False,,False,,False,,False,,False,False,False,True,False,False,False,False
26456,birch tar,Noun,"A substance (liquid when heated) derived from dry distillation of birch bark, and composed of phenols such as guaiacol, cresol, xylenol and creosol.",,,False,False,False,False,False,False,False,False,False,False,False,False,False,False,False,False,False,False,False,False,False,,False,,False,,False,,False,,False,,False,False,False,True,False,False,False,False
29332,blackball,Noun,"A substance for blacking shoes, boots, etc",,or for taking impressions of engraved work.,False,False,False,False,False,False,False,False,False,False,False,False,False,False,False,False,False,False,False,False,False,,False,,False,,False,,False,,False,,False,False,False,True,False,False,False,False
34177,bluing,Noun,A substance used in laundry to whiten clothes; blue,,,False,False,False,False,False,False,False,False,False,False,False,False,False,False,False,False,False,False,False,False,False,,False,,False,,False,,False,,False,,False,False,False,True,False,False,False,False
46930,bromanil,Noun,A substance analogous to chloranil but containing bromine in place of chlorine.,,,False,False,False,False,False,False,False,False,False,False,False,False,False,False,False,False,False,False,False,False,False,,False,,False,,False,,False,,False,,False,False,False,True,False,False,False,False
49710,buff,Noun,A substance used to dilute (street) drugs in order to increase profits,,"2014, Aldergroves 856 gang busted, $400,000 in drugs seized, CBC News, 30 July, 2014,[5] Police say this 20 ton hydraulic jack was used to press mixtures of cocaine and buff into brick.",False,False,False,False,False,False,False,False,False,False,False,False,False,False,False,False,False,False,False,False,False,,False,,False,,False,,False,,False,,False,False,False,True,False,False,False,False
876,haematoin,Noun,"A substance formed from the haematin of blood, by removal of the iron through the action of concentrated sulphuric acid.", biochemistry,,False,False,False,False,False,False,False,False,False,False,False,False,False,False,False,False,False,False,False,False,False,,False,,False,,False,,False,,False,,False,False,False,True,False,False,False,False
2891,hallucinogenic,Noun,a substance that is a hallucinogen,,hallucinogenics are sometimes used in indigenous people's religious rites.,False,False,False,False,False,False,False,False,False,False,False,False,False,False,False,False,False,False,False,False,False,,False,,False,,False,,False,,False,,False,False,False,True,False,False,False,False
8761,hazardous material,Noun,"A substance, natural or man-made, which is intrinsically dangerous or otherwise poses a safety hazard",,"Examples are materials which are explosive, poisonous, chemically active (including acids and other corrosives), radioactive, or biologically active (including human blood and other medical waste).",False,False,False,False,False,False,False,False,False,False,False,False,False,False,False,False,False,False,False,False,False,,False,,False,,False,,False,,False,,False,False,False,True,False,False,False,False
12717,hemacyanin,Noun,"A substance found in the blood of the octopus, responsible for its blue colour.", biochemistry,,False,False,False,False,False,False,False,False,False,False,False,False,False,False,False,False,False,False,False,False,False,,False,,False,,False,,False,,False,,False,False,False,True,False,False,False,False
