Unnamed: 0,term,pos,definition,domain,supplementary_info,obsolete,slang,dated,rare,vulgar,offensive,slur,astrology,mythology,jargon,euphemistic,informal,humorous,literary,literature,childish,folklore,colloquial,nonstandard,theology,abbreviation,abbreviation_for_term,plural,plural_for_term,misspelling,misspelling_for_term,acronym,acronym_for_term,synonym,synonym_for_term,antonym,antonym_for_term,attribute,property,process,matter,role,measure,units,body
15027,herbicide,Noun,A substance used to kill plants.,,,False,False,False,False,False,False,False,False,False,False,False,False,False,False,False,False,False,False,False,False,False,,False,,False,,False,,False,,False,,False,False,False,True,False,False,False,False
17509,hexanitrodiphenylamine,Noun,A substance that was mixed with TNT in World War II to make it more explosive., organic chemistry,,False,False,False,False,False,False,False,False,False,False,False,False,False,False,False,False,False,False,False,False,False,,False,,False,,False,,False,,False,,False,False,False,True,False,False,False,False
32141,hydrocholeretic,Noun,A substance of this kind.,,,False,False,False,False,False,False,False,False,False,False,False,False,False,False,False,False,False,False,False,False,False,,False,,False,,False,,False,,False,,False,False,False,True,False,False,False,False
32652,hydrolyte,Noun,A substance subjected to hydrolysis.,,,False,False,False,False,False,False,False,False,False,False,False,False,False,False,False,False,False,False,False,False,False,,False,,False,,False,,False,,False,,False,False,False,True,False,False,False,False
33802,hymenialdisine,Noun,"A substance found in marine sponges that inhibits cyclin-dependent kinases, glycogen synthase kinase-3beta, and casein kinase 1", organic chemistry,"2015 October 1, Evaluation of the Anti-Inflammatory, Antioxidant and Immunomodulatory Effects of the Organic Extract of the Red Sea Marine Sponge Xestospongia testudinaria against Carrageenan Induced Rat Paw Inflammation, in PLOS ONE[1], DOI:10.1371/journal.pone.0138917:Similarly, marine sponge metabolite hymenialdisine was found to be a potent inhibitor of IL-2 and TNF- production.",False,False,False,False,False,False,False,False,False,False,False,False,False,False,False,False,False,False,False,False,False,,False,,False,,False,,False,,False,,False,False,False,True,False,False,False,False
3605,edemogen,Noun,A substance that causes edema,,,False,False,False,False,False,False,False,False,False,False,False,False,False,False,False,False,False,False,False,False,False,,False,,False,,False,,False,,False,,False,False,False,True,False,False,False,False
3937,edotreotide,Noun,"A substance which, when bound to various radionuclides, is used in the treatment and diagnosis of certain cancers.",,,False,False,False,False,False,False,False,False,False,False,False,False,False,False,False,False,False,False,False,False,False,,False,,False,,False,,False,,False,,False,False,False,True,False,False,False,False
7230,electrolyte,Noun,"A substance that, in solution or when molten, ionizes and conducts electricity.", chemistry,,False,False,False,False,False,False,False,False,False,False,False,False,False,False,False,False,False,False,False,False,False,,False,,False,,False,,False,,False,,False,False,False,True,False,False,False,False
7297,electromer,Noun,A substance that differs from another only in the distribution of electrons within the atoms of both substances,,"2004, Jan Kalinowski, Organic Light-Emitting Diodes: Principles, Characteristics Processes, ISBN:One of the important premises in understanding the notion of electromer is that electromer species are formed at molecular separations and relative orientations as to maximize the rate of the radiative cross-transitions.",False,False,False,False,False,False,False,False,False,False,False,False,False,False,False,False,False,False,False,False,False,,False,,False,,False,,False,,False,,False,False,False,True,False,False,False,False
8568,elixir,Noun,A substance or liquid which is believed to cure all ills and give eternal life., alchemy,,False,False,False,False,False,False,False,False,False,False,False,False,False,False,False,False,False,False,False,False,False,,False,,False,,False,,False,,False,,False,False,False,True,False,False,False,False
8571,elixir of life,Noun,"A substance which when drunk brings immortality: eternal life, eternal youth", alchemy,,False,False,False,False,False,False,False,False,False,False,False,False,False,False,False,False,False,False,False,False,False,,False,,False,,False,,False,,False,,False,False,False,True,False,False,False,False
11325,emulgent,Noun,A substance promoting bile or urine production, medicine,,False,False,False,False,False,False,False,False,False,False,False,False,False,False,False,False,False,False,False,False,False,,False,,False,,False,,False,,False,,False,False,False,True,False,False,False,False
11343,emulsifier,Noun,"A substance that helps an emulsion form, or helps keep an emulsion from separating",,The lecithin in egg yolks is often used as an emulsifier.,False,False,False,False,False,False,False,False,False,False,False,False,False,False,False,False,False,False,False,False,False,,False,,False,,False,,False,,False,,False,False,False,True,False,False,False,False
14345,energy carrier,Noun,A substance or phenomenon that can be used to produce mechanical work or heat or to operate chemical or physical processes (ISO 13600),,Solar radiation is an energy carrier that is not an energyware.,False,False,False,False,False,False,False,False,False,False,False,False,False,False,False,False,False,False,False,False,False,,False,,False,,False,,False,,False,,False,False,False,True,False,False,False,False
17261,entrainer,Noun,A substance used for entraining., chemistry,,False,False,False,False,False,False,False,False,False,False,False,False,False,False,False,False,False,False,False,False,False,,False,,False,,False,,False,,False,,False,False,False,True,False,False,False,False
20825,eradicant,Noun,A substance that serves to eradicate an infestation,,"1999, Larry L. Strand, Integrated Pest Management for Stone Fruits, ISBN, page 169:If inclement weather delays a scheduled protectant spray, apply an eradicant when conditions permit but within the kickback period. 2006, K.G. Mukerji, Fruit and Vegetable Diseases, ISBN, page 52:Some eradicants act by blocking spore production and reducing the potential of established infections to serve as sources of secondary inoculum for new infections. 2009, Dale Walters, Disease Control in Crops, ISBN:Usually, these eradicants exhibit a wide range of control over many organisms, and are detrimental to the crop as well.",False,False,False,False,False,False,False,False,False,False,False,False,False,False,False,False,False,False,False,False,False,,False,,False,,False,,False,,False,,False,False,False,True,False,False,False,False
21917,erythrogen,Noun,"A substance reddened by acids, supposed to be contained in flowers.",,,False,False,False,False,False,False,False,False,False,False,False,False,False,False,False,False,False,False,False,False,False,,False,,False,,False,,False,,False,,False,False,False,True,False,False,False,False
21924,erythrogranulose,Noun,"A substance present in small amount in starch granules, coloured red by iodine.", organic chemistry,,False,False,False,False,False,False,False,False,False,False,False,False,False,False,False,False,False,False,False,False,False,,False,,False,,False,,False,,False,,False,False,False,True,False,False,False,False
29996,expellant,Noun,A substance that expels undesirable material (typically worms) from the body, medicine,,False,False,False,False,False,False,False,False,False,False,False,False,False,False,False,False,False,False,False,False,False,,False,,False,,False,,False,,False,,False,False,False,True,False,False,False,False
31050,exsiccative,Noun,A substance that causes drying.,,,False,False,False,False,False,False,False,False,False,False,False,False,False,False,False,False,False,False,False,False,False,,False,,False,,False,,False,,False,,False,False,False,True,False,False,False,False
1461,paint,Noun,"A substance that is applied as a liquid or paste, and dries into a solid coating that protects or adds color/colour to an object or surface to which it has been applied.",,,False,False,False,False,False,False,False,False,False,False,False,False,False,False,False,False,False,False,False,False,False,,False,,False,,False,,False,,False,,False,False,False,True,False,False,False,False
1501,paint stripper,Noun,"A substance that softens and binds with paint, making it easier to remove from a surface.",,,False,False,False,False,False,False,False,False,False,False,False,False,False,False,False,False,False,False,False,False,False,,False,,False,,False,,False,,False,,False,False,False,True,False,False,False,False
5813,paper,Noun,A substance resembling paper secreted by certain invertebrates as protection for their nests and eggs.,,,False,False,False,False,False,False,False,False,False,False,False,False,False,False,False,False,False,False,False,False,False,,False,,False,,False,,False,,False,,False,False,False,True,False,False,False,False
7182,parahormone,Noun,"A substance that is a product of ordinary metabolism and not produced for a specific purpose, but acts like a hormone in modifying the activity of some distant organ, as in the case of carbon dioxide acting on the respiratory centre.",,,False,False,False,False,False,False,False,False,False,False,False,False,False,False,False,False,False,False,False,False,False,,False,,False,,False,,False,,False,,False,False,False,True,False,False,False,False
7747,paramylum,Noun,"A substance resembling starch, found in the green frothy scum formed on the surface of stagnant water.",,,False,False,False,False,False,False,False,False,False,False,False,False,False,False,False,False,False,False,False,False,False,,False,,False,,False,,False,,False,,False,False,False,True,False,False,False,False
10687,parturient,Noun,A substance that facilitates labour.,,,False,False,False,False,False,False,False,False,False,False,False,False,False,False,False,False,False,False,False,False,False,,False,,False,,False,,False,,False,,False,False,False,True,False,False,False,False
11735,paste,Noun,"A substance that behaves as a solid until a sufficiently large load or stress is applied, at which point it flows like a fluid", physics,,False,False,False,False,False,False,False,False,False,False,False,False,False,False,False,False,False,False,False,False,False,,False,,False,,False,,False,,False,,False,False,False,True,False,False,False,False
18928,peptonoid,Noun,A substance related to peptone., biochemistry,,False,False,False,False,False,False,False,False,False,False,False,False,False,False,False,False,False,False,False,False,False,,False,,False,,False,,False,,False,,False,False,False,True,False,False,False,False
19892,perfume,Noun,A substance created to provide a pleasant smell or one which emits an agreeable odor,,"2014 March 7, Nicole Vulser, Perfume manufacturers must cope with the scarcity of precious supplies, in The Guardian Weekly, volume 190, number 13, page 30:The perfume industry is facing a major problem: maintaining constant levels of quality is crucial, but it is increasingly difficult to obtain a regular supply of all the necessary natural ingredients.",False,False,False,False,False,False,False,False,False,False,False,False,False,False,False,False,False,False,False,False,False,,False,,False,,False,,False,,False,,False,False,False,True,False,False,False,False
21692,permeant,Noun,"A substance which is able to pass through or into a membrane or polymer 2004, Kirk et al., editors, Kirk-Othmer Encyclopedia of Chemical Technology[1], volume 4, ISBN, page 376:The overall movement of permeants through a polymer is called permeation, which is a multistep process.", biochemistry,,False,False,False,False,False,False,False,False,False,False,False,False,False,False,False,False,False,False,False,False,False,,False,,False,,False,,False,,False,,False,False,False,True,False,False,False,False
22378,persipan,Noun,"A substance similar to marzipan, but produced from peach or apricot pits instead of almonds.",,,False,False,False,False,False,False,False,False,False,False,False,False,False,False,False,False,False,False,False,False,False,,False,,False,,False,,False,,False,,False,False,False,True,False,False,False,False
22988,perturbagen,Noun,"A substance (typically a peptide) designed to disrupt intracellular processes, providing information about the operation of pathways and networks within a cell",,"2015 July 9, Maja Temerinac-Ott, Armaghan W Naik, Robert F Murphy, Deciding when to stop: efficient experimentation to learn to predict drug-target interactions, in BMC Bioinformatics[1], volume 16, DOI:10.1186/s12859-015-0650-9:To address this problem, we have previously proposed a parametrization of perturbagen-target systems in which we characterize each system by its responsiveness (the probability that a perturbagen has an effect on a target) and its uniqueness (the probability that a perturbagen or target is different from others) [ 18 ].",False,False,False,False,False,False,False,False,False,False,False,False,False,False,False,False,False,False,False,False,False,,False,,False,,False,,False,,False,,False,False,False,True,False,False,False,False
23831,petroleum coke,Noun,"A substance, mostly carbon, that is a byproduct of oil refining; used as a fuel or in many industrial applications.",,,False,False,False,False,False,False,False,False,False,False,False,False,False,False,False,False,False,False,False,False,False,,False,,False,,False,,False,,False,,False,False,False,True,False,False,False,False
26404,phlebotonic,Noun,"A substance (especially a drug) that is phlebotonic; a drug that modifies the tone of vein walls to treat venous insufficiency causing venous ulcers, hemorrhoids, or varicose veins",,"2012, Perera N, Liolitsa D, Iype S, Croxford A, Yassin M, Lang P, Ukaegbu O, van Issum C, Phlebotonics for haemorrhoids, in Cochrane Database of Systematic Reviews, volume 15, number 8, DOI:10.1002/14651858.CD004322.pub3, PMID 22895941, page CD004322:Phlebotonics are a heterogeneous class of drugs used to treat haemorrhoidal disease in the less severe stages of first and second-degree haemorrhoids, and during the thrombosis episodes. Although their true mechanism of action has not been well established, they are associated with strengthening of blood vessel walls, increasing venous tone, lymphatic drainage and normalizing capillary permeability. We considered twenty four studies for inclusion in this review. This review identified twenty randomised controlled trials enrolling a total of (2334) participants which compared an intervention using phlebotonics with a control intervention.",False,False,False,False,False,False,False,False,False,False,False,False,False,False,False,False,False,False,False,False,False,,False,,False,,False,,False,,False,,False,False,False,True,False,False,False,False
28005,photoallergen,Noun,A substance that generates an allergic response in the presence of light,,,False,False,False,False,False,False,False,False,False,False,False,False,False,False,False,False,False,False,False,False,False,,False,,False,,False,,False,,False,,False,False,False,True,False,False,False,False
28026,photoantigen,Noun,A substance that produces an immune response in the presence of light, immunology,,False,False,False,False,False,False,False,False,False,False,False,False,False,False,False,False,False,False,False,False,False,,False,,False,,False,,False,,False,,False,False,False,True,False,False,False,False
28156,photocatalyst,Noun,"A substance that absorbs light and, in doing so, catalyzes a reaction.", chemistry,,False,False,False,False,False,False,False,False,False,False,False,False,False,False,False,False,False,False,False,False,False,,False,,False,,False,,False,,False,,False,False,False,True,False,False,False,False
29277,photoprotectant,Noun,A substance with photoprotective properties.,,,False,False,False,False,False,False,False,False,False,False,False,False,False,False,False,False,False,False,False,False,False,,False,,False,,False,,False,,False,,False,False,False,True,False,False,False,False
39085,plastin,Noun,"A substance associated with nuclein in cell nuclei, and by some considered as the fundamental substance of the nucleus.", biology,,False,False,False,False,False,False,False,False,False,False,False,False,False,False,False,False,False,False,False,False,False,,False,,False,,False,,False,,False,,False,False,False,True,False,False,False,False
44234,poison,Noun,A substance that is harmful or lethal to a living organism,,We used a poison to kill the weeds.,False,False,False,False,False,False,False,False,False,False,False,False,False,False,False,False,False,False,False,False,False,,False,,False,,False,,False,,False,,False,False,False,True,False,False,False,False
45019,polish,Noun,A substance used to polish,,A good silver polish will remove tarnish easily.,False,False,False,False,False,False,False,False,False,False,False,False,False,False,False,False,False,False,False,False,False,,False,,False,,False,,False,,False,,False,False,False,True,False,False,False,False
45447,pollenin,Noun,A substance found in the pollen of certain plants., organic chemistry,,False,False,False,False,False,False,False,False,False,False,False,False,False,False,False,False,False,False,False,False,False,,False,,False,,False,,False,,False,,False,False,False,True,False,False,False,False
46196,polychromatic acid,Noun,A substance obtained by the action of nitric acid on aloes., chemistry,,False,False,False,False,False,False,False,False,False,False,False,False,False,False,False,False,False,False,False,False,False,,False,,False,,False,,False,,False,,False,False,False,True,False,False,False,False
57329,prebiotic,Noun,A substance in food that is hard to digest and promotes the growth of beneficial intestinal microorganisms, chiefly in the plural,"[from 20th c.] 2009, Jo Ann Hattner Susan Anderes, Gut Insight, ISBN, page 35:The table below includes plant foods we consider to be prebiotic stars since they are the foods listed in the scientific literature as sources of prebiotics. 2015, David Shaw, translating Giulia Enders, Gut, Scribe 2016, p. 240: Prebiotics are nowhere near as well researched as probiotics, although there are already some sound results pertaining to how they work.",False,False,False,False,False,False,False,False,False,False,False,False,False,False,False,False,False,False,False,False,False,,False,,False,,False,,False,,False,,False,False,False,True,False,False,False,False
57799,precipitant,Noun,A substance that forms a precipitate when added to a solution.,,,False,False,False,False,False,False,False,False,False,False,False,False,False,False,False,False,False,False,False,False,False,,False,,False,,False,,False,,False,,False,False,False,True,False,False,False,False
57847,precipitinogen,Noun,A substance that produces a precipitin.,,,False,False,False,False,False,False,False,False,False,False,False,False,False,False,False,False,False,False,False,False,False,,False,,False,,False,,False,,False,,False,False,False,True,False,False,False,False
59840,prehormone,Noun,"A substance secreted by glandular tissue that has little or no significant biological activity, but is converted in peripheral tissues into an active hormone.", biochemistry,,False,False,False,False,False,False,False,False,False,False,False,False,False,False,False,False,False,False,False,False,False,,False,,False,,False,,False,,False,,False,False,False,True,False,False,False,False
62508,preslug,Noun,A substance injected into water contaminated with oil to facilitate the subsequent process of recovering the oil from the water, chemical engineering,"1983, Improved Oil Recovery, page 203:A preslug of brine solution is often used to condition the reservoir by displacing the reservoir brine. 1991, P. H. Ogden, Chemicals in the oil industry: developments and applications, page 36:Usually preslugs were injected to realize optimum salinity in the reservoir and also to control cation exchange. 2013, James Sheng, Enhanced Oil Recovery Field Case Studies, ISBN, page 270:In the first preslug, the foaming concentration was 1.5% and the polymer was 1800ppm.",False,False,False,False,False,False,False,False,False,False,False,False,False,False,False,False,False,False,False,False,False,,False,,False,,False,,False,,False,,False,False,False,True,False,False,False,False
64831,priming,Noun,A substance used as a primer.,,,False,False,False,False,False,False,False,False,False,False,False,False,False,False,False,False,False,False,False,False,False,,False,,False,,False,,False,,False,,False,False,False,True,False,False,False,False
68234,prohormone,Noun,"A substance that is a precursor to a hormone, usually having minimal hormonal effect by itself.", biochemistry,,False,False,False,False,False,False,False,False,False,False,False,False,False,False,False,False,False,False,False,False,False,,False,,False,,False,,False,,False,,False,False,False,True,False,False,False,False
74061,pseudocrystal,Noun,"A substance that appears to be crystalline, even under a microscope, but does not have a true crystalline diffraction pattern.",,,False,False,False,False,False,False,False,False,False,False,False,False,False,False,False,False,False,False,False,False,False,,False,,False,,False,,False,,False,,False,False,False,True,False,False,False,False
76247,ptarmic,Noun,"A substance, such as pepper or snuff, that causes sneezing.",,,False,False,False,False,False,False,False,False,False,False,False,False,False,False,False,False,False,False,False,False,False,,False,,False,,False,,False,,False,,False,False,False,True,False,False,False,False
79894,purree,Noun,A substance used in making the pigment Indian yellow.,,,False,False,False,False,False,False,False,False,False,False,False,False,False,False,False,False,False,False,False,False,False,,False,,False,,False,,False,,False,,False,False,False,True,False,False,False,False
82356,pyrophorus,Noun,"a substance capable of taking fire spontaneously on exposure to the air, especially in a finely divided state",,,False,False,False,False,False,False,False,False,False,False,False,False,False,False,False,False,False,False,False,False,False,,False,,False,,False,,False,,False,,False,False,False,True,False,False,False,False
3993,nauseant,Noun,A substance that induces nausea., medicine,,False,False,False,False,False,False,False,False,False,False,False,False,False,False,False,False,False,False,False,False,False,,False,,False,,False,,False,,False,,False,False,False,True,False,False,False,False
9352,neuromodulator,Noun,"A substance other than a neurotransmitter, released by a neuron at a synapse and conveying information to adjacent or distant neurons, either enhancing or dampening their activities.", neuroscience,,False,False,False,False,False,False,False,False,False,False,False,False,False,False,False,False,False,False,False,False,False,,False,,False,,False,,False,,False,,False,False,False,True,False,False,False,False
13932,nocebo,Noun,"A substance which a patient experiences as harmful due to a previous negative perception, but which is in fact pharmacologically (medicinally) inactive"," pharmacology, also attributive","[from 1961] 1961 September, Walter P. Kennedy, The Nocebo Reaction, in Medical World, volume 95, London: Medical Practitioners' Union, ISSN 0025-7621, OCLC 714999966, PMID 13752532, page 203:It is somewhat surprising that little attention has been drawn to the existence of the contrary effect [to the placebo] which I may call the nocebo reaction. 2009 April 25, Stuart Blackman, Why health warnings can be bad, in Financial Times:In the case of the nocebo, it is negative expectations that become self-fulfilling prophecies. 2014 May 15, Jennifer Welsh, Researchers who Provided Key Evidence for Gluten Sensitivity have now Thoroughly Shown that It Doesnt Exist, in Business Insider[1], archived from the original on 2 July 2017:It seems to be a ""nocebo"" effect the self-diagnosed gluten sensitive patients expected to feel worse on the study diets, so they did.",False,False,False,False,False,False,False,False,False,False,False,False,False,False,False,False,False,False,False,False,False,,False,,False,,False,,False,,False,,False,False,False,True,False,False,False,False
15457,nonabrasive,Noun,A substance that is not abrasive.,,,False,False,False,False,False,False,False,False,False,False,False,False,False,False,False,False,False,False,False,False,False,,False,,False,,False,,False,,False,,False,False,False,True,False,False,False,False
15540,nonacid,Noun,A substance that is not an acid.,,,False,False,False,False,False,False,False,False,False,False,False,False,False,False,False,False,False,False,False,False,False,,False,,False,,False,,False,,False,,False,False,False,True,False,False,False,False
16055,nonantibiotic,Noun,A substance that is not an antibiotic.,,,False,False,False,False,False,False,False,False,False,False,False,False,False,False,False,False,False,False,False,False,False,,False,,False,,False,,False,,False,,False,False,False,True,False,False,False,False
16423,nonbarbiturate,Noun,A substance that is not a barbiturate.,,,False,False,False,False,False,False,False,False,False,False,False,False,False,False,False,False,False,False,False,False,False,,False,,False,,False,,False,,False,,False,False,False,True,False,False,False,False
