Unnamed: 0,term,pos,definition,domain,supplementary_info,obsolete,slang,dated,rare,vulgar,offensive,slur,astrology,mythology,jargon,euphemistic,informal,humorous,literary,literature,childish,folklore,colloquial,nonstandard,theology,abbreviation,abbreviation_for_term,plural,plural_for_term,misspelling,misspelling_for_term,acronym,acronym_for_term,synonym,synonym_for_term,antonym,antonym_for_term,attribute,property,process,matter,role,measure
19734,perfluorobutanesulfonic acid,Noun,"A chemical compound with a four-carbon fluorocarbon chain and a sulfonic acid functional group, used as a replacement for the persistent, toxic, and bioaccumulative perfluorooctanesulfonic acid.", chemistry,,False,False,False,False,False,False,False,False,False,False,False,False,False,False,False,False,False,False,False,False,False,,False,,False,,False,,False,,False,,False,False,False,True,False,False
19771,perfluorotrihexylamine,Noun,"A chemical compound, C18F39N.",,,False,False,False,False,False,False,False,False,False,False,False,False,False,False,False,False,False,False,False,False,False,,False,,False,,False,,False,,False,,False,False,False,True,False,False
21014,periphyton,Noun,"A mixture of algae, cyanobacteria, heterotrophic microbes, and detritus that is attached to submerged surfaces in most aquatic ecosystems", ecology,"2009, January 30, R. S. Oremland et al., in (Please provide the book title or journal name)[1]:Indeed, the tight coupling of As(V) reduction/As(III) oxidation has been seen in periphyton samples and salt-saturated anoxic sediments from Searles Lake.",False,False,False,False,False,False,False,False,False,False,False,False,False,False,False,False,False,False,False,False,False,,False,,False,,False,,False,,False,,False,False,False,True,False,False
25300,phenanthrenemethanol,Noun,A chemical compound used to treat malaria., organic chemistry,,False,False,False,False,False,False,False,False,False,False,False,False,False,False,False,False,False,False,False,False,False,,False,,False,,False,,False,,False,,False,False,False,True,False,False
25564,phenosafranine,Noun,"The chemical compound C18H15ClN4, used in photography.", organic chemistry,,False,False,False,False,False,False,False,False,False,False,False,False,False,False,False,False,False,False,False,False,False,,False,,False,,False,,False,,False,,False,False,False,True,False,False
25652,phenylalanylanhydride,Noun,"A chemical compound, C18H18N2O2.",,,False,False,False,False,False,False,False,False,False,False,False,False,False,False,False,False,False,False,False,False,False,,False,,False,,False,,False,,False,,False,False,False,True,False,False
25777,phenylpiperazine,Noun,"A chemical compound featuring a phenyl group bound to a piperazine ring, many of whose derivatives are used as pharmaceuticals.", chemistry,,False,False,False,False,False,False,False,False,False,False,False,False,False,False,False,False,False,False,False,False,False,,False,,False,,False,,False,,False,,False,False,False,True,False,False
25779,phenylpiperidine,Noun,A chemical compound with a phenyl moiety directly attached to piperidine., chemistry,,False,False,False,False,False,False,False,False,False,False,False,False,False,False,False,False,False,False,False,False,False,,False,,False,,False,,False,,False,,False,False,False,True,False,False
27610,phosphoramidon,Noun,"A chemical compound derived from cultures of the bacterium Streptomyces tanashiensis, widely used as a biochemical tool.",,,False,False,False,False,False,False,False,False,False,False,False,False,False,False,False,False,False,False,False,False,False,,False,,False,,False,,False,,False,,False,False,False,True,False,False
30947,phytocomplex,Noun,A mixture of plant extracts (for a variety of purposes),,,False,False,False,False,False,False,False,False,False,False,False,False,False,False,False,False,False,False,False,False,False,,False,,False,,False,,False,,False,,False,False,False,True,False,False
30950,phytocompound,Noun,Any chemical compound of plant origin,,"2015 December 4, Wild Edible Fruit of Prunus nepalensis Ser. (Steud), a Potential Source of Antioxidants, Ameliorates Iron Overload-Induced Hepatotoxicity and Liver Fibrosis in Mice, in PLOS ONE[1], DOI:10.1371/journal.pone.0144280:Phytochemical screening also indicated the presence of several bioactive phytocompounds and natural antioxidants that are responsible for its overall activity.",False,False,False,False,False,False,False,False,False,False,False,False,False,False,False,False,False,False,False,False,False,,False,,False,,False,,False,,False,,False,False,False,True,False,False
34645,pine oil,Noun,"a mixture of monoterpene alcohols obtained from various species of Pinus, rich in -terpineol",,,False,False,False,False,False,False,False,False,False,False,False,False,False,False,False,False,False,False,False,False,False,,False,,False,,False,,False,,False,,False,False,False,True,False,False
34650,pine terpene,Noun,"A mixture of terpenoid hydrocarbons that is the principal component of essential oils obtained from various species of Pinus; it includes pinene, carene and menthadiene.", organic chemistry,,False,False,False,False,False,False,False,False,False,False,False,False,False,False,False,False,False,False,False,False,False,,False,,False,,False,,False,,False,,False,False,False,True,False,False
35689,piperonylonitrile,Noun,A chemical compound containing piperonyl linked to a nitrile functional group., organic chemistry,,False,False,False,False,False,False,False,False,False,False,False,False,False,False,False,False,False,False,False,False,False,,False,,False,,False,,False,,False,,False,False,False,True,False,False
36978,pituri,Noun,A mixture of wood ash and leaves chewed as a stimulant by Aboriginal Australians.,,,False,False,False,False,False,False,False,False,False,False,False,False,False,False,False,False,False,False,False,False,False,,False,,False,,False,,False,,False,,False,False,False,True,False,False
38919,plaster,Noun,"A mixture of lime or gypsum, sand, and water, sometimes with the addition of fibres, that hardens to a smooth solid and is used for coating walls and ceilings; render, stucco.", uncountable,,False,False,False,False,False,False,False,False,False,False,False,False,False,False,False,False,False,False,False,False,False,,False,,False,,False,,False,,False,,False,False,False,True,False,False
39080,plastifier,Noun,A chemical compound added to a polymer in order to produce a softer plastic material.,,,False,False,False,False,False,False,False,False,False,False,False,False,False,False,False,False,False,False,False,False,False,,False,,False,,False,,False,,False,,False,False,False,True,False,False
41369,ploc,Noun,A mixture of hair and tar for covering the bottom of a ship.," nautical, historical",,False,False,False,False,False,False,False,False,False,False,False,False,False,False,False,False,False,False,False,False,False,,False,,False,,False,,False,,False,,False,False,False,True,False,False
46043,polyblend,Noun,"A mixture of two or more polymers, especially of man-made fibres or recycled plastic.",,,False,False,False,False,False,False,False,False,False,False,False,False,False,False,False,False,False,False,False,False,False,,False,,False,,False,,False,,False,,False,False,False,True,False,False
46720,polyglot,Noun,A mixture of langages and/or nomenclatures,,,False,False,False,False,False,False,False,False,False,False,False,False,False,False,False,False,False,False,False,False,False,,False,,False,,False,,False,,False,,False,False,False,True,False,False
46971,polyinhalant,Noun,"A mixture of inhalants 2015 September 3, Patterns of Inhalant Use among Incarcerated Youth, in PLOS ONE[1], DOI:10.1371/journal.pone.0135303:The study revealed the following classes of inhalant use: (1) severe polyinhalant use; (2) moderate polyinhalant use; (3) gas and permanent marker use; and (4) low-use.",,,False,False,False,False,False,False,False,False,False,False,False,False,False,False,False,False,False,False,False,False,False,,False,,False,,False,,False,,False,,False,False,False,True,False,False
48457,pomander,Noun,"A mixture of aromatic substances, made into a ball and carried by a person to impart a sweet smell or as a protection against infection"," countable, uncountable, historical","[from late 15th c.] 1605, Christopher Wirtzung; Iacob Mosan, transl., Of the Nose, in The General Practise of Physicke:[], London: Impensis Georg[e] Bishop, OCLC 837735745, 8 (Enfeebled or Lost Smelling), page 102:Take red Storar, Nutmegs, Cucubes, Cloues, Nardus eed, Lignum Aloes, Indy Spica, and Cinamom, of each one drag. Mucus and Amber of each one cruple, Landanum one ounce, make a Pomander thereof, like as there be many decribed in the ixt part, and is alo taught how the ame is to be made. 1607, [attributed to Thomas Tomkis], Lingva: Or The Combat of the Tongue, and the Five Senses for Superiority. A Pleasant Comdie., London: Printed by G[eorge] Eld, for Simon Waterson, OCLC 52434902, Act IV, scene iii:Your onely way to make a good pomander, is this. Take an ownce of the puret garden mould, clened and teeped eauen daies in change of motherlee roe water, then take the bet Labdanum, Benioine, both Storaxes, amber greece, and Ciuet, and muke, incorporate them together, and work them into what form you pleae; this, if your breath bee not to valiant, will make you mell as weete as my Ladies dogge. c. 16101611, William Shakespeare, The VVinters Tale, in Mr. William Shakespeares Comedies, Histories, Tragedies: Published According to the True Originall Copies (First Folio), London: Printed by Isaac Iaggard, and Ed[ward] Blount, published 1623, OCLC 606515358, [Act IV, scene iii], page 296, columns 12:I have old all my Tromperie: not a counterfeit Stone, not a Ribbon, Glae, Pomander, Browch, Table-booke, Ballad, Knife, Tape, Gloue, Shooe-tye, Bracelet, Horne-Ring, to keepe my Pack from fating: []",False,False,False,False,False,False,False,False,False,False,False,False,False,False,False,False,False,False,False,False,False,,False,,False,,False,,False,,False,,False,False,False,True,False,False
49241,poolish,Noun,A mixture of flour and water with a little yeast; used to make some forms of dough,,"Synonyms: pre-ferment, sponge, bread starter 2003, Rose Levy Beranbaum, The Bread Bible, W. W. Norton Company (ISBN), page 35: In order to ensure a lower acidity, the ideal time to add the poolish to the dough is when it has matured. At this point it will have domed slightly and will be just beginning to deflate. A long poolish produces more interesting aromas and requires []",False,False,False,False,False,False,False,False,False,False,False,False,False,False,False,False,False,False,False,False,False,,False,,False,,False,,False,,False,,False,False,False,True,False,False
54521,potpourri,Noun,"A mixture of dried fragrant plant material, often in a decorative bowl, used to scent a room.",,,False,False,False,False,False,False,False,False,False,False,False,False,False,False,False,False,False,False,False,False,False,,False,,False,,False,,False,,False,,False,False,False,True,False,False
55107,powder,Noun,"A mixture of fine dry, sweet-smelling particles applied to the face or other body parts, to reduce shine or to alleviate chaffing", cosmetics,"1912, Willa Cather, The Bohemian Girl: She was redolent of violet sachet powder, and had warm, soft, white hands, but she danced divinely, moving as smoothly as the tide coming in.",False,False,False,False,False,False,False,False,False,False,False,False,False,False,False,False,False,False,False,False,False,,False,,False,,False,,False,,False,,False,False,False,True,False,False
69089,pronase,Noun,A mixture of proteinases isolated from the extracellular fluid of the bacterium Streptomyces griseus.,,,False,False,False,False,False,False,False,False,False,False,False,False,False,False,False,False,False,False,False,False,False,,False,,False,,False,,False,,False,,False,False,False,True,False,False
69338,proof spirit,Noun,A mixture of alcohol and water used as a standard for distilled drinks.,,,False,False,False,False,False,False,False,False,False,False,False,False,False,False,False,False,False,False,False,False,False,,False,,False,,False,,False,,False,,False,False,False,True,False,False
74327,pseudohalide,Noun,"A chemical compound that is not a halide, but which resembles a halide in its charge and reactivity.", chemistry,,False,False,False,False,False,False,False,False,False,False,False,False,False,False,False,False,False,False,False,False,False,,False,,False,,False,,False,,False,,False,False,False,True,False,False
77985,pulp,Noun,"A mixture of wood, cellulose and/or rags and water ground up to make paper.",,,False,False,False,False,False,False,False,False,False,False,False,False,False,False,False,False,False,False,False,False,False,,False,,False,,False,,False,,False,,False,False,False,True,False,False
81814,pyrathiazine,Noun,"A chemical compound, C18H20N2S.",,,False,False,False,False,False,False,False,False,False,False,False,False,False,False,False,False,False,False,False,False,False,,False,,False,,False,,False,,False,,False,False,False,True,False,False
82078,pyroboric acid,Noun,"The chemical compound H2B4O7, obtained by heating boric acid.", chemistry,,False,False,False,False,False,False,False,False,False,False,False,False,False,False,False,False,False,False,False,False,False,,False,,False,,False,,False,,False,,False,False,False,True,False,False
82515,pyroxylic spirit,Noun,"A mixture of acetone, methanol, methyl acetate, etc",,obtained by the destructive distillation of wood in the manufacture of pyroligneous acid.,False,False,False,False,False,False,False,False,False,False,False,False,False,False,False,False,False,False,False,False,False,,False,,False,,False,,False,,False,,False,False,False,True,False,False
1285,nanochemical,Noun,Any chemical compound associated with a nanomaterial, chemistry,,False,False,False,False,False,False,False,False,False,False,False,False,False,False,False,False,False,False,False,False,False,,False,,False,,False,,False,,False,,False,False,False,True,False,False
3726,natural gas,Noun,"A mixture of gaseous hydrocarbons associated with petroleum deposits; mostly methane with smaller amounts of ethane, propane and butane; principally used as a fuel.",,,False,False,False,False,False,False,False,False,False,False,False,False,False,False,False,False,False,False,False,False,False,,False,,False,,False,,False,,False,,False,False,False,True,False,False
7021,neopine,Noun,"A chemical compound, C18H21NO3.",,,False,False,False,False,False,False,False,False,False,False,False,False,False,False,False,False,False,False,False,False,False,,False,,False,,False,,False,,False,,False,False,False,True,False,False
7125,neoruscogenin,Noun,A chemical compound found in the rhizome of butcher's broom., organic chemistry,,False,False,False,False,False,False,False,False,False,False,False,False,False,False,False,False,False,False,False,False,False,,False,,False,,False,,False,,False,,False,False,False,True,False,False
12193,nigrosin,Noun,"A mixture of synthetic black dyes made by heating a mixture of nitrobenzene, aniline and aniline hydrochloride in the presence of a copper or iron catalyst; used for staining of bacteria and as a colorant.",,,False,False,False,False,False,False,False,False,False,False,False,False,False,False,False,False,False,False,False,False,False,,False,,False,,False,,False,,False,,False,False,False,True,False,False
12345,nimbidin,Noun,A mixture of tetranortriterpenes that is the bitter principle of neem,,,False,False,False,False,False,False,False,False,False,False,False,False,False,False,False,False,False,False,False,False,False,,False,,False,,False,,False,,False,,False,False,False,True,False,False
13122,nitroblue tetrazolium,Noun,"A chemical compound composed of two tetrazole moieties, used in immunology for detection of alkaline phosphatase.",,,False,False,False,False,False,False,False,False,False,False,False,False,False,False,False,False,False,False,False,False,False,,False,,False,,False,,False,,False,,False,False,False,True,False,False
13439,nitrox,Noun,"A mixture of nitrogen and oxygen, the nitrogen content being lower than what is normally present in air, which is used in place of air as a breathing gas", underwater diving,"1989 September, Abstract, in R. W. Hamilton, Dudley J. Crosson, and Alan W. Hulbert, editors, Workshop on Enriched Air Nitrox Diving (National Undersea Research Program Research Report; 89-1), Rockville, Md.: Office of Undersea Research, Oceanic and Atmosphere Research, National Oceanic and Atmospheric Administration, U.S. Department of Commerce, OCLC 20515583, page 1:""Enriched air"" or ""nitrox"" is a mixture of air and oxygen; the oxygen component ranges to about 50% but is used normally at 32 to 40%. [...] Safe enriched air nitrox diving practices established for the scientific diving community might be of some value and could help avoid accidents due to ignorance of its hazards and use of improper procedures. 1991 October, Appendix D: NOAA Nitrox I Diving and Decompression Tables, in NOAA Diving Manual: Diving for Science and Technology, Silver Spring, Md.: Office of Undersea Research, Oceanic and Atmosphere Research, National Oceanic and Atmospheric Administration, U.S. Department of Commerce, OCLC 645822629, page D-1:NOAA Nitrox I is a standard breathing gas mixture of 32% oxygen (1%); the balance of the gas (68%) is nitrogen. [...] High-pressure storage cylinders, scuba tanks, regulators, and all high-pressure gas transfer equipment that is used with pure oxygen or with nitrox mixtures that contain more than 40 percent oxygen must be cleaned and maintained for oxygen service. 2004, Michael B. Strauss; Igor V. Aksenov, Diving Science, Champaign, Ill.: Human Kinetics, ISBN, page 35:Is there a compromise between too much oxygen and too much inert gas? The answer is the use of enriched air nitrox (enriched air) mixtures in the SCUBA tank. The two most commonly used mixtures are 32 percent and 36 percent oxygen mixtures. [...] [T]he increased oxygen percentages make the diver using nitrox mixtures more subject to oxygen seizures. With nitrox mixtures, the relative increase in oxygen percentage is over three times the relative decrease in nitrogen percentage. 2016, Carl Edmonds; Michael Bennett; John Lippmann; Simon J. Mitchell, Technical Diving, in Diving and Subaquatic Medicine, 5th edition, Boca Raton, Fla.: CRC Press, ISBN, part 10 (Specialized Diving and Its Problems), page 705:[N]itrox is often referred to as enriched air or enriched air nitrox (EANx). By convention, the mix is described by reference to its oxygen content. Thus, if a nitrox mix contains 36 per cent oxygen, then it is referred to as nitrox 36 (Nx36) or EANx36. [...] [T]he nitrox diver can use the reduced absorption of nitrogen to increase allowable dive time by using the EAD to derive the no-decompression limit for the dive or as a basis for calculating decompression. This approach allows longer dives and shorter decompression.",False,False,False,False,False,False,False,False,False,False,False,False,False,False,False,False,False,False,False,False,False,,False,,False,,False,,False,,False,,False,False,False,True,False,False
15329,non-stoichiometric compound,Noun,Any chemical compound in which the number of atoms of each element is not expressible as the ratio of small integers; normally due to missing atoms in a solid state lattice., chemistry,,False,False,False,False,False,False,False,False,False,False,False,False,False,False,False,False,False,False,False,False,False,,False,,False,,False,,False,,False,,False,False,False,True,False,False
15840,nonalcohol,Noun,A chemical compound that is not an alcohol.,,,False,False,False,False,False,False,False,False,False,False,False,False,False,False,False,False,False,False,False,False,False,,False,,False,,False,,False,,False,,False,False,False,True,False,False
20374,nonhistone,Noun,A chemical compound that is not a histone.,,,False,False,False,False,False,False,False,False,False,False,False,False,False,False,False,False,False,False,False,False,False,,False,,False,,False,,False,,False,,False,False,False,True,False,False
26747,nordoxepin,Noun,"A chemical compound, C18H19NO.",,,False,False,False,False,False,False,False,False,False,False,False,False,False,False,False,False,False,False,False,False,False,,False,,False,,False,,False,,False,,False,False,False,True,False,False
1623,Liebermann reagent,Noun,"A mixture of potassium nitrite and concentrated sulfuric acid, used to test for cocaine, morphine, PMA and PMMA.",,,False,False,False,False,False,False,False,False,False,False,False,False,False,False,False,False,False,False,False,False,False,,False,,False,,False,,False,,False,,False,False,False,True,False,False
506,vaginol,Noun,"A chemical compound, with formula C14H14O5, whose glucoside is apterin.", organic chemistry,,False,False,False,False,False,False,False,False,False,False,False,False,False,False,False,False,False,False,False,False,False,,False,,False,,False,,False,,False,,False,False,False,True,False,False
786,valerene,Noun,A mixture of monoterpenes obtained from the essential oil or valerian, organic chemistry,,False,False,False,False,False,False,False,False,False,False,False,False,False,False,False,False,False,False,False,False,False,,False,,False,,False,,False,,False,,False,False,False,True,False,False
1629,vanillin,Noun,"A chemical compound, 4-hydroxy-3-methoxybenzaldehyde, that is the primary constituent of vanilla.",,,False,False,False,False,False,False,False,False,False,False,False,False,False,False,False,False,False,False,False,False,False,,False,,False,,False,,False,,False,,False,False,False,True,False,False
8275,vinylphenol,Noun,A chemical compound containing a ethenyl functional group attached to phenol., organic chemistry,,False,False,False,False,False,False,False,False,False,False,False,False,False,False,False,False,False,False,False,False,False,,False,,False,,False,,False,,False,,False,False,False,True,False,False
8412,violet red bile agar,Noun,"A mixture of agar with peptone, yeast extract, bile salts and crystal violet; it is used for enumerating coliform bacteria in dairy products",,,False,False,False,False,False,False,False,False,False,False,False,False,False,False,False,False,False,False,False,False,False,,False,,False,,False,,False,,False,,False,False,False,True,False,False
12167,vytorin,Noun,"A mixture of ezetimibe and simvastatin used to reduce blood colesterol 2015 August 5, P Iyngkaran, M Thomas, Bedsideto-Bench Translational Research for Chronic Heart Failure: Creating an Agenda for Clients Who Do Not Meet Trial Enrollment Criteria, in Clinical Medicine Insights", medicine,"Cardiology[1], volume 9, DOI:10.4137/CMC.S18737:Several recent publications have raised concerns for AKI in high potency station, particularly if there is a predisposition. 94 This coincides with the SHARP study that highlighted the safety and efficacy of simvastatin plus ezetimibe in ESRD. 67 Exploring a wider role for vytorin is a consideration to reduce high-dose statins in selected cases.",False,False,False,False,False,False,False,False,False,False,False,False,False,False,False,False,False,False,False,False,False,,False,,False,,False,,False,,False,,False,False,False,True,False,False
1320,caf au lait,Noun,A mixture of coffee and hot milk.,,,False,False,False,False,False,False,False,False,False,False,False,False,False,False,False,False,False,False,False,False,False,,False,,False,,False,,False,,False,,False,False,False,True,False,False
2012,calciprotein,Noun,A mixture of calcium salts and protein that is involved in mineralisation in the body,,,False,False,False,False,False,False,False,False,False,False,False,False,False,False,False,False,False,False,False,False,False,,False,,False,,False,,False,,False,,False,False,False,True,False,False
2083,calcium silicate,Noun,"The chemical compound Ca2SiO4, used in roads, insulation, bricks, cements, etc",,and as an antacid and anticaking agent.,False,False,False,False,False,False,False,False,False,False,False,False,False,False,False,False,False,False,False,False,False,,False,,False,,False,,False,,False,,False,False,False,True,False,False
4364,camsal,Noun,A mixture of camphor and salol.,,,False,False,False,False,False,False,False,False,False,False,False,False,False,False,False,False,False,False,False,False,False,,False,,False,,False,,False,,False,,False,False,False,True,False,False
5302,canned air,Noun,"A mixture of gases supplied in a spray can, used for cleaning electronic equipment etc.",,,False,False,False,False,False,False,False,False,False,False,False,False,False,False,False,False,False,False,False,False,False,,False,,False,,False,,False,,False,,False,False,False,True,False,False
6905,capsaicin,Noun,"A chemical compound found in chilli peppers, which is responsible for their pungent flavor.", organic chemistry,,False,False,False,False,False,False,False,False,False,False,False,False,False,False,False,False,False,False,False,False,False,,False,,False,,False,,False,,False,,False,False,False,True,False,False
7853,carbogen,Noun,A mixture of carbon dioxide and oxygen gas.,,,False,False,False,False,False,False,False,False,False,False,False,False,False,False,False,False,False,False,False,False,False,,False,,False,,False,,False,,False,,False,False,False,True,False,False
8250,carbovir,Noun,A chemical compound containing hydroxymethyl cyclopentene bound to guanosine which is active against some viruses, organic chemistry,"IUPAC name is 2-amino-9-[(1R,4S)-4-(hydroxymethyl)cyclopent-2-en-1-yl]-3H-purin-6-one",False,False,False,False,False,False,False,False,False,False,False,False,False,False,False,False,False,False,False,False,False,,False,,False,,False,,False,,False,,False,False,False,True,False,False
