Unnamed: 0,term,pos,definition,domain,supplementary_info,obsolete,slang,dated,rare,vulgar,offensive,slur,astrology,mythology,jargon,euphemistic,informal,humorous,literary,literature,childish,folklore,colloquial,nonstandard,theology,abbreviation,abbreviation_for_term,plural,plural_for_term,misspelling,misspelling_for_term,acronym,acronym_for_term,synonym,synonym_for_term,antonym,antonym_for_term,attribute,property,process,matter,role,measure
45721,slush,Noun,"A mixture of white lead and lime, used as a paint to prevent oxidation.", engineering,,False,False,False,False,False,False,False,False,False,False,False,False,False,False,False,False,False,False,False,False,False,,False,,False,,False,,False,,False,,False,False,False,True,False,False
47956,snakebite,Noun,A mixture of cider and lager., uncountable,,False,False,False,False,False,False,False,False,False,False,False,False,False,False,False,False,False,False,False,False,False,,False,,False,,False,,False,,False,,False,False,False,True,False,False
51294,soda-lime,Noun,A mixture of caustic soda and quicklime.,,,False,False,False,False,False,False,False,False,False,False,False,False,False,False,False,False,False,False,False,False,False,,False,,False,,False,,False,,False,,False,False,False,True,False,False
51452,sodium cocoate,Noun,"A mixture of fatty acid salts of coconut oil, used in soapmaking.",,,False,False,False,False,False,False,False,False,False,False,False,False,False,False,False,False,False,False,False,False,False,,False,,False,,False,,False,,False,,False,False,False,True,False,False
51453,sodium diphenylphosphide,Noun,A chemical compound with the formula Ph2PNa, chemistry,"2003, W. L. F. Armarego, Purification of Laboratory Chemicals, Butterworth-Heinemann, page 536 Sodium diphenylphosphide (Ph2PNa) is readily prepared by adding Na to a solution of the diphosphine in dry Et2O or THF (exothermic!), whereby the colour becomes yellow and the orange Na salt separates.",False,False,False,False,False,False,False,False,False,False,False,False,False,False,False,False,False,False,False,False,False,,False,,False,,False,,False,,False,,False,False,False,True,False,False
51496,sodium tartrate,Noun,"The chemical compound Na2C4H4O6, used as an emulsifier and binding agent in foods such as jellies, margarine, and sausage casings.",,,False,False,False,False,False,False,False,False,False,False,False,False,False,False,False,False,False,False,False,False,False,,False,,False,,False,,False,,False,,False,False,False,True,False,False
51580,soffritto,Noun,"Sauted mixture of chopped onions, carrots and celery, used as the beginning point of a dish", cooking,"May also contain garlic, shallot, and leek.",False,False,False,False,False,False,False,False,False,False,False,False,False,False,False,False,False,False,False,False,False,,False,,False,,False,,False,,False,,False,False,False,True,False,False
52042,soil,Noun,"A mixture of sand and organic material, used to support plant growth.", uncountable,,False,False,False,False,False,False,False,False,False,False,False,False,False,False,False,False,False,False,False,False,False,,False,,False,,False,,False,,False,,False,False,False,True,False,False
52758,solid compound,Noun,A chemical compound that is solid.,,,False,False,False,False,False,False,False,False,False,False,False,False,False,False,False,False,False,False,False,False,False,,False,,False,,False,,False,,False,,False,False,False,True,False,False
55488,soup,Noun,Any mixture or substance suggestive of soup consistency, figuratively,"(slang) Thick fog or cloud (also pea soup). (US, slang) Nitroglycerin or gelignite, especially when used for safe-cracking. (cant) Dope (illicit drug, used for making horses run faster or to change their personality). (photography) Processing chemicals into which film is dipped, such as developer. (biology) Liquid or gelatinous substrate, especially the mixture of organic compounds that is believe to have played a role in the origin of life on Earth. primordial soup (Britain, informal, often with ""the"") An unfortunate situation; trouble, problems (a fix, a mess); chaos. 1960, P. G. Wodehouse, Jeeves in the Offing, chapter I and X:B. Wickham had also the disposition and general outlook on life of a ticking bomb. In her society you always had the uneasy feeling that something was likely to go off at any moment with a pop. You never knew what she was going to do next or into what murky depths of soup she would carelessly plunge you. [...] It may be fun for her, I said with one of my bitter laughs, but it isn't so diverting for the unfortunate toads beneath the harrow whom she plunges so ruthlessly in the soup. (surfing) The foamy portion of a wave.",False,False,False,False,False,False,False,False,False,False,False,False,False,False,False,False,False,False,False,False,False,,False,,False,,False,,False,,False,,False,False,False,True,False,False
57501,sparsomycin,Noun,"A chemical compound, initially discovered as a metabolite of the fungus Streptomyces sparsogenes, that inhibits protein synthesis.",,,False,False,False,False,False,False,False,False,False,False,False,False,False,False,False,False,False,False,False,False,False,,False,,False,,False,,False,,False,,False,False,False,True,False,False
57523,spartioidine,Noun,"A chemical compound, C18H23NO5.",,,False,False,False,False,False,False,False,False,False,False,False,False,False,False,False,False,False,False,False,False,False,,False,,False,,False,,False,,False,,False,False,False,True,False,False
58893,speculum metal,Noun,A mixture of around two-thirds copper and one-third tin making a white brittle alloy that can be polished into a highly reflective surface.,,,False,False,False,False,False,False,False,False,False,False,False,False,False,False,False,False,False,False,False,False,False,,False,,False,,False,,False,,False,,False,False,False,True,False,False
64450,spout,Noun,The mixture of air and water thrown up from the blowhole of a whale.,,,False,False,False,False,False,False,False,False,False,False,False,False,False,False,False,False,False,False,False,False,False,,False,,False,,False,,False,,False,,False,False,False,True,False,False
64614,spray tan,Noun,The mixture itself.,,,False,False,False,False,False,False,False,False,False,False,False,False,False,False,False,False,False,False,False,False,False,,False,,False,,False,,False,,False,,False,False,False,True,False,False
67567,staff,Noun,A mixture of plaster and fibre used as a temporary exterior wall covering.W, uncountable,,False,False,False,False,False,False,False,False,False,False,False,False,False,False,False,False,False,False,False,False,False,,False,,False,,False,,False,,False,,False,False,False,True,False,False
72380,stepholidine,Noun,"A chemical compound with antipsychotic activity, found in the herb Stephania intermedia.",,,False,False,False,False,False,False,False,False,False,False,False,False,False,False,False,False,False,False,False,False,False,,False,,False,,False,,False,,False,,False,False,False,True,False,False
73142,steroid,Noun,Any chemical compound used to enhance athletic performance.," sports, US",,False,False,False,False,False,False,False,False,False,False,False,False,False,False,False,False,False,False,False,False,False,,False,,False,,False,,False,,False,,False,False,False,True,False,False
73787,sticky foam,Noun,"A mixture of highly tacky and/or tenacious materials, carried in compressed form with a propellant and used as an incapacitant.",,,False,False,False,False,False,False,False,False,False,False,False,False,False,False,False,False,False,False,False,False,False,,False,,False,,False,,False,,False,,False,False,False,True,False,False
75556,stone-paste,Noun,A mixture of clay and frit used to create ceramics,,"1997, Ian Freestone David R. M. Gaimster, POTTERY IN THE MAKING PB, page 114:Akin to European soft-paste porcelain, this material, known as fritware or stone-paste, is described in the fourtheenth-century treatise of Ahu'l Qasim as consisting of ten parts ground quartz, one part ground glass and one part fine white clay. 2004, Rose Kerr, Joseph Needham Nigel Wood, Science and Civilisation in China: Volume 5, Chemistry and Chemical Technology, ISBN:Mason and Tite propse that Islamic stone-paste material may have been developed by migrant Iraqi potters in Egypt in the +10th to +11th centuries, after some initial experiments with adding powdered glass to clay bodies in Iraq in the +9th century. 2009, Erinn Corson, Successful Strategies for Teaching World Geography, ISBN, page 78:Later tiles were made from a compound called stone-pastea mixture of ground quartz, glaze frit, and white clay.",False,False,False,False,False,False,False,False,False,False,False,False,False,False,False,False,False,False,False,False,False,,False,,False,,False,,False,,False,,False,False,False,True,False,False
80758,stuffing,Noun,A mixture of oil and tallow used in softening and dressing leather.,,,False,False,False,False,False,False,False,False,False,False,False,False,False,False,False,False,False,False,False,False,False,,False,,False,,False,,False,,False,,False,False,False,True,False,False
84470,submixture,Noun,A mixture of elements that will itself be mixed with other elements.,,,False,False,False,False,False,False,False,False,False,False,False,False,False,False,False,False,False,False,False,False,False,,False,,False,,False,,False,,False,,False,False,False,True,False,False
87317,sucroglyceride,Noun,Any mixture of sucrose esters of fatty acids and glycerides., chemistry,,False,False,False,False,False,False,False,False,False,False,False,False,False,False,False,False,False,False,False,False,False,,False,,False,,False,,False,,False,,False,False,False,True,False,False
88691,sulfonphthalein,Noun,"Any chemical compound, analogous to a phthalein, formed by the condensation of o-sulfobenzoic acid with a phenol.", chemistry,,False,False,False,False,False,False,False,False,False,False,False,False,False,False,False,False,False,False,False,False,False,,False,,False,,False,,False,,False,,False,False,False,True,False,False
97939,swill,Noun,A mixture of solid and liquid food scraps fed to pigs etc; especially kitchen waste for this purpose, collective,"Synonyms: hogwash, slops",False,False,False,False,False,False,False,False,False,False,False,False,False,False,False,False,False,False,False,False,False,,False,,False,,False,,False,,False,,False,False,False,True,False,False
100555,synergist,Noun,A chemical compound that increases the chemical activity of another compound when used with it.," chemistry, by extension",,False,False,False,False,False,False,False,False,False,False,False,False,False,False,False,False,False,False,False,False,False,,False,,False,,False,,False,,False,,False,False,False,True,False,False
5114,fat lute,Noun,A mixture of pipeclay and oil for filling joints.,,,False,False,False,False,False,False,False,False,False,False,False,False,False,False,False,False,False,False,False,False,False,,False,,False,,False,,False,,False,,False,False,False,True,False,False
8532,ferric oxide,Noun,"The chemical compound Fe2O3, iron oxide where iron has a valence of +3", chemistry,IUPAC has deprecated this term in favor of iron(III) oxide.,False,False,False,False,False,False,False,False,False,False,False,False,False,False,False,False,False,False,False,False,False,,False,,False,,False,,False,,False,,False,False,False,True,False,False
8830,ferrous oxide,Noun,"The chemical compound FeO, iron oxide where iron has a valence of +2", chemistry,IUPAC has deprecated this term in favor of iron(II) oxide.,False,False,False,False,False,False,False,False,False,False,False,False,False,False,False,False,False,False,False,False,False,,False,,False,,False,,False,,False,,False,False,False,True,False,False
8954,fertilizer,Noun,A chemical compound created to have the same effect.,,,False,False,False,False,False,False,False,False,False,False,False,False,False,False,False,False,False,False,False,False,False,,False,,False,,False,,False,,False,,False,False,False,True,False,False
9407,fettling,Noun,"A mixture of ore, cinders, etc., used to line the hearth of a puddling furnace.", Britain,,False,False,False,False,False,False,False,False,False,False,False,False,False,False,False,False,False,False,False,False,False,,False,,False,,False,,False,,False,,False,False,False,True,False,False
11228,figuration,Noun,Mixture of concords and discords.,,,False,False,False,False,False,False,False,False,False,False,False,False,False,False,False,False,False,False,False,False,False,,False,,False,,False,,False,,False,,False,False,False,True,False,False
11574,filenadol,Noun,A chemical compound with antipain properties.,,,False,False,False,False,False,False,False,False,False,False,False,False,False,False,False,False,False,False,False,False,False,,False,,False,,False,,False,,False,,False,False,False,True,False,False
14829,fishcake,Noun,"A mixture of flaked fish, mashed potato and seasoning made into a patty and shallow fried",,"1922, Michael Arlen, 1/1/2, in Piracy: A Romantic Chronicle of These Days[1]:There were rumours, new rumours every morning, delightful and outrageous rumours, so that the lumps in the porridge were swallowed without comment and the fish-cakes were eaten without contumely.",False,False,False,False,False,False,False,False,False,False,False,False,False,False,False,False,False,False,False,False,False,,False,,False,,False,,False,,False,,False,False,False,True,False,False
18091,fleetings,Noun,A mixture of buttermilk and boiling whey; curds," Britain, dialectal",(Can we find and add a quotation of Wright to this entry?),False,False,False,False,False,False,False,False,False,False,False,False,False,False,False,False,False,False,False,False,False,,False,,False,,False,,False,,False,,False,False,False,True,False,False
21094,fluorochemical,Noun,Any chemical compound (especially an organic compound) containing fluorine,,,False,False,False,False,False,False,False,False,False,False,False,False,False,False,False,False,False,False,False,False,False,,False,,False,,False,,False,,False,,False,False,False,True,False,False
21334,fluorotriphenylsilane,Noun,"A chemical compound, C18H15FSi.",,,False,False,False,False,False,False,False,False,False,False,False,False,False,False,False,False,False,False,False,False,False,,False,,False,,False,,False,,False,,False,False,False,True,False,False
27390,formylmethanofuran,Noun,A chemical compound formed from methanofuran during an early stage of methanogenesis., organic chemistry,,False,False,False,False,False,False,False,False,False,False,False,False,False,False,False,False,False,False,False,False,False,,False,,False,,False,,False,,False,,False,False,False,True,False,False
31297,freezing mixture,Noun,"A mixture, as of pounded ice and salt, producing cold sufficient to freeze a liquid by the rapid absorption of heat.",,,False,False,False,False,False,False,False,False,False,False,False,False,False,False,False,False,False,False,False,False,False,,False,,False,,False,,False,,False,,False,False,False,True,False,False
33600,fructosamine,Noun,A chemical compound that can be considered the result of a reaction between fructose and ammonia or an amine (with a molecule of water being released)., organic chemistry,,False,False,False,False,False,False,False,False,False,False,False,False,False,False,False,False,False,False,False,False,False,,False,,False,,False,,False,,False,,False,False,False,True,False,False
33693,fruit cocktail,Noun,"a mixture of chopped fruit served as an appetizer, often chilled; tends to be less sweet than a fruit salad",,,False,False,False,False,False,False,False,False,False,False,False,False,False,False,False,False,False,False,False,False,False,,False,,False,,False,,False,,False,,False,False,False,True,False,False
33725,fruit salad,Noun,"A mixture of freshly cut fruit, sometimes with the addition of alcohol or yogurt, often served as a dessert.",,,False,False,False,False,False,False,False,False,False,False,False,False,False,False,False,False,False,False,False,False,False,,False,,False,,False,,False,,False,,False,False,False,True,False,False
36410,furanochromone,Noun,"A chemical compound that is a derivative of chromone (1,4-benzopyrone) and furan.",,,False,False,False,False,False,False,False,False,False,False,False,False,False,False,False,False,False,False,False,False,False,,False,,False,,False,,False,,False,,False,False,False,True,False,False
36942,fusel oil,Noun,A mixture of several higher-order alcohols (alcohols with more than two carbon atoms) formed as byproduct in the normal fermentation process,,"An excessive concentration, as in low-quality moonshine, causes unpleasant taste. 2006, Thomas Pynchon, Against the Day, Vintage 2007, p. 849: many simply blamed [] the Doosra's known enthusiasms for opium, ganja, and any number of local fusel oils, singly or combined, named and nameless.",False,False,False,False,False,False,False,False,False,False,False,False,False,False,False,False,False,False,False,False,False,,False,,False,,False,,False,,False,,False,False,False,True,False,False
1823,Saudi champagne,Noun,A mixture of soda water and apple juice.,,,False,False,False,False,False,False,False,False,False,False,False,False,False,False,False,False,False,False,False,False,False,,False,,False,,False,,False,,False,,False,False,False,True,False,False
211,macassar oil,Noun,"A mixture, once used to smooth the hair, consisting of oil of the ylang ylang tree and other oils.",,,False,False,False,False,False,False,False,False,False,False,False,False,False,False,False,False,False,False,False,False,False,,False,,False,,False,,False,,False,,False,False,False,True,False,False
248,macedoine,Noun,A mixture of diced vegetables or fruit served as a salad.,,,False,False,False,False,False,False,False,False,False,False,False,False,False,False,False,False,False,False,False,False,False,,False,,False,,False,,False,,False,,False,False,False,True,False,False
2345,magic mud,Noun,a mixture of refractory materials used in casting metal,,,False,False,False,False,False,False,False,False,False,False,False,False,False,False,False,False,False,False,False,False,False,,False,,False,,False,,False,,False,,False,False,False,True,False,False
5433,maleylacetoacetic acid,Noun,A chemical compound formed from the oxidation of homogentisic acid oxidase and isomerized into fumarylacetoacetic acid., organic chemistry,,False,False,False,False,False,False,False,False,False,False,False,False,False,False,False,False,False,False,False,False,False,,False,,False,,False,,False,,False,,False,False,False,True,False,False
10993,mash,Noun,A mixture of meal or bran and water fed to animals.,,,False,False,False,False,False,False,False,False,False,False,False,False,False,False,False,False,False,False,False,False,False,,False,,False,,False,,False,,False,,False,False,False,True,False,False
11164,maslin,Noun,A mixture composed of different materials; especially: A mixture of metals resembling brass,,"A mixture of different sorts of grain, such as wheat and rye.",False,False,False,False,False,False,False,False,False,False,False,False,False,False,False,False,False,False,False,False,False,,False,,False,,False,,False,,False,,False,False,False,True,False,False
17015,melado,Noun,a mixture of sugar and molasses; crude sugar as it comes from the pans without being drained,,,False,False,False,False,False,False,False,False,False,False,False,False,False,False,False,False,False,False,False,False,False,,False,,False,,False,,False,,False,,False,False,False,True,False,False
17091,melange,Noun,A mixture of different things; a disordered mixture,,The room was a melange of comic books and posters.,False,False,False,False,False,False,False,False,False,False,False,False,False,False,False,False,False,False,False,False,False,,False,,False,,False,,False,,False,,False,False,False,True,False,False
17354,melicopicine,Noun,"A chemical compound, C18H19NO5.",,,False,False,False,False,False,False,False,False,False,False,False,False,False,False,False,False,False,False,False,False,False,,False,,False,,False,,False,,False,,False,False,False,True,False,False
18338,menazon,Noun,A chemical compound (C6H12N5O2PS2) used as an organophosphate insecticide., chemistry,,False,False,False,False,False,False,False,False,False,False,False,False,False,False,False,False,False,False,False,False,False,,False,,False,,False,,False,,False,,False,False,False,True,False,False
18651,menstrual fluid,Noun,The mixture of blood and cellular debris from the uterus that constitutes the menses,,,False,False,False,False,False,False,False,False,False,False,False,False,False,False,False,False,False,False,False,False,False,,False,,False,,False,,False,,False,,False,False,False,True,False,False
19271,mercurial,Noun,A chemical compound containing mercury., chemistry,,False,False,False,False,False,False,False,False,False,False,False,False,False,False,False,False,False,False,False,False,False,,False,,False,,False,,False,,False,,False,False,False,True,False,False
19532,meringue,Noun,A mixture consisting of beaten egg whites and sugar which is added to the tops of pies then browned,,The key to a good baked Alaska is the meringue topping.,False,False,False,False,False,False,False,False,False,False,False,False,False,False,False,False,False,False,False,False,False,,False,,False,,False,,False,,False,,False,False,False,True,False,False
19995,mesclun,Noun,"A mixture of small, young leaves as a salad",,,False,False,False,False,False,False,False,False,False,False,False,False,False,False,False,False,False,False,False,False,False,,False,,False,,False,,False,,False,,False,False,False,True,False,False
23174,methacarn,Noun,"A mixture of methanol, chloroform and acetic acid used as a fixative 2015 July 30, Marina G", cytology,"Gobbo et al., Influence of Melatonin on the Proliferative and Apoptotic Responses of the Prostate under Normal and Hyperglycemic Conditions, in Journal of Diabetes Research[1], volume 2015, DOI:10.1155/2015/538529:Fragments of ventral prostate were fixed by immersion in 4% formaldehyde freshly prepared in phosphate buffer pH 7.2 and methacarn (1:3:6 of acetic acid, chloroform, and methanol) and embedded in Paraplast.",False,False,False,False,False,False,False,False,False,False,False,False,False,False,False,False,False,False,False,False,False,,False,,False,,False,,False,,False,,False,False,False,True,False,False
23240,methanethiosulfonate,Noun,A chemical compound with molecular formula C10H18NO3S2, chemistry,,False,False,False,False,False,False,False,False,False,False,False,False,False,False,False,False,False,False,False,False,False,,False,,False,,False,,False,,False,,False,False,False,True,False,False
23529,methoxypromazine,Noun,"A chemical compound, C18H22N2OS.",,,False,False,False,False,False,False,False,False,False,False,False,False,False,False,False,False,False,False,False,False,False,,False,,False,,False,,False,,False,,False,False,False,True,False,False
23566,methyl methyacrylate,Noun,"A chemical compound C5O2H8, mostly used as a monomer for the production of the transparent plastic polymethyl methacrylate (PMMA).", chemistry,,False,False,False,False,False,False,False,False,False,False,False,False,False,False,False,False,False,False,False,False,False,,False,,False,,False,,False,,False,,False,False,False,True,False,False
31115,mincemeat,Noun,"A mixture of fruit, spices and sugar used as a filling for mince pies",,"2002 March 20, Kazuki Takahashi, Yu-Gi-Oh! Forbidden Memories (PlayStation video game, North American version), Konami:Weevil Underwood: My army of insects will make mincemeat out of you!",False,False,False,False,False,False,False,False,False,False,False,False,False,False,False,False,False,False,False,False,False,,False,,False,,False,,False,,False,,False,False,False,True,False,False
31423,mineral oil,Noun,"Any mixture of aliphatic and alicyclic hydrocarbons derived from petroleum used for very many applications, but not as a fuel.",,,False,False,False,False,False,False,False,False,False,False,False,False,False,False,False,False,False,False,False,False,False,,False,,False,,False,,False,,False,,False,False,False,True,False,False
31532,ming,Noun,Mixture.,,,False,False,False,False,False,False,False,False,False,False,False,False,False,False,False,False,False,False,False,False,False,,False,,False,,False,,False,,False,,False,False,False,True,False,False
31573,mingling,Noun,A mixture; a blending.,,,False,False,False,False,False,False,False,False,False,False,False,False,False,False,False,False,False,False,False,False,False,,False,,False,,False,,False,,False,,False,False,False,True,False,False
33156,mirepoix,Noun,"mixture 2016 december, Adam Chandler, What If Consumers Just Want to Buy Junk Food?, in The Atlantic[4]:To this mirepoix of contradictory news, add another Pew survey from earlier this month, which found that 54 percent of respondents said they believe that Americans are seeking out more-healthy food than they did 20 years agoeven though they are eating less healthfully than they did in that same timeframe.", figuratively,,False,False,False,False,False,False,False,False,False,False,False,False,False,False,False,False,False,False,False,False,False,,False,,False,,False,,False,,False,,False,False,False,True,False,False
33888,miscellane,Noun,A mixture of two or more sorts of grain; maslin; meslin,,(Can we find and add a quotation of Francis Bacon to this entry?),False,False,False,False,False,False,False,False,False,False,False,False,False,False,False,False,False,False,False,False,False,,False,,False,,False,,False,,False,,False,False,False,True,False,False
