Unnamed: 0,term,pos,definition,domain,supplementary_info,obsolete,slang,dated,rare,vulgar,offensive,slur,astrology,mythology,jargon,euphemistic,informal,humorous,literary,literature,childish,folklore,colloquial,nonstandard,theology,abbreviation,abbreviation_for_term,plural,plural_for_term,misspelling,misspelling_for_term,acronym,acronym_for_term,synonym,synonym_for_term,antonym,antonym_for_term,attribute,property,process,matter,role,measure
11250,case-shot,Noun,"A mixture of stones and old iron, put into a wooden case and fired from a cannon as an anti-personnel weapon.", nautical,,False,False,False,False,False,False,False,False,False,False,False,False,False,False,False,False,False,False,False,False,False,,False,,False,,False,,False,,False,,False,False,False,True,False,False
14227,caulerpicin,Noun,A mixture of toxic ceramides present in green alga of the genus Caulerpa, organic chemistry,,False,False,False,False,False,False,False,False,False,False,False,False,False,False,False,False,False,False,False,False,False,,False,,False,,False,,False,,False,,False,False,False,True,False,False
17658,ceroma,Noun,A mixture of oil and wax.,,,False,False,False,False,False,False,False,False,False,False,False,False,False,False,False,False,False,False,False,False,False,,False,,False,,False,,False,,False,,False,False,False,True,False,False
18091,cetostearyl,Noun,"A mixture of cetyl and stearyl 2015 August 18, Michael Gebrehiwot et al., Evaluation of the wound healing property of Commiphora guidottii Chiov",,"ex. Guid., in BMC Complementary and Alternative Medicine[1], volume 15, DOI:10.1186/s12906-015-0813-2:Simple ointment base was prepared according to the British Pharmacopoeia [ 24 ] using hard paraffin, cetostearyl alcohol, white soft paraffin and wool fat.",False,False,False,False,False,False,False,False,False,False,False,False,False,False,False,False,False,False,False,False,False,,False,,False,,False,,False,,False,,False,False,False,True,False,False
22867,chemical clock,Noun,"Any mixture of compounds whose relative concentrations oscillate, and in which such change is marked by a visible rhythmic change in colour.", chemistry,,False,False,False,False,False,False,False,False,False,False,False,False,False,False,False,False,False,False,False,False,False,,False,,False,,False,,False,,False,,False,False,False,True,False,False
25999,chippie sauce,Noun,"A mixture of spirit vinegar and brown sauce, used as a condiment for chips.", Britain,,False,False,False,False,False,False,False,False,False,False,False,False,False,False,False,False,False,False,False,False,False,,False,,False,,False,,False,,False,,False,False,False,True,False,False
26971,chlorohydrate,Noun,A chemical compound having the general formula [] Cl(3n-m)(OH)m., inorganic chemistry,,False,False,False,False,False,False,False,False,False,False,False,False,False,False,False,False,False,False,False,False,False,,False,,False,,False,,False,,False,,False,False,False,True,False,False
27015,chloromethylsulfonyl,Noun,A chemical compound with the formula CH2ClO2S, chemistry,"2012, Ulrich Schirmer, Peter Jeschke, Matthias Witschel, Modern Crop Protection Compounds: Herbicides, Volume 1, John Wiley Sons, page 134 Further, compound 21, which was synthesized by substituting the methylsulfonyl group with a chloromethylsulfonyl group, showed a marked increase in herbicidal activity []",False,False,False,False,False,False,False,False,False,False,False,False,False,False,False,False,False,False,False,False,False,,False,,False,,False,,False,,False,,False,False,False,True,False,False
29086,chrism,Noun,"A mixture of oil and balm, consecrated for use as an anointing fluid in certain Christian ceremonies, especially confirmation",,"1982, A. G. Dickens, Reformation Studies, page 305, footnote, I observe no confirmation of this reversal and Pole specifically restored chrisms in 1555 (Cardwell, op. cit. i. 147). 1984, Anthony Burgess, Enderby's Dark Lady:The King, Will cried, is my master and bathed in the chrism of the Lord God. 1986, Thomas G. Pavel, Fictional Worlds[1], page 111:For Christian examples of condensed symbols, consider the sacraments, particularly the Eucharist and the Chrisms. 2000, Joseph O'Neill, The Black Shore[2], page 62:He was more dangerous than the plump satisfied ones, he was so sure of the value of his witchcraft, the holy oils and chrisms and unctions. 2002, Colin Jones, The Great Nation, Penguin 2003, p. 8: Miraculously moist, the chrism was kept in an ampulla in Reims cathedral where the coronations of the kings of France were held.",False,False,False,False,False,False,False,False,False,False,False,False,False,False,False,False,False,False,False,False,False,,False,,False,,False,,False,,False,,False,False,False,True,False,False
30010,chrysophanol,Noun,A chemical compound found in rhubarb., organic chemistry,,False,False,False,False,False,False,False,False,False,False,False,False,False,False,False,False,False,False,False,False,False,,False,,False,,False,,False,,False,,False,False,False,True,False,False
31100,ciclosidomine,Noun,A chemical compound used in the hydrochloride form as a vasodilator.,,,False,False,False,False,False,False,False,False,False,False,False,False,False,False,False,False,False,False,False,False,False,,False,,False,,False,,False,,False,,False,False,False,True,False,False
31129,cider-and,Noun,A mixture of cider and other spirits.,,,False,False,False,False,False,False,False,False,False,False,False,False,False,False,False,False,False,False,False,False,False,,False,,False,,False,,False,,False,,False,False,False,True,False,False
31767,cinnamon sugar,Noun,"A mixture of ground cinnamon and granulated sugar, with much more sugar than cinnamon.",,,False,False,False,False,False,False,False,False,False,False,False,False,False,False,False,False,False,False,False,False,False,,False,,False,,False,,False,,False,,False,False,False,True,False,False
39071,co-amilofruse,Noun,A mixture of amiloride and frusemide used to treat fluid retention, medicine,,False,False,False,False,False,False,False,False,False,False,False,False,False,False,False,False,False,False,False,False,False,,False,,False,,False,,False,,False,,False,False,False,True,False,False
39072,co-amilozide,Noun,A mixture of amiloride and hydrochlorothiazide used in the treatment of hypertension, medicine,,False,False,False,False,False,False,False,False,False,False,False,False,False,False,False,False,False,False,False,False,False,,False,,False,,False,,False,,False,,False,False,False,True,False,False
39117,co-codamol,Noun,A mixture of codeine and paracetamol used as an analgesic, medicine,,False,False,False,False,False,False,False,False,False,False,False,False,False,False,False,False,False,False,False,False,False,,False,,False,,False,,False,,False,,False,False,False,True,False,False
39118,co-codaprin,Noun,A mixture of codeine and aspirin used as an analgesic, medicine,,False,False,False,False,False,False,False,False,False,False,False,False,False,False,False,False,False,False,False,False,False,,False,,False,,False,,False,,False,,False,False,False,True,False,False
39132,co-danthramer,Noun,A mixture of dantron and a poloxamer used as a laxative, medicine,,False,False,False,False,False,False,False,False,False,False,False,False,False,False,False,False,False,False,False,False,False,,False,,False,,False,,False,,False,,False,False,False,True,False,False
39133,co-danthrusate,Noun,A mixture of dantron and docusate used as a laxative, medicine,,False,False,False,False,False,False,False,False,False,False,False,False,False,False,False,False,False,False,False,False,False,,False,,False,,False,,False,,False,,False,False,False,True,False,False
39150,co-dydramol,Noun,A mixture of dihydrocodeine and paracetamol used as an analgesic, medicine,,False,False,False,False,False,False,False,False,False,False,False,False,False,False,False,False,False,False,False,False,False,,False,,False,,False,,False,,False,,False,False,False,True,False,False
39192,co-fluampicil,Noun,A mixture of flucloxacillin and ampicillin used as an antibiotic, medicine,,False,False,False,False,False,False,False,False,False,False,False,False,False,False,False,False,False,False,False,False,False,,False,,False,,False,,False,,False,,False,False,False,True,False,False
39193,co-flumactone,Noun,A mixture of hydroflumethiazide and spironolactone used as a diuretic, medicine,,False,False,False,False,False,False,False,False,False,False,False,False,False,False,False,False,False,False,False,False,False,,False,,False,,False,,False,,False,,False,False,False,True,False,False
39327,co-phenotrope,Noun,A mixture of diphenoxylate and atropine used in the treatment of diarrhoea, medicine,,False,False,False,False,False,False,False,False,False,False,False,False,False,False,False,False,False,False,False,False,False,,False,,False,,False,,False,,False,,False,False,False,True,False,False
39343,co-proxamol,Noun,A mixture of paracetamol and dextropropoxyphene used as a painkiller, medicine,,False,False,False,False,False,False,False,False,False,False,False,False,False,False,False,False,False,False,False,False,False,,False,,False,,False,,False,,False,,False,False,False,True,False,False
39399,co-tenidone,Noun,A mixture of atenolol and chlortalidone used in the treatment of hypertension, medicine,,False,False,False,False,False,False,False,False,False,False,False,False,False,False,False,False,False,False,False,False,False,,False,,False,,False,,False,,False,,False,False,False,True,False,False
39419,co-zidocapt,Noun,A mixture of captopril and hydrochlorothiazide used to treat hypertension, medicine,,False,False,False,False,False,False,False,False,False,False,False,False,False,False,False,False,False,False,False,False,False,,False,,False,,False,,False,,False,,False,False,False,True,False,False
40627,cocamide,Noun,"A mixture of amides of the fatty acids obtained from coconut oil, used in many surfactants.",,,False,False,False,False,False,False,False,False,False,False,False,False,False,False,False,False,False,False,False,False,False,,False,,False,,False,,False,,False,,False,False,False,True,False,False
40629,cocamidopropylbetaine,Noun,"A mixture of closely related organic compounds derived from coconut oil and dimethylaminopropylamine, used as a surfactant.",,,False,False,False,False,False,False,False,False,False,False,False,False,False,False,False,False,False,False,False,False,False,,False,,False,,False,,False,,False,,False,False,False,True,False,False
41298,cocktail,Noun,A mixture of other substances,,Scientists found a cocktail of pollutants in the river downstream from the chemical factory. a cocktail of illegal drugs,False,False,False,False,False,False,False,False,False,False,False,False,False,False,False,False,False,False,False,False,False,,False,,False,,False,,False,,False,,False,False,False,True,False,False
45050,collongite,Noun,A mixture of phosgene and stannic chloride or arsenic trichloride once used as a poison gas,,,False,False,False,False,False,False,False,False,False,False,False,False,False,False,False,False,False,False,False,False,False,,False,,False,,False,,False,,False,,False,False,False,True,False,False
45750,colostrinin,Noun,A mixture of polypeptides derived from colostrum,,,False,False,False,False,False,False,False,False,False,False,False,False,False,False,False,False,False,False,False,False,False,,False,,False,,False,,False,,False,,False,False,False,True,False,False
45754,colostrum,Noun,"A mixture of turpentine and egg yolk, formerly used as an emulsion.",,,False,False,False,False,False,False,False,False,False,False,False,False,False,False,False,False,False,False,False,False,False,,False,,False,,False,,False,,False,,False,False,False,True,False,False
50162,compo,Noun,"A mixture of whiting, resin, and glue for ornamenting walls and cornices.",,,False,False,False,False,False,False,False,False,False,False,False,False,False,False,False,False,False,False,False,False,False,,False,,False,,False,,False,,False,,False,False,False,True,False,False
50250,composite,Noun,A mixture of different components.,,,False,False,False,False,False,False,False,False,False,False,False,False,False,False,False,False,False,False,False,False,False,,False,,False,,False,,False,,False,,False,False,False,True,False,False
50298,composition,Noun,A mixture or compound; the result of composing,,[from 16th c.],False,False,False,False,False,False,False,False,False,False,False,False,False,False,False,False,False,False,False,False,False,,False,,False,,False,,False,,False,,False,False,False,True,False,False
50415,compound butter,Noun,"Any mixture of butter and supplementary ingredients (such as lemon or garlic), typically used in cooking.",,,False,False,False,False,False,False,False,False,False,False,False,False,False,False,False,False,False,False,False,False,False,,False,,False,,False,,False,,False,,False,False,False,True,False,False
51872,concoction,Noun,A mixture prepared in such a way.,,,False,False,False,False,False,False,False,False,False,False,False,False,False,False,False,False,False,False,False,False,False,,False,,False,,False,,False,,False,,False,False,False,True,False,False
60590,corallin,Noun,A mixture of phenolic dyestuffs consisting mostly of aurin.,,,False,False,False,False,False,False,False,False,False,False,False,False,False,False,False,False,False,False,False,False,False,,False,,False,,False,,False,,False,,False,False,False,True,False,False
68442,crack cocaine,Noun,A mixture of baking soda and cocaine in solid form that is smoked in a pipe as a narcotic.,,,False,False,False,False,False,False,False,False,False,False,False,False,False,False,False,False,False,False,False,False,False,,False,,False,,False,,False,,False,,False,False,False,True,False,False
68443,crack cocaine,Noun,"A mixture of salt substitute, ether, and cocaine in a semi-liquid form, which is far more potent than if made with baking soda alone.",,,False,False,False,False,False,False,False,False,False,False,False,False,False,False,False,False,False,False,False,False,False,,False,,False,,False,,False,,False,,False,False,False,True,False,False
69637,crasis,Noun,A mixture or combination.,,,False,False,False,False,False,False,False,False,False,False,False,False,False,False,False,False,False,False,False,False,False,,False,,False,,False,,False,,False,,False,False,False,True,False,False
74672,crumb,Noun,"A mixture of sugar, cocoa and milk, used to make industrial chocolate.",,,False,False,False,False,False,False,False,False,False,False,False,False,False,False,False,False,False,False,False,False,False,,False,,False,,False,,False,,False,,False,False,False,True,False,False
75782,cryptenamine,Noun,"A mixture of hypotensive alkaloids extracted from Veratrum album, used in the treatment of hypertension.",,,False,False,False,False,False,False,False,False,False,False,False,False,False,False,False,False,False,False,False,False,False,,False,,False,,False,,False,,False,,False,False,False,True,False,False
78240,cuprofen,Noun,A mixture of codeine and ibuprofen used as an analgesic, medicine,,False,False,False,False,False,False,False,False,False,False,False,False,False,False,False,False,False,False,False,False,False,,False,,False,,False,,False,,False,,False,False,False,True,False,False
78902,curry powder,Noun,"A mixture of spices, usually including turmeric, commonly used in Asian cooking.",,,False,False,False,False,False,False,False,False,False,False,False,False,False,False,False,False,False,False,False,False,False,,False,,False,,False,,False,,False,,False,False,False,True,False,False
80281,cyanamide,Noun,"A chemical compound, NH2CN; a white crystalline solid, soluble in water, having many commercial applications including fertilizer", chemistry,,False,False,False,False,False,False,False,False,False,False,False,False,False,False,False,False,False,False,False,False,False,,False,,False,,False,,False,,False,,False,False,False,True,False,False
83193,cytochemical,Noun,Any chemical compound that is found only in cells, biochemistry,,False,False,False,False,False,False,False,False,False,False,False,False,False,False,False,False,False,False,False,False,False,,False,,False,,False,,False,,False,,False,False,False,True,False,False
2822,Bordeaux mixture,Noun,A mixture of copper sulphate and lime that is sprayed on plants as a fungicide,,"1891, The Times Nov 16, 1891 pg 12 col A Reports are coming to hand from a very large number of districts as to the success which has attended the use of the Bordeaux mixture (sulphate of copper and lime) as a preventive of potato disease.",False,False,False,False,False,False,False,False,False,False,False,False,False,False,False,False,False,False,False,False,False,,False,,False,,False,,False,,False,,False,False,False,True,False,False
2923,Boston baked beans,Noun,A mixture of navy beans or pinto beans and molasses baked slowly.,,,False,False,False,False,False,False,False,False,False,False,False,False,False,False,False,False,False,False,False,False,False,,False,,False,,False,,False,,False,,False,False,False,True,False,False
3927,Burgundy mixture,Noun,"A mixture of copper sulphate and sodium carbonate, used as a fungicidal spray for trees and small fruits.",,,False,False,False,False,False,False,False,False,False,False,False,False,False,False,False,False,False,False,False,False,False,,False,,False,,False,,False,,False,,False,False,False,True,False,False
179,kaempferitrin,Noun,"A chemical compound, the 3,7-dirhamnoside of kaempferol, found in Onychium japonicum and in the leaves of Hedyotis verticillata.",,,False,False,False,False,False,False,False,False,False,False,False,False,False,False,False,False,False,False,False,False,False,,False,,False,,False,,False,,False,,False,False,False,True,False,False
3187,ketocaine,Noun,"A chemical compound, C18H29NO2, used as an anaesthetic.",,,False,False,False,False,False,False,False,False,False,False,False,False,False,False,False,False,False,False,False,False,False,,False,,False,,False,,False,,False,,False,False,False,True,False,False
3306,ketosphinganine,Noun,A chemical compound involved in the synthesis of sphingolipids., organic chemistry,,False,False,False,False,False,False,False,False,False,False,False,False,False,False,False,False,False,False,False,False,False,,False,,False,,False,,False,,False,,False,False,False,True,False,False
3330,ketoxal,Noun,"A chemical compound, beta-ethoxy-alpha-ketobutyraldehyde.",,,False,False,False,False,False,False,False,False,False,False,False,False,False,False,False,False,False,False,False,False,False,,False,,False,,False,,False,,False,,False,False,False,True,False,False
6090,kinnikinnick,Noun,"A mixture of bark, dried leaves, and often berries and/or tobacco, which is smoked.",,,False,False,False,False,False,False,False,False,False,False,False,False,False,False,False,False,False,False,False,False,False,,False,,False,,False,,False,,False,,False,False,False,True,False,False
1758,Abraum salts,Noun,"a mixture of carnallite, kieserite and sylvite found in Prussia; chemically, mixed sulphates and chlorides of potassium, sodium and calcium",,,False,False,False,False,False,False,False,False,False,False,False,False,False,False,False,False,False,False,False,False,False,,False,,False,,False,,False,,False,,False,False,False,True,False,False
4671,Athole brose,Noun,"A mixture of whisky and honey, traditionally drunk in Scotland.",,,False,False,False,False,False,False,False,False,False,False,False,False,False,False,False,False,False,False,False,False,False,,False,,False,,False,,False,,False,,False,False,False,True,False,False
3123,saltcat,Noun,"A mixture of salt, coarse meal, lime, etc., attractive to pigeons.",,,False,False,False,False,False,False,False,False,False,False,False,False,False,False,False,False,False,False,False,False,False,,False,,False,,False,,False,,False,,False,False,False,True,False,False
4460,sanggenon,Noun,A chemical compound found in mulberry root bark.,,,False,False,False,False,False,False,False,False,False,False,False,False,False,False,False,False,False,False,False,False,False,,False,,False,,False,,False,,False,,False,False,False,True,False,False
4565,sanies,Noun,a thin mixture of pus and blood serum discharged from a wound; ichor, medicine,,False,False,False,False,False,False,False,False,False,False,False,False,False,False,False,False,False,False,False,False,False,,False,,False,,False,,False,,False,,False,False,False,True,False,False
15065,sealant,Noun,"A mixture of polymers, fillers, and pigments used to fill and seal joints where moderate movement is expected.", construction,,False,False,False,False,False,False,False,False,False,False,False,False,False,False,False,False,False,False,False,False,False,,False,,False,,False,,False,,False,,False,False,False,True,False,False
21553,senecicannabine,Noun,"A chemical compound, C18H23NO7, isolated from Senecio cannabifolius.", organic chemistry,,False,False,False,False,False,False,False,False,False,False,False,False,False,False,False,False,False,False,False,False,False,,False,,False,,False,,False,,False,,False,False,False,True,False,False
25264,sewer gas,Noun,A mixture of toxic and non-toxic gases produced and collected in sewage systems by the decomposition of organic household or industrial wastes.,,,False,False,False,False,False,False,False,False,False,False,False,False,False,False,False,False,False,False,False,False,False,,False,,False,,False,,False,,False,,False,False,False,True,False,False
27153,shandygaff,Noun,A mixture of strong beer and ginger beer., Britain,,False,False,False,False,False,False,False,False,False,False,False,False,False,False,False,False,False,False,False,False,False,,False,,False,,False,,False,,False,,False,False,False,True,False,False
36640,silicon monoxide,Noun,A chemical compound with the formula SiO, inorganic chemistry,"In the atmosphere it oxidizes quickly into SiO, but has been detected in stellar objects and has been described as the most common oxide of silicon in the universe.",False,False,False,False,False,False,False,False,False,False,False,False,False,False,False,False,False,False,False,False,False,,False,,False,,False,,False,,False,,False,False,False,True,False,False
36942,silsesquioxane,Noun,"Any chemical compound with the empirical chemical formula RSiO1.5, where R is either hydrogen or an alkyl, alkene, aryl or arylene group.", chemistry,,False,False,False,False,False,False,False,False,False,False,False,False,False,False,False,False,False,False,False,False,False,,False,,False,,False,,False,,False,,False,False,False,True,False,False
37314,silymarin,Noun,"A mixture of flavonolignans extracted from the blessed milk thistle (Silybum marianum), used as a source of silibinin.", biochemistry,,False,False,False,False,False,False,False,False,False,False,False,False,False,False,False,False,False,False,False,False,False,,False,,False,,False,,False,,False,,False,False,False,True,False,False
37591,simple syrup,Noun,"A mixture of sugar and water used as a basis for sauces and preserves, as well as a mixer in mixed drinks",,,False,False,False,False,False,False,False,False,False,False,False,False,False,False,False,False,False,False,False,False,False,,False,,False,,False,,False,,False,,False,False,False,True,False,False
38699,sinter,Noun,A mixture of iron ore and fluxes added to a blast furnace.,,,False,False,False,False,False,False,False,False,False,False,False,False,False,False,False,False,False,False,False,False,False,,False,,False,,False,,False,,False,,False,False,False,True,False,False
39113,sisalagenin,Noun,A chemical compound found in Agave sisalana.,,,False,False,False,False,False,False,False,False,False,False,False,False,False,False,False,False,False,False,False,False,False,,False,,False,,False,,False,,False,,False,False,False,True,False,False
43582,sleet,Noun,A mixture of rain and snow," chiefly Britain, Ireland, New England","Synonyms: slush, ice pellets",False,False,False,False,False,False,False,False,False,False,False,False,False,False,False,False,False,False,False,False,False,,False,,False,,False,,False,,False,,False,False,False,True,False,False
45593,slumgullion,Noun,"A mixture of unrelated things, a jumble, a hodgepodge 2018, Julie Hirschfeld Davis and Emily Cochrane, ""Shutdown Looms and Priorities Stack Up as Congress Races Toward Sessions End"", The New York Times: Aides are tossing around metaphors to describe the means by which other bills could find their way into the spending package",,"The last train leaving the station. Final ornaments on the Christmas tree. ""A big slumgullion of legislation,"" Mr. Whitehouse offered.",False,False,False,False,False,False,False,False,False,False,False,False,False,False,False,False,False,False,False,False,False,,False,,False,,False,,False,,False,,False,False,False,True,False,False
45706,slurry,Noun,"A mixture of animal waste, other organic material and sometimes water, stored in a slurry pit and used as fertilizer; also used in combination, as pig slurry, etc", agriculture,"2004, W. H. Rulkens, 11: Overview of resource recovery techmologies for biowaste, Piet Lens, B. Hamelers, Harry Hoitink, Werner Bidlingmaier (editors), Resource Recovery and Reuse in Organic Solid Waste Management, page 249, In the Netherlands, the most problematic agricultural waste is liquid pig manure or pig slurry.",False,False,False,False,False,False,False,False,False,False,False,False,False,False,False,False,False,False,False,False,False,,False,,False,,False,,False,,False,,False,False,False,True,False,False
45719,slush,Noun,"A soft mixture of grease and other materials, used for lubrication.",,,False,False,False,False,False,False,False,False,False,False,False,False,False,False,False,False,False,False,False,False,False,,False,,False,,False,,False,,False,,False,False,False,True,False,False
