Unnamed: 0,term,pos,definition,domain,supplementary_info,obsolete,slang,dated,rare,vulgar,offensive,slur,astrology,mythology,jargon,euphemistic,informal,humorous,literary,literature,childish,folklore,colloquial,nonstandard,theology,abbreviation,abbreviation_for_term,plural,plural_for_term,misspelling,misspelling_for_term,acronym,acronym_for_term,synonym,synonym_for_term,antonym,antonym_for_term,attribute,property,process,matter,role,measure,units,body
52742,solid,Noun,A substance in the fundamental state of matter that retains its size and shape without need of a container (as opposed to a liquid or gas)., chemistry,,False,False,False,False,False,False,False,False,False,False,False,False,False,False,False,False,False,False,False,False,False,,False,,False,,False,,False,,False,,False,False,False,True,False,False,False,False
53093,solubilizer,Noun,A substance used to solubilize another.,,,False,False,False,False,False,False,False,False,False,False,False,False,False,False,False,False,False,False,False,False,False,,False,,False,,False,,False,,False,,False,False,False,True,False,False,False,False
53187,solvend,Noun,A substance to be dissolved.,,,False,False,False,False,False,False,False,False,False,False,False,False,False,False,False,False,False,False,False,False,False,,False,,False,,False,,False,,False,,False,False,False,True,False,False,False,False
54596,sorbent,Noun,A substance that can enable sorption., sciences,,False,False,False,False,False,False,False,False,False,False,False,False,False,False,False,False,False,False,False,False,False,,False,,False,,False,,False,,False,,False,False,False,True,False,False,False,False
57552,spasmogen,Noun,A substance which induces spasms, pharmacology,"When tested on rats, the compound was found to be a spasmogen.",False,False,False,False,False,False,False,False,False,False,False,False,False,False,False,False,False,False,False,False,False,,False,,False,,False,,False,,False,,False,False,False,True,False,False,False,False
59631,spermaticide,Noun,A substance used to kill sperm.,,,False,False,False,False,False,False,False,False,False,False,False,False,False,False,False,False,False,False,False,False,False,,False,,False,,False,,False,,False,,False,False,False,True,False,False,False,False
59637,spermatin,Noun,"A substance allied to alkali albumin and to mucin, present in semen, to which it is said to impart the mucilaginous character.", biochemistry,,False,False,False,False,False,False,False,False,False,False,False,False,False,False,False,False,False,False,False,False,False,,False,,False,,False,,False,,False,,False,False,False,True,False,False,False,False
59748,spermicide,Noun,A substance used for killing sperm.,,,False,False,False,False,False,False,False,False,False,False,False,False,False,False,False,False,False,False,False,False,False,,False,,False,,False,,False,,False,,False,False,False,True,False,False,False,False
63847,sporicide,Noun,A substance that kills spores.,,,False,False,False,False,False,False,False,False,False,False,False,False,False,False,False,False,False,False,False,False,False,,False,,False,,False,,False,,False,,False,False,False,True,False,False,False,False
67935,stain,Noun,A substance used to soak into a surface and colour it,,"1980, Robert M. Jones, editor, Walls and Ceilings, Time-Life Books, ISBN, page 93:The wood will darken whether it is stained or notthe main function of a stain is to enhance the wood's natural color and emphasize its grain.",False,False,False,False,False,False,False,False,False,False,False,False,False,False,False,False,False,False,False,False,False,,False,,False,,False,,False,,False,,False,False,False,True,False,False,False,False
74239,stimulant,Noun,A substance that acts to increase physiological or nervous activity in the body.,,,False,False,False,False,False,False,False,False,False,False,False,False,False,False,False,False,False,False,False,False,False,,False,,False,,False,,False,,False,,False,False,False,True,False,False,False,False
81501,styptic,Noun,A substance used for styptic results,,"1876, Henry Beasley, The Book of Prescriptions The powdered gum with resin is used as a styptic; and the mucilage has been recommended as an application to burns. 1889, John Barclay Biddle, Materia Medica and Therapeutics: For Physicians and Students Externally, it is applied as a styptic, and in solution, of various strengths, as an astringent. 1990, A. L. Tommie Bass et al., Herbal Medicine Past and Present Knowledge of puffball's use as a styptic and for hemorrhoids reached Bass through the popular tradition.",False,False,False,False,False,False,False,False,False,False,False,False,False,False,False,False,False,False,False,False,False,,False,,False,,False,,False,,False,,False,False,False,True,False,False,False,False
81532,styrone,Noun,"A substance with a hyacinth-like odour, obtained by decomposition of styracin; cinnamic styryl alcohol.", chemistry,,False,False,False,False,False,False,False,False,False,False,False,False,False,False,False,False,False,False,False,False,False,,False,,False,,False,,False,,False,,False,False,False,True,False,False,False,False
91100,superconductor,Noun,A substance that has no resistance to conducting an electric current,,,False,False,False,False,False,False,False,False,False,False,False,False,False,False,False,False,False,False,False,False,False,,False,,False,,False,,False,,False,,False,False,False,True,False,False,False,False
91197,supercritical fluid,Noun,A substance at a temperature and pressure above its own thermodynamic critical point that can diffuse through solids like a gas and dissolve materials like a liquid, physics,The most commonly used supercritical fluids are carbon dioxide and water.,False,False,False,False,False,False,False,False,False,False,False,False,False,False,False,False,False,False,False,False,False,,False,,False,,False,,False,,False,,False,False,False,True,False,False,False,False
91633,superfluid,Noun,"A substance, such as liquid helium, that exhibits superfluidity.", physics,,False,False,False,False,False,False,False,False,False,False,False,False,False,False,False,False,False,False,False,False,False,,False,,False,,False,,False,,False,,False,False,False,True,False,False,False,False
94154,suppressant,Noun,A substance that suppresses.,,,False,False,False,False,False,False,False,False,False,False,False,False,False,False,False,False,False,False,False,False,False,,False,,False,,False,,False,,False,,False,False,False,True,False,False,False,False
6425,febrifacient,Noun,A substance that produces a fever.,,,False,False,False,False,False,False,False,False,False,False,False,False,False,False,False,False,False,False,False,False,False,,False,,False,,False,,False,,False,,False,False,False,True,False,False,False,False
9923,fibrinolytic,Noun,A substance or drug that produces fibrinolysis.,,,False,False,False,False,False,False,False,False,False,False,False,False,False,False,False,False,False,False,False,False,False,,False,,False,,False,,False,,False,,False,False,False,True,False,False,False,False
13367,fire-retardant,Noun,A substance that makes an object resistant to burning.,,,False,False,False,False,False,False,False,False,False,False,False,False,False,False,False,False,False,False,False,False,False,,False,,False,,False,,False,,False,,False,False,False,True,False,False,False,False
15694,fixative,Noun,"A substance that fixes, protects, or preserves.",,,False,False,False,False,False,False,False,False,False,False,False,False,False,False,False,False,False,False,False,False,False,,False,,False,,False,,False,,False,,False,False,False,True,False,False,False,False
16395,flame-retardant,Noun,A substance used to make an object flameproof,,"The flame-retardant used on the child's pajamas would keep them from bursting into flame, but it caused a rash.",False,False,False,False,False,False,False,False,False,False,False,False,False,False,False,False,False,False,False,False,False,,False,,False,,False,,False,,False,,False,False,False,True,False,False,False,False
17683,flavor,Noun,A substance used to produce a taste,,Flavoring. Flavor was added to the pudding.,False,False,False,False,False,False,False,False,False,False,False,False,False,False,False,False,False,False,False,False,False,,False,,False,,False,,False,,False,,False,False,False,True,False,False,False,False
22249,foam,Noun,A substance composed of a large collection of bubbles or their solidified remains,,"2013 May-June, Charles T. Ambrose, Alzheimers Disease, in American Scientist, volume 101, number 3, page 200:Similar studies of rats have employed four different intracranial resorbable, slow sustained release systemssurgical foam, a thermal gel depot, a microcapsule or biodegradable polymer beads. He doesn't like so much foam in his beer.",False,False,False,False,False,False,False,False,False,False,False,False,False,False,False,False,False,False,False,False,False,,False,,False,,False,,False,,False,,False,False,False,True,False,False,False,False
22250,foam,Noun,A substance formed by trapping pockets of gas in a liquid or solid,,A foam mat can soften a hard seat.,False,False,False,False,False,False,False,False,False,False,False,False,False,False,False,False,False,False,False,False,False,,False,,False,,False,,False,,False,,False,False,False,True,False,False,False,False
27250,formicide,Noun,A substance that kills ants.,,,False,False,False,False,False,False,False,False,False,False,False,False,False,False,False,False,False,False,False,False,False,,False,,False,,False,,False,,False,,False,False,False,True,False,False,False,False
32226,frill,Noun,"A substance or material on the edge of something, resembling such a strip of fabric", figuratively,"1874, Thomas Hardy, Far from the Madding Crowd, London: Smith, Elder, Volume2, Chapter17, p.206,[4] Nothing moved in sky, land, or sea, except a frill of milkwhite foam along the nearer angles of the shore [] 1920, Katherine Mansfield, Prelude in Bliss and Other Stories, Toronto: Macmillan, pp.25-26,[5] [] a few tiny corkscrew tendrils had come right through some cracks in the scullery ceiling and all the windows of the lean-to had a thick frill of ruffled green. 1979, Angela Carter, The Company of Wolves in The Bloody Chamber, Penguin, 1993,[6] [] the bright frills of the winter fungi on the blotched trunks of the trees; 2009, Sarah Waters, The Little Stranger, London: Virago, Chapter12,[7] Isnt it a shame! Mrs Ayres said softly, now and then pausing to brush aside a frill of snow and examine the plant beneath []",False,False,False,False,False,False,False,False,False,False,False,False,False,False,False,False,False,False,False,False,False,,False,,False,,False,,False,,False,,False,False,False,True,False,False,False,False
36075,fungicide,Noun,A substance used to kill fungus,,,False,False,False,False,False,False,False,False,False,False,False,False,False,False,False,False,False,False,False,False,False,,False,,False,,False,,False,,False,,False,False,False,True,False,False,False,False
2347,magic mud,Noun,a substance used to treat baseballs before they are put into professional play,,,False,False,False,False,False,False,False,False,False,False,False,False,False,False,False,False,False,False,False,False,False,,False,,False,,False,,False,,False,,False,False,False,True,False,False,False,False
13918,meal marker,Noun,A substance added to food to allow measurements to be made of how quickly the food passes through the segments of the digestive tract, medicine,"2013, Thomas F. Schweizer, Christine A. Edwards, Dietary Fibre A Component of Food: Nutritional Function in Health and Disease, p. 188: The incorporation of guar gum into a radiolabelled homogenised meal in rats delayed the delivery of the meal marker from the stomach into the small intestine and also from the small intestine into the colon.",False,False,False,False,False,False,False,False,False,False,False,False,False,False,False,False,False,False,False,False,False,,False,,False,,False,,False,,False,,False,False,False,True,False,False,False,False
14857,meconin,Noun,"A substance regarded as an anhydride of meconinic acid, found in opium.", chemistry,,False,False,False,False,False,False,False,False,False,False,False,False,False,False,False,False,False,False,False,False,False,,False,,False,,False,,False,,False,,False,False,False,True,False,False,False,False
15304,medicine,Noun,A substance which specifically promotes healing when ingested or consumed in some way.,,,False,False,False,False,False,False,False,False,False,False,False,False,False,False,False,False,False,False,False,False,False,,False,,False,,False,,False,,False,,False,False,False,True,False,False,False,False
22311,metapectin,Noun,"A substance obtained from, and resembling, pectin, and occurring in overripe fruits.", organic chemistry,,False,False,False,False,False,False,False,False,False,False,False,False,False,False,False,False,False,False,False,False,False,,False,,False,,False,,False,,False,,False,False,False,True,False,False,False,False
24785,microabrasive,Noun,A substance used to produce microabrasion.,,,False,False,False,False,False,False,False,False,False,False,False,False,False,False,False,False,False,False,False,False,False,,False,,False,,False,,False,,False,,False,False,False,True,False,False,False,False
30909,mimetic,Noun,A substance with similar pharmacological effects to another substance., pharmacology,,False,False,False,False,False,False,False,False,False,False,False,False,False,False,False,False,False,False,False,False,False,,False,,False,,False,,False,,False,,False,False,False,True,False,False,False,False
31488,mineraloid,Noun,A substance that resembles a mineral but does not exhibit crystallinity.,,,False,False,False,False,False,False,False,False,False,False,False,False,False,False,False,False,False,False,False,False,False,,False,,False,,False,,False,,False,,False,False,False,True,False,False,False,False
38524,moderator,Noun,a substance (often water or graphite) used to decrease the speed of fast neutrons in a nuclear reactor and hence increase likelihood of fission, physics,,False,False,False,False,False,False,False,False,False,False,False,False,False,False,False,False,False,False,False,False,False,,False,,False,,False,,False,,False,,False,False,False,True,False,False,False,False
39249,moldavite,Noun,"A substance formed by meteorite impact, a component of the tektites found across central Europe.", geology,,False,False,False,False,False,False,False,False,False,False,False,False,False,False,False,False,False,False,False,False,False,,False,,False,,False,,False,,False,,False,False,False,True,False,False,False,False
39543,molluscicide,Noun,A substance that kills molluscs.,,,False,False,False,False,False,False,False,False,False,False,False,False,False,False,False,False,False,False,False,False,False,,False,,False,,False,,False,,False,,False,False,False,True,False,False,False,False
47540,mucigen,Noun,A substance formed in mucous epithelial cells that gives rise to mucin., physiology,,False,False,False,False,False,False,False,False,False,False,False,False,False,False,False,False,False,False,False,False,False,,False,,False,,False,,False,,False,,False,False,False,True,False,False,False,False
51507,mummy,Noun,"A substance used in medicine, prepared from mummified flesh"," uncountable, medicine, now historical","[from 14th c.] 1978, Benjamin Walker, Encyclopedia of Metaphysical Medicine, Routledge 1978, p. 253: Yet another scatological medicament was obtained from mummy, the material derived from a dried or embalmed human corpse, the most valuable being that imported from Mizraim (ancient Egypt). 2006, Philip Ball, The Devil's Doctor, Arrow 2007, p. 360: Nonetheless, his book advertises many Paracelsian remedies, including laudanum, mummy, antimony and mercury. (Can we find and add a quotation of Sir T. Herbert to this entry?)",False,False,False,False,False,False,False,False,False,False,False,False,False,False,False,False,False,False,False,False,False,,False,,False,,False,,False,,False,,False,False,False,True,False,False,False,False
54178,myeloidin,Noun,"A substance present in the protoplasm of the retinal epithelium cells, and resembling, if not identical with, the myelin that forms the medullary sheaths of nerve fibres.", biochemistry,,False,False,False,False,False,False,False,False,False,False,False,False,False,False,False,False,False,False,False,False,False,,False,,False,,False,,False,,False,,False,False,False,True,False,False,False,False
26433,urogastrone,Noun,"A substance secreted by the Brunner's glands that inhibits parietal cells and chief cells of the stomach from secreting acid and their digestive enzymes, in order to protect the duodenum.",,,False,False,False,False,False,False,False,False,False,False,False,False,False,False,False,False,False,False,False,False,False,,False,,False,,False,,False,,False,,False,False,False,True,False,False,False,False
26438,uroglaucin,Noun,"A substance identical with indigo, occasionally found in the urine in degeneration of the kidneys", organic chemistry,It is readily formed by oxidation or decomposition of indican.,False,False,False,False,False,False,False,False,False,False,False,False,False,False,False,False,False,False,False,False,False,,False,,False,,False,,False,,False,,False,False,False,True,False,False,False,False
26693,urticant,Noun,Such a substance.,,,False,False,False,False,False,False,False,False,False,False,False,False,False,False,False,False,False,False,False,False,False,,False,,False,,False,,False,,False,,False,False,False,True,False,False,False,False
5881,juniperin,Noun,A substance extracted from juniper berries, organic chemistry,"1940, Journal of the American Pharmaceutical Association (volume 29) The unusually bitter taste of aqueous juniperin solutions is not in accord with a mixture of only sugars and tannin.",False,False,False,False,False,False,False,False,False,False,False,False,False,False,False,False,False,False,False,False,False,,False,,False,,False,,False,,False,,False,False,False,True,False,False,False,False
1944,radioprotector,Noun,"A substance, such as potassium iodide, that provides some protection against the harmful effects of radiation.", chemistry,,False,False,False,False,False,False,False,False,False,False,False,False,False,False,False,False,False,False,False,False,False,,False,,False,,False,,False,,False,,False,False,False,True,False,False,False,False
14098,redox indicator,Noun,"A substance that exists in an oxidized and reduced forms, these forms having different colours, changing colour at a specific redox potential", chemistry,,False,False,False,False,False,False,False,False,False,False,False,False,False,False,False,False,False,False,False,False,False,,False,,False,,False,,False,,False,,False,False,False,True,False,False,False,False
16340,refrigerant,Noun,"A substance used in a heat cycle that undergoes a phase change between gas and liquid to allow the cooling, as in refrigerators, air conditioners, etc.",,,False,False,False,False,False,False,False,False,False,False,False,False,False,False,False,False,False,False,False,False,False,,False,,False,,False,,False,,False,,False,False,False,True,False,False,False,False
19083,rejuvenator,Noun,A substance sprayed onto a bituminous surface to renew it.,,,False,False,False,False,False,False,False,False,False,False,False,False,False,False,False,False,False,False,False,False,False,,False,,False,,False,,False,,False,,False,False,False,True,False,False,False,False
19350,relative permittivity,Noun,"for a substance, the ratio between its permittivity and the permittivity of vacuum",,,False,False,False,False,False,False,False,False,False,False,False,False,False,False,False,False,False,False,False,False,False,,False,,False,,False,,False,,False,,False,False,False,True,False,False,False,False
22613,repellent,Noun,"A substance used to repel insects, other pests, or dangerous animals.",,,False,False,False,False,False,False,False,False,False,False,False,False,False,False,False,False,False,False,False,False,False,,False,,False,,False,,False,,False,,False,False,False,True,False,False,False,False
22614,repellent,Noun,A substance or treatment for a fabric etc to make it impervious to something.,,,False,False,False,False,False,False,False,False,False,False,False,False,False,False,False,False,False,False,False,False,False,,False,,False,,False,,False,,False,,False,False,False,True,False,False,False,False
41705,royal jelly,Noun,"A substance secreted by honey bees to aid in the development of immature or young bees, supplied in extra measure to those young that will become queen bees.",,,False,False,False,False,False,False,False,False,False,False,False,False,False,False,False,False,False,False,False,False,False,,False,,False,,False,,False,,False,,False,False,False,True,False,False,False,False
42171,rubefacient,Noun,"A substance for topical application that produces redness of the skin, e.g", medicine,by dilating the capillaries.,False,False,False,False,False,False,False,False,False,False,False,False,False,False,False,False,False,False,False,False,False,,False,,False,,False,,False,,False,,False,False,False,True,False,False,False,False
42200,rubiacin,Noun,"A substance found in madder root, and probably identical with ruberythrinic acid.", organic chemistry,,False,False,False,False,False,False,False,False,False,False,False,False,False,False,False,False,False,False,False,False,False,,False,,False,,False,,False,,False,,False,False,False,True,False,False,False,False
708,galactagogue,Noun,A substance that induces lactation,,"2005, Jan Riordan, Breastfeeding and Human Lactation, 3rd Edition, page 303, Galactagogues are agents that promote milk production, such as drugs, herbs, or foods. [] Domperidone, though not commercially available in the United States, is used as a galactagogue in other countries. 2009, Gerald G. Briggs, Michael P. Nageotte, Diseases, Complications, and Drug Therapy in Obstetrics: A Guide for Clinicians, page 44, The safety of dopamine antagonists has not been adequately studied when used as galactagogues, but all have potential safety concerns for mothers, infants, or both. Fenugreek is an herbal product that is frequently used as a galactagogue, although no scientific evidence exists on its use for this purpose. 2011, Marsha Walker, Breastfeeding Management for the Clinician: Using the Evidence, page 592, It is estimated that at least 15% of breastfeeding women use herbal galactagogues at some point (The National Childrens Study, 2003).",False,False,False,False,False,False,False,False,False,False,False,False,False,False,False,False,False,False,False,False,False,,False,,False,,False,,False,,False,,False,False,False,True,False,False,False,False
1344,gallin,Noun,A substance obtained by the reduction of gallein., organic chemistry,,False,False,False,False,False,False,False,False,False,False,False,False,False,False,False,False,False,False,False,False,False,,False,,False,,False,,False,,False,,False,False,False,True,False,False,False,False
13338,glidant,Noun,a substance that is added to a powder to improve its flowability.,,,False,False,False,False,False,False,False,False,False,False,False,False,False,False,False,False,False,False,False,False,False,,False,,False,,False,,False,,False,,False,False,False,True,False,False,False,False
27628,guanine,Noun,A substance first obtained from guano; it is a nucleic base and pairs with cytosine in DNA and RNA (by means of three hydrogen bonds)., chemistry,,False,False,False,False,False,False,False,False,False,False,False,False,False,False,False,False,False,False,False,False,False,,False,,False,,False,,False,,False,,False,False,False,True,False,False,False,False
960,lactagogue,Noun,A substance which induces lactation; a galactagogue.,,,False,False,False,False,False,False,False,False,False,False,False,False,False,False,False,False,False,False,False,False,False,,False,,False,,False,,False,,False,,False,False,False,True,False,False,False,False
7069,leacher,Noun,A substance that leaches from the soil., agriculture,,False,False,False,False,False,False,False,False,False,False,False,False,False,False,False,False,False,False,False,False,False,,False,,False,,False,,False,,False,,False,False,False,True,False,False,False,False
12098,levulin,Noun,"A substance resembling dextrin, obtained from the bulbs of the dahlia, the artichoke, and other sources, that yields levulose on decomposition.", organic chemistry,,False,False,False,False,False,False,False,False,False,False,False,False,False,False,False,False,False,False,False,False,False,,False,,False,,False,,False,,False,,False,False,False,True,False,False,False,False
16774,lip balm,Noun,"A substance topically applied to the lips of the mouth to relieve chapped or dry lips, angular cheilitis or stomatitis, and cold sores.",,,False,False,False,False,False,False,False,False,False,False,False,False,False,False,False,False,False,False,False,False,False,,False,,False,,False,,False,,False,,False,False,False,True,False,False,False,False
