Unnamed: 0,term,pos,definition,domain,supplementary_info,obsolete,slang,dated,rare,vulgar,offensive,slur,astrology,mythology,jargon,euphemistic,informal,humorous,literary,literature,childish,folklore,colloquial,nonstandard,theology,abbreviation,abbreviation_for_term,plural,plural_for_term,misspelling,misspelling_for_term,acronym,acronym_for_term,synonym,synonym_for_term,antonym,antonym_for_term,attribute,property,process,matter,role,measure,units,body
772,ichnotaxonomy,Noun,"The branch of taxonomy that attempts to classify an animal based on its footprints, burrows, or other traces",True,,False,False,False,False,False,False,False,False,False,False,False,False,False,False,False,False,False,False,False,False,False,,False,,False,,False,,False,,False,,False,False,False,False,False,False,False,False
848,ichthyology,Noun,The branch of zoology devoted to the study of fish.,True,,False,False,False,False,False,False,False,False,False,False,False,False,False,False,False,False,False,False,False,False,False,,False,,False,,False,,False,,False,,False,False,False,False,False,False,False,False
859,ichthyopathology,Noun,The study of diseases of fish,True,"2012, Edmir Carvalho, Health and Environment in Aquaculture, page 124:Classically the species of Aeromonas implicated in fish disease that have been considered important in ichthyopathology were A. salmonicida and A. hydrophila.",False,False,False,False,False,False,False,False,False,False,False,False,False,False,False,False,False,False,False,False,False,,False,,False,,False,,False,,False,,False,False,False,False,False,False,False,False
877,ichthyoplanktology,Noun,"The study of the free-floating larvae of fish 2015 July 6, Molecular Identification of Atlantic Bluefin Tuna ( Thunnus thynnus, Scombridae) Larvae and Development of a DNA Character-Based Identification Key for Mediterranean Scombrids, in PLOS ONE[1], DOI:10.1371/journal.pone.0130407:It comes as no surprise that all 58 larvae provided by the IEO and OCEANA-Marviva project were correctly identified, since their staff are leading experts in the field of ichthyoplanktology.",True,,False,False,False,False,False,False,False,False,False,False,False,False,False,False,False,False,False,False,False,False,False,,False,,False,,False,,False,,False,,False,False,False,False,False,False,False,False
991,iconics,Noun,The study of images and symbols as a form of communication.,True,,False,False,False,False,False,False,False,False,False,False,False,False,False,False,False,False,False,False,False,False,False,,False,,False,,False,,False,,False,,False,False,False,False,False,False,False,False
1044,iconography,Noun,The study of representative art in general.,True,,False,False,False,False,False,False,False,False,False,False,False,False,False,False,False,False,False,False,False,False,False,,False,,False,,False,,False,,False,,False,False,False,False,False,False,False,False
1055,iconology,Noun,The study of icons in art or art history.,True,,False,False,False,False,False,False,False,False,False,False,False,False,False,False,False,False,False,False,False,False,False,,False,,False,,False,,False,,False,,False,False,False,False,False,False,False,False
1534,ideology,Noun,The study of the origin and nature of ideas.,True,,False,False,False,False,False,False,False,False,False,False,False,False,False,False,False,False,False,False,False,False,False,,False,,False,,False,,False,,False,,False,False,False,False,False,False,False,False
1621,idiography,Noun,The study of individuals,True,,False,False,False,False,False,False,False,False,False,False,False,False,False,False,False,False,False,False,False,False,False,,False,,False,,False,,False,,False,,False,False,False,False,False,False,False,False
1663,idiomatology,Noun,"The study of idioms and idiomatic language 1919, H.A",True,"Rose, Comparative ""Idiomatology"", in Man[1], page 133:Mr. Alan Gardiner's Home Thoughts on Language emboldens one to ask whether there is not room for a science of Idiomatology* as a sister to Semantics. 1952, Claire Eileen Craddock, Style theories as found in stylistic studies of Romance scholars, 1900-1950[2], page 32:His aim is language characterization as to its system, a kind of idiomatology. 1978 June 9, George W. Grace, The Langue, in Ethnolinguistic Notes[3], number 2:If we were to identify the langue strictly with the object of linguistic description then one aspect of the problem of defining the langue would involve drawing the line between that aspect of the speakers knowledge of X which is relevant to a linguistic description of X and those aspects (the idiomatology) which are not.",False,False,False,False,False,False,False,False,False,False,False,False,False,False,False,False,False,False,False,False,False,,False,,False,,False,,False,,False,,False,False,False,False,False,False,False,False
3083,imageology,Noun,"The study of images, especially those produced by medical imaging 2015 July 2, Hao Zeng et al., Comparison of three surgical approaches for cervicothoracic spinal tuberculosis: a retrospective casecontrol study, in Journal of Orthopaedic Surgery and Research[1], volume 10, DOI:10.1186/s13018-015-0238-0:In our study, patients in group B indeed harvested perfect clinical and imageology outcomes during the follow-up (Fig",True,"2 ); however, the longer operation and hospitalization time, more loss of bleeding, and anteriorposterior routine-related complications made the combined anterior and posterior (AP) approach not applicable to all CTSTBs, except multi-level segments lesion, severe destruction, and complex kyphosis deformity [ 19 ].",False,False,False,False,False,False,False,False,False,False,False,False,False,False,False,False,False,False,False,False,False,,False,,False,,False,,False,,False,,False,False,False,False,False,False,False,False
3190,imagology,Noun,The study of cultural stereotypes as presented in literature etc,True,"2016, Reingard M. Nischik, On Imagology, Canadian-US Relations, and Popular Culture: National Images and Border Crossings in Margaret Atwoods Works, in Comparative North American Studies, page 93:Applied to American Studies, imagologythe term derives from Latin imago/imageasks not how Americans themselves see America, but how other cultures view the United States. In other words, what is the image of the United States as seen in literatures from outside the United States?",False,False,False,False,False,False,False,False,False,False,False,False,False,False,False,False,False,False,False,False,False,,False,,False,,False,,False,,False,,False,False,False,False,False,False,False,False
4298,immunobiology,Noun,The branch of biology that deals with the biological effects of the immune system,True,,False,False,False,False,False,False,False,False,False,False,False,False,False,False,False,False,False,False,False,False,False,,False,,False,,False,,False,,False,,False,False,False,False,False,False,False,False
4351,immunochemistry,Noun,the study of the structure of antibody molecules (immunoglobulins) and of their ability to bind with antigens of diverse chemical structure,True,,False,False,False,False,False,False,False,False,False,False,False,False,False,False,False,False,False,False,False,False,False,,False,,False,,False,,False,,False,,False,False,False,False,False,False,False,False
4515,immunoecology,Noun,The study of interactions between immunology and ecology,True,,False,False,False,False,False,False,False,False,False,False,False,False,False,False,False,False,False,False,False,False,False,,False,,False,,False,,False,,False,,False,False,False,False,False,False,False,False
4605,immunogenetics,Noun,"The study of the genetic basis for the immune response, and of the relationships between genetics and immunity from disease",True,,False,False,False,False,False,False,False,False,False,False,False,False,False,False,False,False,False,False,False,False,False,,False,,False,,False,,False,,False,,False,False,False,False,False,False,False,False
4634,immunohematology,Noun,The study of the relationships between disorders of the blood and the immune system,True,,False,False,False,False,False,False,False,False,False,False,False,False,False,False,False,False,False,False,False,False,False,,False,,False,,False,,False,,False,,False,False,False,False,False,False,False,False
4675,immunoinformatics,Noun,The branch of bioinformatics that deals with immunology,True,,False,False,False,False,False,False,False,False,False,False,False,False,False,False,False,False,False,False,False,False,False,,False,,False,,False,,False,,False,,False,False,False,False,False,False,False,False
4743,immunology,Noun,The branch of medicine that concerns the body's immune system,True,,False,False,False,False,False,False,False,False,False,False,False,False,False,False,False,False,False,False,False,False,False,,False,,False,,False,,False,,False,,False,False,False,False,False,False,False,False
4762,immunometabolism,Noun,"The study of the interaction between the immune system and metabolism 2015 September 15, Characterization of In Vitro Engineered Human Adipose Tissues: Relevant Adipokine Secretion and Impact of TNF-, in PLOS ONE[1], DOI:10.1371/journal.pone.0137612:In fact, a novel research area termed immunometabolism has emerged from the study of ATs roles in metabolism and immunity, which contribute to the pathogenesis of obesity-associated dysfunctions [23, 24 ].",True,,False,False,False,False,False,False,False,False,False,False,False,False,False,False,False,False,False,False,False,False,False,,False,,False,,False,,False,,False,,False,False,False,False,False,False,False,False
4798,immunomorphology,Noun,The study of the relationship between form and function of immunological species such as antigens,True,,False,False,False,False,False,False,False,False,False,False,False,False,False,False,False,False,False,False,False,False,False,,False,,False,,False,,False,,False,,False,False,False,False,False,False,False,False
4844,immunopathology,Noun,The branch of immunology that studies the relation of the immune system to disease; a disease caused by a disruption of the immune system,True,,False,False,False,False,False,False,False,False,False,False,False,False,False,False,False,False,False,False,False,False,False,,False,,False,,False,,False,,False,,False,False,False,False,False,False,False,False
4856,immunopeptidomics,Noun,The branch of molecular biology that studies the set of immunopeptides of an organism,True,,False,False,False,False,False,False,False,False,False,False,False,False,False,False,False,False,False,False,False,False,False,,False,,False,,False,,False,,False,,False,False,False,False,False,False,False,False
4868,immunopharmacology,Noun,The branch of pharmacology that deals with the immune system,True,,False,False,False,False,False,False,False,False,False,False,False,False,False,False,False,False,False,False,False,False,False,,False,,False,,False,,False,,False,,False,False,False,False,False,False,False,False
4961,immunoproteomics,Noun,"The study of an immunoproteome 2016 February 24, Identification of Immunoreactive Leishmania infantum Protein Antigens to Asymptomatic Dog Sera through Combined Immunoproteomics and Bioinformatics Analysis, in PLOS ONE[1], DOI:10.1371/journal.pone.0149894:Our results suggest that the combination of immunoproteomics and bioinformatics analyses is a promising method for the identification of novel candidate antigens for vaccine development or with potential use in the development of sensitive diagnostic tests.",True,,False,False,False,False,False,False,False,False,False,False,False,False,False,False,False,False,False,False,False,False,False,,False,,False,,False,,False,,False,,False,False,False,False,False,False,False,False
5052,immunoserology,Noun,The branch of serology that involves studies of the immune response,True,,False,False,False,False,False,False,False,False,False,False,False,False,False,False,False,False,False,False,False,False,False,,False,,False,,False,,False,,False,,False,False,False,False,False,False,False,False
5188,immunotoxicology,Noun,The study of dysfunction of the immune system caused by a xenobiotic,True,,False,False,False,False,False,False,False,False,False,False,False,False,False,False,False,False,False,False,False,False,False,,False,,False,,False,,False,,False,,False,False,False,False,False,False,False,False
5219,immunovirology,Noun,The study of the interactions between viruses and the immune system,True,,False,False,False,False,False,False,False,False,False,False,False,False,False,False,False,False,False,False,False,False,False,,False,,False,,False,,False,,False,,False,False,False,False,False,False,False,False
6171,implantology,Noun,The science of or techniques involved in dental implants,True,"2015 December 15, Antibacterial Peptide-Based Gel for Prevention of Medical Implanted-Device Infection, in PLOS ONE[1], DOI:10.1371/journal.pone.0145143:In oral implantology, bacteria are present in dental plaque and along with in the microgap between implant and prosthesis screws on implants.",False,False,False,False,False,False,False,False,False,False,False,False,False,False,False,False,False,False,False,False,False,,False,,False,,False,,False,,False,,False,False,False,False,False,False,False,False
12191,infectiology,Noun,"The study of infection 2015 September 24, Individual Monitoring of Immune Response in Atlantic Salmon Salmo salar following Experimental Infection with Infectious Salmon Anaemia Virus (ISAV), in PLOS ONE[1], DOI:10.1371/journal.pone.0137767:We describe here a novel approach to infectiology for salmonid fish where blood samples are collected repeatedly in a small group of PIT-tagged animals.",True,,False,False,False,False,False,False,False,False,False,False,False,False,False,False,False,False,False,False,False,False,False,,False,,False,,False,,False,,False,,False,False,False,False,False,False,False,False
13095,information management,Noun,"the study of the acquisition of information from one or more sources, the custodianship and the distribution of that information to those who need it, and its ultimate disposition through archiving or deletion.",True,,False,False,False,False,False,False,False,False,False,False,False,False,False,False,False,False,False,False,False,False,False,,False,,False,,False,,False,,False,,False,False,False,False,False,False,False,False
13102,information retrieval,Noun,"The science of searching for information in documents, searching for documents themselves, searching for metadata which describe documents, or searching within databases, whether relational stand-alone databases or hypertextually-networked databases such as the World Wide Web.",True,,False,False,False,False,False,False,False,False,False,False,False,False,False,False,False,False,False,False,False,False,False,,False,,False,,False,,False,,False,,False,False,False,False,False,False,False,False
13190,informetrics,Noun,The study of quantitative aspects of information,True,,False,False,False,False,False,False,False,False,False,False,False,False,False,False,False,False,False,False,False,False,False,,False,,False,,False,,False,,False,,False,False,False,False,False,False,False,False
17489,integumation,Noun,The branch of physiology that deals with the integuments of animals and plants.,True,,False,False,False,False,False,False,False,False,False,False,False,False,False,False,False,False,False,False,False,False,False,,False,,False,,False,,False,,False,,False,False,False,False,False,False,False,False
17893,interactionism,Noun,The branch of sociology that studies interaction between individuals or groups,True,,False,False,False,False,False,False,False,False,False,False,False,False,False,False,False,False,False,False,False,False,False,,False,,False,,False,,False,,False,,False,False,False,False,False,False,False,False
17914,interactomics,Noun,The study of the interactions between proteins and other components of a cell,True,,False,False,False,False,False,False,False,False,False,False,False,False,False,False,False,False,False,False,False,False,False,,False,,False,,False,,False,,False,,False,False,False,False,False,False,False,False
18974,interferomics,Noun,The study of interferomes,True,,False,False,False,False,False,False,False,False,False,False,False,False,False,False,False,False,False,False,False,False,False,,False,,False,,False,,False,,False,,False,False,False,False,False,False,False,False
19507,interlinguistics,Noun,"The study of international communication, focused especially on planned international auxiliary languages and having e.g",True,Esperanto and Interlingua as a chief applied product.,False,False,False,False,False,False,False,False,False,False,False,False,False,False,False,False,False,False,False,False,False,,False,,False,,False,,False,,False,,False,False,False,False,False,False,False,False
20042,international relations,Noun,"The study of relationships among countries, commonly abbreviated as IR.",True,,False,False,False,False,False,False,False,False,False,False,False,False,False,False,False,False,False,False,False,False,False,,False,,False,,False,,False,,False,,False,False,False,False,False,False,False,False
20887,intersectionalism,Noun,"The study of minorities within minorities, or intersections between minorities; specifically, the study of the interactions of multiple systems of oppression or discrimination.",True,,False,False,False,False,False,False,False,False,False,False,False,False,False,False,False,False,False,False,False,False,False,,False,,False,,False,,False,,False,,False,False,False,False,False,False,False,False
20895,intersectionality,Noun,"The study of (or a sociological methodology of studying) overlapping or intersecting social identities and related systems of oppression, domination, or discrimination",True,"1989, Kimberl [Williams] Crenshaw, Demarginalizing the Intersection of Race and Sex: A Black Feminist Critique of Antidiscrimination Doctrine, Feminist Theory and Antiracist Politics, in The University of Chicago Legal Forum[1], volume 139, archived from the original on 6 May 2016, page 141:One way to approach the problem of intersectionality is to examine how courts frame and interpret the stories of Black women plaintiffs. 2012, Kalwant Bhopal; John Preston, Introduction: Intersectionality and Race in Education: Theorising Difference, in Kalwant Bhopal and John Preston, editors, Intersectionality and Race in Education, New York, N.Y.; Abingdon, Oxon.: Routledge, ISBN, page 1:This book is about intersectionality and is particularly concerned with examining theorising intersectionalities and difference. In recent years, the concept of intersectionality has taken centre stage and has become a dominant model with which to engage in how differences such as race, gender, class, sexuality, age, disability and religion interweave and intersect upon individual lives in a modern risk society[]. 2016, Patricia Hill Collins; Sirma Bilge, What is Intersectionality?, in Intersectionality (Key Concepts), Cambridge; Malden, Mass.: Polity Press, ISBN:Intersectionality is a way of understanding and analyzing the complexity in the world, in people, and in human experiences. The events and conditions of social and political life and the self can seldom be understood as shaped by one factor. They are generally shaped by many factors in diverse and mutually influencing ways. [] Intersectionality as an analytic tool gives people better access to the complexity of the world and of themselves.",False,False,False,False,False,False,False,False,False,False,False,False,False,False,False,False,False,False,False,False,False,,False,,False,,False,,False,,False,,False,False,False,False,False,False,False,False
22129,intracrinology,Noun,The study of intracrine hormones and their related disorders,True,,False,False,False,False,False,False,False,False,False,False,False,False,False,False,False,False,False,False,False,False,False,,False,,False,,False,,False,,False,,False,False,False,False,False,False,False,False
23660,invariant theory,Noun,The branch of algebra concerned with actions of groups on algebraic varieties from the point of view of their effect on functions,True,"1993, Bernd Sturmfels, Introduction, David Hilbert, Reinhard C. Laubenbacher (translator and editor), Bernd Sturmfels (editor), Theory of Algebraic Invariants, Cambridge University Press, page xi, Today, invariant theory is often understood as a branch of representation theory, algebraic geometry, commutative algebra, and algebraic combinatorics. Each of these four disciplines has roots in nineteenth-century invariant theory. [] In modern terms, the basic problem of invariant theory can be categorized as follows. Let V {\displaystyle V} be a K {\displaystyle K} -vector space on which a group G {\displaystyle G} acts linearly. In the ring of polynomial functions K [ V ] {\displaystyle K[V]} consider the subring K [ V ] G {\displaystyle K[V]^{G}} consisting of all polynomial functions on V {\displaystyle V} which are invariant under the action of the group G {\displaystyle G} . The basic problem is to describe the invariant ring K [ V ] G {\displaystyle K[V]^{G}} . In particular, we would like to know whether K [ V ] G {\displaystyle K[V]^{G}} is finitely generated as a K {\displaystyle K} -algebra and, if so, to give an algorithm for computing generators. 2001, Gian-Carlo Rota, What is invariant theory, really?, H. Crapo, D. Senato (editors), Algebraic Combinatorics and Computer Science: A Tribute to Gian-Carlo Rota, Springer, page 41, Invariant theory is the great romantic story of mathematics. [] In our century, Lie theory and algebraic geometry, differential algebra and algebraic combinatorics are all offsprings of invariant theory. 2009, Roe Goodman, Nolan R. Wallach, Symmetry, Representations, and Invariants, Springer, page 225, For a linear algebraic group G {\displaystyle G} and a regular representation ( , V ) {\displaystyle (\rho ,V)} of G {\displaystyle G} , the basic problem of invariant theory is to describe the G {\displaystyle G} -invariant elements ( k V ) G {\displaystyle ({\bigotimes }^{k}V)^{G}} of the k {\displaystyle k} -fold tensor product for all k {\displaystyle k} .",False,False,False,False,False,False,False,False,False,False,False,False,False,False,False,False,False,False,False,False,False,,False,,False,,False,,False,,False,,False,False,False,False,False,False,False,False
23898,inversive geometry,Noun,"The branch of geometry concerned with inversion transformations, specifically circle inversions in the Euclidean plane, but also as generalised in non-Euclidean and higher-dimensional spaces",True,"1983, John Willard Milnor, On the Geometry of the Kepler Problem, The American Mathematical Monthly, Volume 90, reprinted in 1994, John Milnor, Collected Papers, I: Geometry, page 261, In particular, the non-Euclidean geometry of Lobachevsky and Bolyai, and the inversive geometry of Steiner play an important role. 1999, David A. Brannan, Matthew F. Esplen, Jeremy J. Gray, Geometry, page 2, The study of properties of such families of circles gave rise to a new geometry, called inversive geometry, which was able to provide particularly striking proofs of previously known results in Euclidean geometry as well as new results. 2007, Elena Anne Marchisotto, James T. Smith, The Legacy of Mario Pieri in Geometry and Arithmetic, page 143, Even after that, despite the need identified by Klein, Kasner, and J. W. Young, foundations of inversive geometry did not receive much research attention. David Hilbert's school at Gttingen spawned an axiomatization of inversive geometry by B. L. van der Waerden and Lucas J. Smid in 1935.",False,False,False,False,False,False,False,False,False,False,False,False,False,False,False,False,False,False,False,False,False,,False,,False,,False,,False,,False,,False,False,False,False,False,False,False,False
24818,ionics,Noun,The study of ionic conductors.,True,,False,False,False,False,False,False,False,False,False,False,False,False,False,False,False,False,False,False,False,False,False,,False,,False,,False,,False,,False,,False,False,False,False,False,False,False,False
24866,ionomics,Noun,The study of ionomes,True,,False,False,False,False,False,False,False,False,False,False,False,False,False,False,False,False,False,False,False,False,False,,False,,False,,False,,False,,False,,False,False,False,False,False,False,False,False
26823,isoenzymology,Noun,The study of isoenzymes,True,,False,False,False,False,False,False,False,False,False,False,False,False,False,False,False,False,False,False,False,False,False,,False,,False,,False,,False,,False,,False,False,False,False,False,False,False,False
27374,isoperimetry,Noun,The study of isoperimetric structures.,True,,False,False,False,False,False,False,False,False,False,False,False,False,False,False,False,False,False,False,False,False,False,,False,,False,,False,,False,,False,,False,False,False,False,False,False,False,False
27807,isotopic chemistry,Noun,"The study of the effects of isotopic substitution on chemical compounds, especially on the kinetics of their reactions.",True,,False,False,False,False,False,False,False,False,False,False,False,False,False,False,False,False,False,False,False,False,False,,False,,False,,False,,False,,False,,False,False,False,False,False,False,False,False
27816,isotopics,Noun,"The study of isotopes, especially stable isotopes.",True,,False,False,False,False,False,False,False,False,False,False,False,False,False,False,False,False,False,False,False,False,False,,False,,False,,False,,False,,False,,False,False,False,False,False,False,False,False
281,dactyliology,Noun,The branch of archaeology dealing with gem engraving.,True,,False,False,False,False,False,False,False,False,False,False,False,False,False,False,False,False,False,False,False,False,False,,False,,False,,False,,False,,False,,False,False,False,False,False,False,False,False
