Unnamed: 0,term,pos,definition,domain,supplementary_info,obsolete,slang,dated,rare,vulgar,offensive,slur,astrology,mythology,jargon,euphemistic,informal,humorous,literary,literature,childish,folklore,colloquial,nonstandard,theology,abbreviation,abbreviation_for_term,plural,plural_for_term,misspelling,misspelling_for_term,acronym,acronym_for_term,synonym,synonym_for_term,antonym,antonym_for_term,attribute,property,process,matter,role,measure,units,body
26787,micrometabolomics,Noun,The study of the range of metabolites present in a very small biological sample,True,,False,False,False,False,False,False,False,False,False,False,False,False,False,False,False,False,False,False,False,False,False,,False,,False,,False,,False,,False,,False,False,False,False,False,False,False,False
27054,micropaleontology,Noun,"The branch of paleontology dealing with the fossilized microscopic organic remains (microfossils) of the geologic past; including their structure, biology, relationships and distribution.",True,,False,False,False,False,False,False,False,False,False,False,False,False,False,False,False,False,False,False,False,False,False,,False,,False,,False,,False,,False,,False,False,False,False,False,False,False,False
27055,micropalynology,Noun,"The study of pollen traces 2015 December 24, Taxonomic Characterization of Honey Bee ( Apis mellifera ) Pollen Foraging Based on Non-Overlapping Paired-End Sequencing of Nuclear Ribosomal Loci, in PLOS ONE[1], DOI:10.1371/journal.pone.0145365:To date, comparisons of micropalynology and metagenetics indicate that the latter is effective in identifying pollen sources, but read counts may not be consistently related to visual counts.",True,,False,False,False,False,False,False,False,False,False,False,False,False,False,False,False,False,False,False,False,False,False,,False,,False,,False,,False,,False,,False,False,False,False,False,False,False,False
27563,microrheology,Noun,The branch of rheology that deals with emulsions and heterogeneous mixtures,True,,False,False,False,False,False,False,False,False,False,False,False,False,False,False,False,False,False,False,False,False,False,,False,,False,,False,,False,,False,,False,False,False,False,False,False,False,False
27673,microscopy,Noun,"the study of microscopes, their design and manufacture",True,,False,False,False,False,False,False,False,False,False,False,False,False,False,False,False,False,False,False,False,False,False,,False,,False,,False,,False,,False,,False,False,False,False,False,False,False,False
28201,microtribology,Noun,The branch of tribology that studies interactions between very small surfaces,True,,False,False,False,False,False,False,False,False,False,False,False,False,False,False,False,False,False,False,False,False,False,,False,,False,,False,,False,,False,,False,False,False,False,False,False,False,False
28356,microwave spectroscopy,Noun,The study of the interaction of matter with electromagnetic radiation in the microwave region of the spectrum.,True,,False,False,False,False,False,False,False,False,False,False,False,False,False,False,False,False,False,False,False,False,False,,False,,False,,False,,False,,False,,False,False,False,False,False,False,False,False
31485,mineralogy,Noun,The branch of petrology that studies minerals.,True,,False,False,False,False,False,False,False,False,False,False,False,False,False,False,False,False,False,False,False,False,False,,False,,False,,False,,False,,False,,False,False,False,False,False,False,False,False
32212,mining engineering,Noun,The branch of engineering that is applied to mining.,True,,False,False,False,False,False,False,False,False,False,False,False,False,False,False,False,False,False,False,False,False,False,,False,,False,,False,,False,,False,,False,False,False,False,False,False,False,False
36343,missilery,Noun,The science of missiles.,True,,False,False,False,False,False,False,False,False,False,False,False,False,False,False,False,False,False,False,False,False,False,,False,,False,,False,,False,,False,,False,False,False,False,False,False,False,False
37291,mitogenomics,Noun,The study of the complete genome of the mitochondrion of an organism,True,,False,False,False,False,False,False,False,False,False,False,False,False,False,False,False,False,False,False,False,False,False,,False,,False,,False,,False,,False,,False,False,False,False,False,False,False,False
37815,mnemonics,Noun,The study of techniques for remembering anything more easily.,True,,False,False,False,False,False,False,False,False,False,False,False,False,False,False,False,False,False,False,False,False,False,,False,,False,,False,,False,,False,,False,False,False,False,False,False,False,False
38136,mociology,Noun,The study of how people adapt and use wireless technologies.,True,,False,False,False,False,False,False,False,False,False,False,False,False,False,False,False,False,False,False,False,False,False,,False,,False,,False,,False,,False,,False,False,False,False,False,False,False,False
38552,modern algebra,Noun,"The branch of mathematics that deals with groups, monoids, fields, and like algebraic structures.",True,,False,False,False,False,False,False,False,False,False,False,False,False,False,False,False,False,False,False,False,False,False,,False,,False,,False,,False,,False,,False,False,False,False,False,False,False,False
38675,modificomics,Noun,The study of posttranslational modifications of the proteins associated with a particular genome,True,,False,False,False,False,False,False,False,False,False,False,False,False,False,False,False,False,False,False,False,False,False,,False,,False,,False,,False,,False,,False,False,False,False,False,False,False,False
39343,molecular biology,Noun,"the branch of biology that studies the macromolecules of life, such as proteins, lipoproteins and nucleic acids",True,,False,False,False,False,False,False,False,False,False,False,False,False,False,False,False,False,False,False,False,False,False,,False,,False,,False,,False,,False,,False,False,False,False,False,False,False,False
39344,molecular biology,Noun,the branch of biology that studies the manipulation of genetic sequence of DNA,True,,False,False,False,False,False,False,False,False,False,False,False,False,False,False,False,False,False,False,False,False,False,,False,,False,,False,,False,,False,,False,False,False,False,False,False,False,False
39357,molecular dynamics,Noun,The study of the physical movement of collections of atoms and molecules as they interact,True,,False,False,False,False,False,False,False,False,False,False,False,False,False,False,False,False,False,False,False,False,False,,False,,False,,False,,False,,False,,False,False,False,False,False,False,False,False
39371,molecular medicine,Noun,"the branch of medicine that studies the manipulation of genes, and the subsequent effect on genetic diseases",True,,False,False,False,False,False,False,False,False,False,False,False,False,False,False,False,False,False,False,False,False,False,,False,,False,,False,,False,,False,,False,False,False,False,False,False,False,False
39476,molinology,Noun,The study of mills.,True,,False,False,False,False,False,False,False,False,False,False,False,False,False,False,False,False,False,False,False,False,False,,False,,False,,False,,False,,False,,False,False,False,False,False,False,False,False
42894,monsterology,Noun,The study of monsters or cryptids.,True,,False,False,False,False,False,False,False,False,False,False,False,False,False,False,False,False,False,False,False,False,False,,False,,False,,False,,False,,False,,False,False,False,False,False,False,False,False
42895,monsterology,Noun,The study of the Monster group.,True,,False,False,False,False,False,False,False,False,False,False,False,False,False,False,False,False,False,False,False,False,False,,False,,False,,False,,False,,False,,False,False,False,False,False,False,False,False
44030,moralistics,Noun,The study of morals.,True,,False,False,False,False,False,False,False,False,False,False,False,False,False,False,False,False,False,False,False,False,False,,False,,False,,False,,False,,False,,False,False,False,False,False,False,False,False
44544,morphemics,Noun,"The study of morphemes, or of the morphemic structure of a language.",True,,False,False,False,False,False,False,False,False,False,False,False,False,False,False,False,False,False,False,False,False,False,,False,,False,,False,,False,,False,,False,False,False,False,False,False,False,False
44611,morphoanatomy,Noun,The study of anatomical forms and structures with emphasis on characteristics useful in distinguishing the species.,True,,False,False,False,False,False,False,False,False,False,False,False,False,False,False,False,False,False,False,False,False,False,,False,,False,,False,,False,,False,,False,False,False,False,False,False,False,False
44628,morphodynamics,Noun,The study of the changing morphology of geologic surfaces.,True,,False,False,False,False,False,False,False,False,False,False,False,False,False,False,False,False,False,False,False,False,False,,False,,False,,False,,False,,False,,False,False,False,False,False,False,False,False
44648,morphogenetics,Noun,The study of morphogenesis,True,"1963, Advances in Botanical Research[1], ISBN, page 182: The pollen grains are usually very large and well suited for studies in morphogenetics, fine structure, etc. 1990, Roger Wolcott Sperry, Brain Circuits and Functions of the Mind[2], ISBN, page 105: This process relies on the spatiotemporal aspects of morphogenesis, called morphogenetics (Horder and Martin 1978), for the assembly of most of the projection.",False,False,False,False,False,False,False,False,False,False,False,False,False,False,False,False,False,False,False,False,False,,False,,False,,False,,False,,False,,False,False,False,False,False,False,False,False
44705,morphomechanics,Noun,The study of (the relationship between) morphology and mechanical properties.,True,,False,False,False,False,False,False,False,False,False,False,False,False,False,False,False,False,False,False,False,False,False,,False,,False,,False,,False,,False,,False,False,False,False,False,False,False,False
44713,morphometrics,Noun,The study of the relationships between the form and function of organisms.,True,,False,False,False,False,False,False,False,False,False,False,False,False,False,False,False,False,False,False,False,False,False,,False,,False,,False,,False,,False,,False,False,False,False,False,False,False,False
44734,morphopathology,Noun,The branch of pathology that deals with pathological changes to morphology,True,,False,False,False,False,False,False,False,False,False,False,False,False,False,False,False,False,False,False,False,False,False,,False,,False,,False,,False,,False,,False,False,False,False,False,False,False,False
44799,morphotectonics,Noun,The study of superficial evidences of tectonic activity.,True,,False,False,False,False,False,False,False,False,False,False,False,False,False,False,False,False,False,False,False,False,False,,False,,False,,False,,False,,False,,False,False,False,False,False,False,False,False
45087,mortuary science,Noun,The study of deceased bodies through mortuary work.,True,,False,False,False,False,False,False,False,False,False,False,False,False,False,False,False,False,False,False,False,False,False,,False,,False,,False,,False,,False,,False,False,False,False,False,False,False,False
53828,mycobacteriology,Noun,The study of mycobacteria,True,,False,False,False,False,False,False,False,False,False,False,False,False,False,False,False,False,False,False,False,False,False,,False,,False,,False,,False,,False,,False,False,False,False,False,False,False,False
53898,mycology,Noun,"The study of fungi, in the wide sense.",True,,False,False,False,False,False,False,False,False,False,False,False,False,False,False,False,False,False,False,False,False,False,,False,,False,,False,,False,,False,,False,False,False,False,False,False,False,False
53976,mycoserology,Noun,The study of fungi in the blood,True,,False,False,False,False,False,False,False,False,False,False,False,False,False,False,False,False,False,False,False,False,False,,False,,False,,False,,False,,False,,False,False,False,False,False,False,False,False
54013,mycotoxicology,Noun,The study of mycotoxins.,True,,False,False,False,False,False,False,False,False,False,False,False,False,False,False,False,False,False,False,False,False,False,,False,,False,,False,,False,,False,,False,False,False,False,False,False,False,False
54884,myrmecology,Noun,The study of ants.,True,,False,False,False,False,False,False,False,False,False,False,False,False,False,False,False,False,False,False,False,False,False,,False,,False,,False,,False,,False,,False,False,False,False,False,False,False,False
55289,mythonomy,Noun,"The study of myths in general and how they develop, as contrasted with mythology, the study of specific existing myths.",True,,False,False,False,False,False,False,False,False,False,False,False,False,False,False,False,False,False,False,False,False,False,,False,,False,,False,,False,,False,,False,False,False,False,False,False,False,False
334,xenoanthropology,Noun,The branch of xenology dealing with extraterrestrial cultures.,True,,False,False,False,False,False,False,False,False,False,False,False,False,False,False,False,False,False,False,False,False,False,,False,,False,,False,,False,,False,,False,False,False,False,False,False,False,False
360,xenobotany,Noun,The study of alien plants,True,"2008, Eric Flint, Dave Freer, Slow Train to Arcturus An oddly lucid part of his stunned mind registered that these were the first fruiting bodies he'd seen. But this was hardly the time for exercising one of the specialties that had got him onto the intercept ship, xenobotany. 2012, David Mack, Star Trek: Vanguard: Storming Heaven Terrell quipped to the new tactical officer, He also holds doctorates in archaeology and xenobotany. So, if you get the urge to debate him about fossils or flowers . . . don't.",False,False,False,False,False,False,False,False,False,False,False,False,False,False,False,False,False,False,False,False,False,,False,,False,,False,,False,,False,,False,False,False,False,False,False,False,False
500,xenology,Noun,The study of alien life.,True,,False,False,False,False,False,False,False,False,False,False,False,False,False,False,False,False,False,False,False,False,False,,False,,False,,False,,False,,False,,False,False,False,False,False,False,False,False
529,xenonatomy,Noun,The study of alien anatomy,True,"2000, A.C. Crispin, Time For Yesterday Until yesterday, McCoy had been teaching a course in Xenoanatomy at the Starfleet medical school on Prima, parsecs away. 2008, Joe Haldeman , Marsbound The argument was that decisions had to be made by someone who was not herself a specialist, so she wouldn't give preferential treatment to xenoanatomy or linguistics or whatever. Martian cuisine. 2014, William C Dietz, Drifter's War I took a course in xenoanatomy. We dissected a variety of human corpses. 2015, Tanya Huff , An Ancient Peace I didn't know you were all up on xenoanatomy. I'm not. Ressk set the blade above the uppermost hole in the skull and began to draw the saw back and forth. It caught on the desiccated flesh, bucked, then bit into bone.",False,False,False,False,False,False,False,False,False,False,False,False,False,False,False,False,False,False,False,False,False,,False,,False,,False,,False,,False,,False,False,False,False,False,False,False,False
631,xenotheology,Noun,The study of alien religion,True,"2011, Sheri S. Tepper, Raising The Stones ... had added a number of generalists, who had done research in such fields as religious history, xenotheology, deconstruction of scriptures, the anatomy and chemistry of revelation, and the social and economic consequences of prophecy. 2015, John Grant, The Hundredfold Problem The few she'd spoken with so far had proved to be not only more intelligent than herself but also wiser. Of course, it was possible that it was an illusion: one of the first lessons she had learnt in her undergraduate xenotheology courses back at ...",False,False,False,False,False,False,False,False,False,False,False,False,False,False,False,False,False,False,False,False,False,,False,,False,,False,,False,,False,,False,False,False,False,False,False,False,False
679,xenozoology,Noun,The branch of xenology dealing with extraterrestrial animals.,True,,False,False,False,False,False,False,False,False,False,False,False,False,False,False,False,False,False,False,False,False,False,,False,,False,,False,,False,,False,,False,False,False,False,False,False,False,False
1310,Riemannian geometry,Noun,The branch of differential geometry that concerns Riemannian manifolds; an example of a geometry that involves Riemannian manifolds,True,"2001, Mikls Farkas, Dynamical Models in Biology[1], page 171:Riemannian geometry was introduced by Riemann in 1854 as the n-dimensional generalization of the theory of curved surfaces of the 3D Euclidean space. 2005, John F. Hawley, Katherine A. Holcomb, Foundations of Modern Cosmology, 2nd Edition, page 235, Such geometries are called Riemannian geometries; they are characterized by invariant distances (for example, the space-time interval) that depend at most on the squares of the coordinate distances (x or t). 2010, Saul Stahl, Geometry from Euclid to Knots[2], page 22:Riemannian geometry has found many applications in science, the most spectacular of these being the theory of relativity. [] Every Riemannian geometry has geodesics, which are defined as the shortest curves joining two points. 2010, Ilka Agricola, Chapter 9: Non-integrable geometries, torsion, and holonomy, Vicente Corts (editor), Handbook of Pseudo-Riemannian Geometry and Supersymmetry, page 278, At the beginning of the seventies, A. Gray generalized the classical holonomy concept by introducing a classification principle for non-integrable special Riemannian geometries [and] discovered in this context nearly Khler manifolds in dimension six and nearly parallel G2-manifolds in dimension seven. 2013, Andrew McInerney, First Steps in Differential Geometry: Riemannian, Contact, Symplectic[3], page 195:The concepts of Riemannian geometry are familiar: length, angle, distance, and curvature, among others. Historically tied to the origins of differential geometry, and with such familiar concepts, Riemannian geometry is often presented in textbooks as being synonymous with differential geometry itself, instead of as one differential-geometric structure among many.",False,False,False,False,False,False,False,False,False,False,False,False,False,False,False,False,False,False,False,False,False,,False,,False,,False,,False,,False,,False,False,False,False,False,False,False,False
1368,Ripperology,Noun,"The study of Jack the Ripper, an unidentified serial killer active around the Whitechapel district of London in the late 19th century.",True,,False,False,False,False,False,False,False,False,False,False,False,False,False,False,False,False,False,False,False,False,False,,False,,False,,False,,False,,False,,False,False,False,False,False,False,False,False
1649,Romanistics,Noun,The study of Roman law.,True,,False,False,False,False,False,False,False,False,False,False,False,False,False,False,False,False,False,False,False,False,False,,False,,False,,False,,False,,False,,False,False,False,False,False,False,False,False
1650,Romanistics,Noun,The study of Romance languages.,True,,False,False,False,False,False,False,False,False,False,False,False,False,False,False,False,False,False,False,False,False,False,,False,,False,,False,,False,,False,,False,False,False,False,False,False,False,False
1669,Romanology,Noun,The study of Romania and its people.,True,,False,False,False,False,False,False,False,False,False,False,False,False,False,False,False,False,False,False,False,False,False,,False,,False,,False,,False,,False,,False,False,False,False,False,False,False,False
1000,Egyptology,Noun,The study of ancient Egypt.,True,,False,False,False,False,False,False,False,False,False,False,False,False,False,False,False,False,False,False,False,False,False,,False,,False,,False,,False,,False,,False,False,False,False,False,False,False,False
1570,Eskimology,Noun,The study of the Eskimo people.,True,,False,False,False,False,False,False,False,False,False,False,False,False,False,False,False,False,False,False,False,False,False,,False,,False,,False,,False,,False,,False,False,False,False,False,False,False,False
1685,Etruscology,Noun,The study of the Etruscans.,True,,False,False,False,False,False,False,False,False,False,False,False,False,False,False,False,False,False,False,False,False,False,,False,,False,,False,,False,,False,,False,False,False,False,False,False,False,False
745,Galois theory,Noun,"The branch of mathematics dealing with Galois groups, Galois fields, and polynomial equations",True,"1989, G. Karpilovsky, Topics in Field Theory, North-Holland, page 299, In this chapter we present the Galois theory which may be described as the analysis of field extensions by means of automorphism groups. 1989, Donald S. Passman, Infinite Crossed Products, Academic Press, page 297, The Galois theory of noncommutative rings is a natural outgrowth of the Galois theory of fields. 1992, Journal of Contemporary Mathematical Analysis, Volume 27, Allerton Press, page 4, Though often our results are prompted by the classical or parallel Galois theories, their proofs are completely different and are based on the set-theoretical approach. 2003, Introduction, Leila Schneps (editor), Galois Groups and Fundamental Groups, Cambridge, University Press, page ix, Classical Galois theory has developed a number of extensions and ramifications into more specific theories, which combine it with other areas of mathematics or restate its main problems in different situations. Three of the most important are geometric Galois theory, differential Galois theory, and Lie Galois theory, all of which have undergone very rapid development in recent years.",False,False,False,False,False,False,False,False,False,False,False,False,False,False,False,False,False,False,False,False,False,,False,,False,,False,,False,,False,,False,False,False,False,False,False,False,False
1393,Palestinianism,Noun,"The study of Palestinian history, anthropology, or archeology",True,,False,False,False,False,False,False,False,False,False,False,False,False,False,False,False,False,False,False,False,False,False,,False,,False,,False,,False,,False,,False,False,False,False,False,False,False,False
243,ufology,Noun,The study of UFOs.,True,,False,False,False,False,False,False,False,False,False,False,False,False,False,False,False,False,False,False,False,False,False,,False,,False,,False,,False,,False,,False,False,False,False,False,False,False,False
11648,unfoldomics,Noun,The study of unfoldomes,True,,False,False,False,False,False,False,False,False,False,False,False,False,False,False,False,False,False,False,False,False,False,,False,,False,,False,,False,,False,,False,False,False,False,False,False,False,False
14740,universology,Noun,The science of the universe,True,"1872, ""Contemporary Literature: Theology and Philosophy,"" Westminster Review, vol. 98, p. 101: Mr. Andrews . . . also finds three primitive laws or fundamental principles of universology, which he calls Unism, Duism, and Trinism.",False,False,False,False,False,False,False,False,False,False,False,False,False,False,False,False,False,False,False,False,False,,False,,False,,False,,False,,False,,False,False,False,False,False,False,False,False
25807,urban planning,Noun,The science of such design.,True,,False,False,False,False,False,False,False,False,False,False,False,False,False,False,False,False,False,False,False,False,False,,False,,False,,False,,False,,False,,False,False,False,False,False,False,False,False
25845,urbanism,Noun,"the study of cities, their geographic, economic, political, social and cultural environment",True,,False,False,False,False,False,False,False,False,False,False,False,False,False,False,False,False,False,False,False,False,False,,False,,False,,False,,False,,False,,False,False,False,False,False,False,False,False
25877,urbanology,Noun,The branch of sociology that studies the problems of living in cities and towns.,True,,False,False,False,False,False,False,False,False,False,False,False,False,False,False,False,False,False,False,False,False,False,,False,,False,,False,,False,,False,,False,False,False,False,False,False,False,False
26295,urinology,Noun,The study of urine as a way to analyse a patient's health.,True,,False,False,False,False,False,False,False,False,False,False,False,False,False,False,False,False,False,False,False,False,False,,False,,False,,False,,False,,False,,False,False,False,False,False,False,False,False
808,Fermiology,Noun,The study of the configuration (shape and size) of Fermi surfaces.,True,,False,False,False,False,False,False,False,False,False,False,False,False,False,False,False,False,False,False,False,False,False,,False,,False,,False,,False,,False,,False,False,False,False,False,False,False,False
2664,jet propulsion,Noun,The study of devices propelled by jet propulsion,True,,False,False,False,False,False,False,False,False,False,False,False,False,False,False,False,False,False,False,False,False,False,,False,,False,,False,,False,,False,,False,False,False,False,False,False,False,False
5005,judicial branch,Noun,The branch of government which is concerned with the administration of justice through the interpretation of the law.,True,,False,False,False,False,False,False,False,False,False,False,False,False,False,False,False,False,False,False,False,False,False,,False,,False,,False,,False,,False,,False,False,False,False,False,False,False,False
358,race relations,Noun,The branch of sociology that studies these patterns,True,,False,False,False,False,False,False,False,False,False,False,False,False,False,False,False,False,False,False,False,False,False,,False,,False,,False,,False,,False,,False,False,False,False,False,False,False,False
