Unnamed: 0,term,pos,definition,domain,supplementary_info,obsolete,slang,dated,rare,vulgar,offensive,slur,astrology,mythology,jargon,euphemistic,informal,humorous,literary,literature,childish,folklore,colloquial,nonstandard,theology,abbreviation,abbreviation_for_term,plural,plural_for_term,misspelling,misspelling_for_term,acronym,acronym_for_term,synonym,synonym_for_term,antonym,antonym_for_term,attribute,property,process,matter,role,measure,units,body
24051,ethopharmacology,Noun,The study of the effects of pharmaceutical drugs on behaviour,True,,False,False,False,False,False,False,False,False,False,False,False,False,False,False,False,False,False,False,False,False,False,,False,,False,,False,,False,,False,,False,False,False,False,False,False,False,False
24416,etymology,Noun,"The study of the historical development of languages, particularly as manifested in individual words.",True,,False,False,False,False,False,False,False,False,False,False,False,False,False,False,False,False,False,False,False,False,False,,False,,False,,False,,False,,False,,False,False,False,False,False,False,False,False
24451,eubiotics,Noun,The science of hygienic and healthy living.,True,,False,False,False,False,False,False,False,False,False,False,False,False,False,False,False,False,False,False,False,False,False,,False,,False,,False,,False,,False,,False,False,False,False,False,False,False,False
24694,eugenics,Noun,"The science of improving stock, whether human or animal.",True,,False,False,False,False,False,False,False,False,False,False,False,False,False,False,False,False,False,False,False,False,False,,False,,False,,False,,False,,False,,False,False,False,False,False,False,False,False
25032,euphenics,Noun,The science of making biological (phenotypic) improvements to humans after birth.,True,,False,False,False,False,False,False,False,False,False,False,False,False,False,False,False,False,False,False,False,False,False,,False,,False,,False,,False,,False,,False,False,False,False,False,False,False,False
25509,euthenics,Noun,The study of the effects of place on people.,True,,False,False,False,False,False,False,False,False,False,False,False,False,False,False,False,False,False,False,False,False,False,,False,,False,,False,,False,,False,,False,False,False,False,False,False,False,False
25510,euthenics,Noun,The study of improvement of human function when their environment improves.,True,,False,False,False,False,False,False,False,False,False,False,False,False,False,False,False,False,False,False,False,False,False,,False,,False,,False,,False,,False,,False,False,False,False,False,False,False,False
26161,eventology,Noun,"The branch of statistics that deals with random, vague events",True,,False,False,False,False,False,False,False,False,False,False,False,False,False,False,False,False,False,False,False,False,False,,False,,False,,False,,False,,False,,False,False,False,False,False,False,False,False
27165,exanthematology,Noun,The study of exanthem.,True,,False,False,False,False,False,False,False,False,False,False,False,False,False,False,False,False,False,False,False,False,False,,False,,False,,False,,False,,False,,False,False,False,False,False,False,False,False
27695,excitonics,Noun,The study of excitons.,True,,False,False,False,False,False,False,False,False,False,False,False,False,False,False,False,False,False,False,False,False,False,,False,,False,,False,,False,,False,,False,False,False,False,False,False,False,False
28185,executive branch,Noun,The branch of government that oversees the carrying out of the laws,True,,False,False,False,False,False,False,False,False,False,False,False,False,False,False,False,False,False,False,False,False,False,,False,,False,,False,,False,,False,,False,False,False,False,False,False,False,False
28257,exegetics,Noun,The science of interpretation or exegesis.,True,,False,False,False,False,False,False,False,False,False,False,False,False,False,False,False,False,False,False,False,False,False,,False,,False,,False,,False,,False,,False,False,False,False,False,False,False,False
28980,exobiology,Noun,The branch of biology dealing with lifeforms from a different planet,True,"Synonyms: astrobiology, xenobiology",False,False,False,False,False,False,False,False,False,False,False,False,False,False,False,False,False,False,False,False,False,,False,,False,,False,,False,,False,,False,False,False,False,False,False,False,False
29041,exoconsciousness,Noun,"The study of extraterrestrial dimensions of human consciousness: the origins, dimensions, endowments and abilities of human consciousness that link us directly to the cosmos and its inhabitants.",True,,False,False,False,False,False,False,False,False,False,False,False,False,False,False,False,False,False,False,False,False,False,,False,,False,,False,,False,,False,,False,False,False,False,False,False,False,False
29059,exocrinology,Noun,"The study of external (exocrine) secretions, especially of pheromones",True,,False,False,False,False,False,False,False,False,False,False,False,False,False,False,False,False,False,False,False,False,False,,False,,False,,False,,False,,False,,False,False,False,False,False,False,False,False
29181,exogeography,Noun,The study of the physical structure and inhabitants outside the Earth.,True,,False,False,False,False,False,False,False,False,False,False,False,False,False,False,False,False,False,False,False,False,False,,False,,False,,False,,False,,False,,False,False,False,False,False,False,False,False
1985,palaeoecology,Noun,The study of past ecologies by using the evidence of fossils,True,,False,False,False,False,False,False,False,False,False,False,False,False,False,False,False,False,False,False,False,False,False,,False,,False,,False,,False,,False,,False,False,False,False,False,False,False,False
2032,palaeogenomics,Noun,"The study of ancient genomes, especially those of extinct organisms",True,,False,False,False,False,False,False,False,False,False,False,False,False,False,False,False,False,False,False,False,False,False,,False,,False,,False,,False,,False,,False,False,False,False,False,False,False,False
2034,palaeogeochemistry,Noun,The study of the changes in the geochemistry of the Earth over geologic time,True,,False,False,False,False,False,False,False,False,False,False,False,False,False,False,False,False,False,False,False,False,False,,False,,False,,False,,False,,False,,False,False,False,False,False,False,False,False
2039,palaeogeography,Noun,"The study of historical geography of the (chiefly physical, but sometimes political/cultural) geography of the world in the geologic past.",True,,False,False,False,False,False,False,False,False,False,False,False,False,False,False,False,False,False,False,False,False,False,,False,,False,,False,,False,,False,,False,False,False,False,False,False,False,False
2067,palaeohydrology,Noun,The study of ancient rivers and other hydrological features,True,,False,False,False,False,False,False,False,False,False,False,False,False,False,False,False,False,False,False,False,False,False,,False,,False,,False,,False,,False,,False,False,False,False,False,False,False,False
2110,palaeomammalogy,Noun,The study of prehistoric mammals,True,,False,False,False,False,False,False,False,False,False,False,False,False,False,False,False,False,False,False,False,False,False,,False,,False,,False,,False,,False,,False,False,False,False,False,False,False,False
2201,palaeosalinity,Noun,The study of these salinities,True,,False,False,False,False,False,False,False,False,False,False,False,False,False,False,False,False,False,False,False,False,False,,False,,False,,False,,False,,False,,False,False,False,False,False,False,False,False
2259,palaeoxylology,Noun,"the study of fossil wood, whether petrified or not",True,,False,False,False,False,False,False,False,False,False,False,False,False,False,False,False,False,False,False,False,False,False,,False,,False,,False,,False,,False,,False,False,False,False,False,False,False,False
2530,paleoalgology,Noun,The study of fossil algae,True,"1966, United States Joint Publications Research Service, Conferences in the Soviet Bloc - Issue 22, page 10:The conference passed a resolution to publish the works of the conference and also to compile a collection of articles on problems of paleoalgology, which would explain the latest data of a theoretical and applied nature. 1978, Hsinhua Weekly - Issues 1-25, page 24:Paleoalgology is the branch of botany that deals with algae in ancient times. This branch of science is closely related to the studies of the origin of life, ...",False,False,False,False,False,False,False,False,False,False,False,False,False,False,False,False,False,False,False,False,False,,False,,False,,False,,False,,False,,False,False,False,False,False,False,False,False
2547,paleoauxology,Noun,The study of prehistoric change,True,,False,False,False,False,False,False,False,False,False,False,False,False,False,False,False,False,False,False,False,False,False,,False,,False,,False,,False,,False,,False,False,False,False,False,False,False,False
2569,paleobiology,Noun,The branch of biology or paleontology concerned with the study of fossils of plants and animals,True,,False,False,False,False,False,False,False,False,False,False,False,False,False,False,False,False,False,False,False,False,False,,False,,False,,False,,False,,False,,False,False,False,False,False,False,False,False
2579,paleobotany,Noun,The branch of paleontology that deals with the study of plant fossils.,True,,False,False,False,False,False,False,False,False,False,False,False,False,False,False,False,False,False,False,False,False,False,,False,,False,,False,,False,,False,,False,False,False,False,False,False,False,False
2588,paleoceanography,Noun,"The study of the history of the oceans, especially their circulation, chemistry, biogeography, fertility, and sedimentation.",True,,False,False,False,False,False,False,False,False,False,False,False,False,False,False,False,False,False,False,False,False,False,,False,,False,,False,,False,,False,,False,False,False,False,False,False,False,False
2663,paleoecology,Noun,The study of ecology in the ancient past.,True,,False,False,False,False,False,False,False,False,False,False,False,False,False,False,False,False,False,False,False,False,False,,False,,False,,False,,False,,False,,False,False,False,False,False,False,False,False
2686,paleoethnobotany,Noun,The study of plant remains from archaeological sites.,True,,False,False,False,False,False,False,False,False,False,False,False,False,False,False,False,False,False,False,False,False,False,,False,,False,,False,,False,,False,,False,False,False,False,False,False,False,False
2690,paleoethology,Noun,The study of the behaviour of extinct species of humans.,True,,False,False,False,False,False,False,False,False,False,False,False,False,False,False,False,False,False,False,False,False,False,,False,,False,,False,,False,,False,,False,False,False,False,False,False,False,False
2691,paleoethology,Noun,The study of behavior of organisms in the fossil record.,True,,False,False,False,False,False,False,False,False,False,False,False,False,False,False,False,False,False,False,False,False,False,,False,,False,,False,,False,,False,,False,False,False,False,False,False,False,False
2741,paleography,Noun,The study of old or ancient forms of writing.[2],True,,False,False,False,False,False,False,False,False,False,False,False,False,False,False,False,False,False,False,False,False,False,,False,,False,,False,,False,,False,,False,False,False,False,False,False,False,False
2782,paleoimmunology,Noun,"The study of the ancient roots of the immune system 2015 August 6, Despina Moissidou et al., Invasive versus Non Invasive Methods Applied to Mummy Research: Will This Controversy Ever Be Solved?, in BioMed Research International[1], volume 2015, DOI:10.1155/2015/192829:Advances in paleoimmunology [ 48 50 ] and paleomicrobiology through soft/hard tissue analysis and secretion swabs led to the retrospective diagnosis of several pathogens (e.g., salmonellosis, tuberculosis, malaria, human leishmaniasis, and Chagas disease) in mummies [ 51 67 ] and revealed some of their evolutionary patterns [ 68 ].",True,,False,False,False,False,False,False,False,False,False,False,False,False,False,False,False,False,False,False,False,False,False,,False,,False,,False,,False,,False,,False,False,False,False,False,False,False,False
2814,paleolimnology,Noun,The study of the paleoenvironments of inland bodies of water,True,,False,False,False,False,False,False,False,False,False,False,False,False,False,False,False,False,False,False,False,False,False,,False,,False,,False,,False,,False,,False,False,False,False,False,False,False,False
2815,paleolinguistics,Noun,The study of the distant human past by linguistic means.,True,,False,False,False,False,False,False,False,False,False,False,False,False,False,False,False,False,False,False,False,False,False,,False,,False,,False,,False,,False,,False,False,False,False,False,False,False,False
2816,paleolinguistics,Noun,The study of prehistoric languages using linguistic evidence alone to try to reconstruct them.,True,,False,False,False,False,False,False,False,False,False,False,False,False,False,False,False,False,False,False,False,False,False,,False,,False,,False,,False,,False,,False,False,False,False,False,False,False,False
2827,paleology,Noun,The study of antiquities or of the ancient past,True,,False,False,False,False,False,False,False,False,False,False,False,False,False,False,False,False,False,False,False,False,False,,False,,False,,False,,False,,False,,False,False,False,False,False,False,False,False
2835,paleomagnetics,Noun,The study of paleomagnetism,True,,False,False,False,False,False,False,False,False,False,False,False,False,False,False,False,False,False,False,False,False,False,,False,,False,,False,,False,,False,,False,False,False,False,False,False,False,False
2836,paleomagnetism,Noun,The study of the strength and direction of the Earth's magnetic field as it has changed over geologic time,True,"2004, Richard Fortey, The Earth, Folio Society 2011, p. 139: The crucial work on palaeomagnetism was already under way less than ten years after Holmes's first edition.",False,False,False,False,False,False,False,False,False,False,False,False,False,False,False,False,False,False,False,False,False,,False,,False,,False,,False,,False,,False,False,False,False,False,False,False,False
2859,paleomicrobiomics,Noun,The study of prehistoric microbiomes,True,,False,False,False,False,False,False,False,False,False,False,False,False,False,False,False,False,False,False,False,False,False,,False,,False,,False,,False,,False,,False,False,False,False,False,False,False,False
2871,paleoneurology,Noun,The study of the nervous systems of extinct animals,True,,False,False,False,False,False,False,False,False,False,False,False,False,False,False,False,False,False,False,False,False,False,,False,,False,,False,,False,,False,,False,False,False,False,False,False,False,False
2883,paleonutrition,Noun,The study of dietary nutrition in ancient or primitive peoples.,True,,False,False,False,False,False,False,False,False,False,False,False,False,False,False,False,False,False,False,False,False,False,,False,,False,,False,,False,,False,,False,False,False,False,False,False,False,False
2899,paleopalynology,Noun,"The branch of palynology concerned with the study of ancient pollens and spores, rather than with those still extant.",True,,False,False,False,False,False,False,False,False,False,False,False,False,False,False,False,False,False,False,False,False,False,,False,,False,,False,,False,,False,,False,False,False,False,False,False,False,False
2905,paleoparasitology,Noun,"The study of ancient parasites, especially as a branch of archaeology",True,,False,False,False,False,False,False,False,False,False,False,False,False,False,False,False,False,False,False,False,False,False,,False,,False,,False,,False,,False,,False,False,False,False,False,False,False,False
2912,paleopathology,Noun,The study of ancient diseases,True,,False,False,False,False,False,False,False,False,False,False,False,False,False,False,False,False,False,False,False,False,False,,False,,False,,False,,False,,False,,False,False,False,False,False,False,False,False
2917,paleopedology,Noun,The study of geologic soils,True,,False,False,False,False,False,False,False,False,False,False,False,False,False,False,False,False,False,False,False,False,False,,False,,False,,False,,False,,False,,False,False,False,False,False,False,False,False
2919,paleophycology,Noun,"The branch of paleontology that deals with fossil algae 1956, Kanazawa Daigaku, The Science Reports of Kanazawa University - Volumes 5-7, page 254:An endeavor to introduce the biological species concept into paleontologic species has been explored by many progressive paleontologists",True,"But, no such contribution has ever been made in paleophycology. 2009, John P. Smol, Pollution of Lakes and Rivers: A Paleoenvironmental Perspective, ISBN:As most of the primary production in freshwater systems comes from algae, and given that there are many thousands of algal taxa, it is not surprising that paleophycology has played a leading role in paleolimnology. 2012, Daniela Basso Bruno Granier, Calcareous algae in changing environments, in Geodiversitas, volume 34, number 1:We dedicate this special issue to all aspects of quantifying species abundance and the subsequent elaborations of it in paleophycology.",False,False,False,False,False,False,False,False,False,False,False,False,False,False,False,False,False,False,False,False,False,,False,,False,,False,,False,,False,,False,False,False,False,False,False,False,False
2943,paleoprimatology,Noun,The study of ancient (typically extinct) primates,True,,False,False,False,False,False,False,False,False,False,False,False,False,False,False,False,False,False,False,False,False,False,,False,,False,,False,,False,,False,,False,False,False,False,False,False,False,False
2964,paleornithology,Noun,The branch of paleontology that deals with fossil birds.,True,,False,False,False,False,False,False,False,False,False,False,False,False,False,False,False,False,False,False,False,False,False,,False,,False,,False,,False,,False,,False,False,False,False,False,False,False,False
2979,paleoseismology,Noun,"The study of ancient rocks and sediments for evidence of seismic events, such as earthquakes and tsunamis, from times before records were kept.",True,,False,False,False,False,False,False,False,False,False,False,False,False,False,False,False,False,False,False,False,False,False,,False,,False,,False,,False,,False,,False,False,False,False,False,False,False,False
3010,paleotempestology,Noun,The study of past tropical cyclone activity by means of geological evidence and historical documentary records.,True,,False,False,False,False,False,False,False,False,False,False,False,False,False,False,False,False,False,False,False,False,False,,False,,False,,False,,False,,False,,False,False,False,False,False,False,False,False
3035,paleovirology,Noun,"The study of ancient, now-extinct viruses.",True,,False,False,False,False,False,False,False,False,False,False,False,False,False,False,False,False,False,False,False,False,False,,False,,False,,False,,False,,False,,False,False,False,False,False,False,False,False
3049,paleozoology,Noun,"The branch of zoology dealing with fossils, and the creatures that were transformed into them",True,,False,False,False,False,False,False,False,False,False,False,False,False,False,False,False,False,False,False,False,False,False,,False,,False,,False,,False,,False,,False,False,False,False,False,False,False,False
4780,pangenomics,Noun,The study of pangenomes,True,,False,False,False,False,False,False,False,False,False,False,False,False,False,False,False,False,False,False,False,False,False,,False,,False,,False,,False,,False,,False,False,False,False,False,False,False,False
5666,panzootics,Noun,The study of panzootic disease,True,,False,False,False,False,False,False,False,False,False,False,False,False,False,False,False,False,False,False,False,False,False,,False,,False,,False,,False,,False,,False,False,False,False,False,False,False,False
6299,papyrology,Noun,The study of ancient texts written on papyrus.,True,,False,False,False,False,False,False,False,False,False,False,False,False,False,False,False,False,False,False,False,False,False,,False,,False,,False,,False,,False,,False,False,False,False,False,False,False,False
6409,parabiology,Noun,The study of biological paranormal activity,True,,False,False,False,False,False,False,False,False,False,False,False,False,False,False,False,False,False,False,False,False,False,,False,,False,,False,,False,,False,,False,False,False,False,False,False,False,False
6639,paraconsistent logic,Noun,The study of such systems.,True,,False,False,False,False,False,False,False,False,False,False,False,False,False,False,False,False,False,False,False,False,False,,False,,False,,False,,False,,False,,False,False,False,False,False,False,False,False
7291,paralinguistics,Noun,The study of paralanguage.,True,,False,False,False,False,False,False,False,False,False,False,False,False,False,False,False,False,False,False,False,False,False,,False,,False,,False,,False,,False,,False,False,False,False,False,False,False,False
7838,paranormalism,Noun,The study of the paranormal.,True,,False,False,False,False,False,False,False,False,False,False,False,False,False,False,False,False,False,False,False,False,False,,False,,False,,False,,False,,False,,False,False,False,False,False,False,False,False
8030,paraphysics,Noun,The study of paranormal activity and the occult as it applies to physical phenomena.,True,,False,False,False,False,False,False,False,False,False,False,False,False,False,False,False,False,False,False,False,False,False,,False,,False,,False,,False,,False,,False,False,False,False,False,False,False,False
8124,parapsychology,Noun,"The study of that which cannot yet be explained; psychic or occult phenomena, such as telepathy and ghosts.",True,,False,False,False,False,False,False,False,False,False,False,False,False,False,False,False,False,False,False,False,False,False,,False,,False,,False,,False,,False,,False,False,False,False,False,False,False,False
8966,paremiology,Noun,The study of proverbs.,True,,False,False,False,False,False,False,False,False,False,False,False,False,False,False,False,False,False,False,False,False,False,,False,,False,,False,,False,,False,,False,False,False,False,False,False,False,False
10388,particle mechanics,Noun,The study of the motion of individual particles.,True,,False,False,False,False,False,False,False,False,False,False,False,False,False,False,False,False,False,False,False,False,False,,False,,False,,False,,False,,False,,False,False,False,False,False,False,False,False
12499,pathoanatomy,Noun,The study of the causes of disease based on the examination of organs and tissues,True,"1997, Roy Porter, The Greatest Benefit to Mankind, Folio Society 2016, p. 257: His work laid the foundations for nineteenth-century pathoanatomy, and helps explain why, within a few decades, Cullen and his colleagues had gone the way of Galen.",False,False,False,False,False,False,False,False,False,False,False,False,False,False,False,False,False,False,False,False,False,,False,,False,,False,,False,,False,,False,False,False,False,False,False,False,False
12507,pathobiology,Noun,The branch of biology that deals with pathology with greater emphasis on the biological than on the medical aspects.,True,,False,False,False,False,False,False,False,False,False,False,False,False,False,False,False,False,False,False,False,False,False,,False,,False,,False,,False,,False,,False,False,False,False,False,False,False,False
12516,pathocenosis,Noun,The study of disease in societies,True,,False,False,False,False,False,False,False,False,False,False,False,False,False,False,False,False,False,False,False,False,False,,False,,False,,False,,False,,False,,False,False,False,False,False,False,False,False
12559,pathognomonics,Noun,The study of characteristic indications (pathognomonic signs) of particular diseases,True,"1734, William Stukeley, Of the Gout, page 39:Without that, 'tis vain to harangue the world with the formal and formidable pomp of tiologics, pathognomonics, procatarctics, prognostics...",False,False,False,False,False,False,False,False,False,False,False,False,False,False,False,False,False,False,False,False,False,,False,,False,,False,,False,,False,,False,False,False,False,False,False,False,False
12573,patholinguistics,Noun,The study of language disorders.,True,,False,False,False,False,False,False,False,False,False,False,False,False,False,False,False,False,False,False,False,False,False,,False,,False,,False,,False,,False,,False,False,False,False,False,False,False,False
12582,pathological histology,Noun,The study of the microscopic structure of living tissue (histology) of diseased tissue (as opposed to normal histology which studies the histology of healthy tissues).,True,,False,False,False,False,False,False,False,False,False,False,False,False,False,False,False,False,False,False,False,False,False,,False,,False,,False,,False,,False,,False,False,False,False,False,False,False,False
12602,pathology,Noun,"The branch of medicine concerned with the study of the nature of disease and its causes, processes, development, and consequences.",True,,False,False,False,False,False,False,False,False,False,False,False,False,False,False,False,False,False,False,False,False,False,,False,,False,,False,,False,,False,,False,False,False,False,False,False,False,False
12975,patristics,Noun,The study of the works of the early Christian Church Fathers.,True,,False,False,False,False,False,False,False,False,False,False,False,False,False,False,False,False,False,False,False,False,False,,False,,False,,False,,False,,False,,False,False,False,False,False,False,False,False
