Unnamed: 0,term,pos,definition,domain,supplementary_info,obsolete,slang,dated,rare,vulgar,offensive,slur,astrology,mythology,jargon,euphemistic,informal,humorous,literary,literature,childish,folklore,colloquial,nonstandard,theology,abbreviation,abbreviation_for_term,plural,plural_for_term,misspelling,misspelling_for_term,acronym,acronym_for_term,synonym,synonym_for_term,antonym,antonym_for_term,attribute,property,process,matter,role,measure,units,body
29076,chresmology,Noun,the study of prophecy,True,,False,False,False,False,False,False,False,False,False,False,False,False,False,False,False,False,False,False,False,False,False,,False,,False,,False,,False,,False,,False,False,False,False,False,False,False,False
29208,chromatics,Noun,The science of colours; the branch of optics that deals with the properties of colours.,True,,False,False,False,False,False,False,False,False,False,False,False,False,False,False,False,False,False,False,False,False,False,,False,,False,,False,,False,,False,,False,False,False,False,False,False,False,False
29450,chromodynamics,Noun,"The study of the relationship between those quarks that possess the quantum property of color, and exchange gluons; more fully quantum chromodynamics.",True,,False,False,False,False,False,False,False,False,False,False,False,False,False,False,False,False,False,False,False,False,False,,False,,False,,False,,False,,False,,False,False,False,False,False,False,False,False
29574,chromosomology,Noun,"The study of chromosomes 2016 February 17, Development of a Xeno-Free Feeder-Layer System from Human Umbilical Cord Mesenchymal Stem Cells for Prolonged Expansion of Human Induced Pluripotent Stem Cells in Culture, in PLOS ONE[1], DOI:10.1371/journal.pone.0149023:In this study, morphology, growth rate, chromosomology, cytochemistry and molecular biology analysis of hiPSCs cultured on hUC-MSCs feeder in comparison to those on MEF feeder confirmed the characteristics of hiPSCs were of pluripotent stem cell properties.",True,,False,False,False,False,False,False,False,False,False,False,False,False,False,False,False,False,False,False,False,False,False,,False,,False,,False,,False,,False,,False,False,False,False,False,False,False,False
29628,chronemics,Noun,The study of the communicative function of time,True,,False,False,False,False,False,False,False,False,False,False,False,False,False,False,False,False,False,False,False,False,False,,False,,False,,False,,False,,False,,False,False,False,False,False,False,False,False
29707,chronobiology,Noun,"The study of the effects of time on biological systems, especially the effects of periodicity",True,,False,False,False,False,False,False,False,False,False,False,False,False,False,False,False,False,False,False,False,False,False,,False,,False,,False,,False,,False,,False,False,False,False,False,False,False,False
29730,chronoecology,Noun,"The study of the effects of time on ecosystems, especially the effects of periodicity",True,,False,False,False,False,False,False,False,False,False,False,False,False,False,False,False,False,False,False,False,False,False,,False,,False,,False,,False,,False,,False,False,False,False,False,False,False,False
29793,chronology,Noun,the science of determining the order in which events occurred.,True,,False,False,False,False,False,False,False,False,False,False,False,False,False,False,False,False,False,False,False,False,False,,False,,False,,False,,False,,False,,False,False,False,False,False,False,False,False
29810,chronometry,Noun,The science of the measurement of time,True,,False,False,False,False,False,False,False,False,False,False,False,False,False,False,False,False,False,False,False,False,False,,False,,False,,False,,False,,False,,False,False,False,False,False,False,False,False
29824,chronopharmacodynamics,Noun,The study of how the effects of drugs are modified based on the time at which they are administered.,True,,False,False,False,False,False,False,False,False,False,False,False,False,False,False,False,False,False,False,False,False,False,,False,,False,,False,,False,,False,,False,False,False,False,False,False,False,False
29826,chronopharmacokinetics,Noun,"The study of how the absorption, metabolism and elimination of drugs relates to the time at which they are administered.",True,,False,False,False,False,False,False,False,False,False,False,False,False,False,False,False,False,False,False,False,False,False,,False,,False,,False,,False,,False,,False,False,False,False,False,False,False,False
29828,chronopharmacology,Noun,The branch of pharmacology concerned with the interaction of drugs and biorhythms,True,,False,False,False,False,False,False,False,False,False,False,False,False,False,False,False,False,False,False,False,False,False,,False,,False,,False,,False,,False,,False,False,False,False,False,False,False,False
29844,chronophysiology,Noun,The study of the cyclic variations and rhythmicity in physiological processes in the body,True,,False,False,False,False,False,False,False,False,False,False,False,False,False,False,False,False,False,False,False,False,False,,False,,False,,False,,False,,False,,False,False,False,False,False,False,False,False
29852,chronopsychology,Noun,The study of the psychological effects of human circadian rhythms and related topics,True,,False,False,False,False,False,False,False,False,False,False,False,False,False,False,False,False,False,False,False,False,False,,False,,False,,False,,False,,False,,False,False,False,False,False,False,False,False
29888,chronotoxicology,Noun,The study of the interactions between toxic substances and biorhythms,True,,False,False,False,False,False,False,False,False,False,False,False,False,False,False,False,False,False,False,False,False,False,,False,,False,,False,,False,,False,,False,False,False,False,False,False,False,False
31493,cindynics,Noun,The science of risk analysis,True,,False,False,False,False,False,False,False,False,False,False,False,False,False,False,False,False,False,False,False,False,False,,False,,False,,False,,False,,False,,False,False,False,False,False,False,False,False
31610,cinemology,Noun,The study of film,True,"1971, The New York Times Book Review, volume 76, page 42:Without sinking into fens of cinemology, which properly belong in another section of this wilderness, one can say for openers that all three critics cross lines continuously in practice. 1973, Maureen Turim, The Aesthetic Becomes Political: A History of Film Criticism in Cahiers du cinma, in The Velvet Light Trap, volume 9, number 13:Debate must take the shape, to use the current jargon, of ""meta-cinemology,"" a discussion of the approach to film itself, above and beyond the discussion of films. 2016 July 22, Victoria Dmitrieva, Dana Namdi, Using cinemology in psychological practice, in International Journal of Psychology, abstract:Our experience of using onto psychological cinemology based on using films shows that it is an effective way to identify discrepancies between the person's rational beliefs and authentic needs.",False,False,False,False,False,False,False,False,False,False,False,False,False,False,False,False,False,False,False,False,False,,False,,False,,False,,False,,False,,False,False,False,False,False,False,False,False
33409,civics,Noun,The study of good citizenship and proper membership in a community.,True,,False,False,False,False,False,False,False,False,False,False,False,False,False,False,False,False,False,False,False,False,False,,False,,False,,False,,False,,False,,False,False,False,False,False,False,False,False
34546,classical hadrodynamics,Noun,"The study of classical relativistic equations of motion for actions involving extended nucleons interacting with massive, neutral scalar and vector meson fields.",True,,False,False,False,False,False,False,False,False,False,False,False,False,False,False,False,False,False,False,False,False,False,,False,,False,,False,,False,,False,,False,False,False,False,False,False,False,False
34560,classical studies,Noun,"The study of Ancient Greek and Latin, their literature, history, etc., sometimes inclusive of the study of the ancient Mediterranean generally.",True,,False,False,False,False,False,False,False,False,False,False,False,False,False,False,False,False,False,False,False,False,False,,False,,False,,False,,False,,False,,False,False,False,False,False,False,False,False
36565,clinicopathology,Noun,"The study of the signs and symptoms of a disease and also of its pathology, especially with regard to their correlations",True,"2000, Mszros I, Mrocz J, Szlvi J, Schmidt J, Tornci L, Nagy L, Szp L, Epidemiology and clinicopathology of aortic dissection, in Chest, volume 117, number 5, DOI:10.1378/chest.117.5.1271, PMID 10807810, pages 1271-1278:Study objectives: To determine the incidence and mortality as well as to analyze the clinical and pathologic changes of aortic dissection.",False,False,False,False,False,False,False,False,False,False,False,False,False,False,False,False,False,False,False,False,False,,False,,False,,False,,False,,False,,False,False,False,False,False,False,False,False
38381,clownology,Noun,The study of being a clown,True,"1976, International Thespian Society, Dramatics: Volumes 48-49 At another graduation, Zoomer and Zonker, two students who met in the clownology course, were married [] 1992, Catherine V. McIntyre, Writing effective news releases, page 98:In addition to her duties as a clownology instructor, she is an active member of Clowns of America International [] 1994, Roberta Fernndez, In other words: literature by Latinas of the United States, page 61:In the mid-seventies, she was the valedictorian of her clownology class. Among her many performances as a clown, she counts as her most memorable her performances at a national conference of the National Endowment for the Arts []",False,False,False,False,False,False,False,False,False,False,False,False,False,False,False,False,False,False,False,False,False,,False,,False,,False,,False,,False,,False,False,False,False,False,False,False,False
41958,codicology,Noun,the study of codices (early handwritten books),True,,False,False,False,False,False,False,False,False,False,False,False,False,False,False,False,False,False,False,False,False,False,,False,,False,,False,,False,,False,,False,False,False,False,False,False,False,False
41994,coding theory,Noun,The branch of mathematics dealing with the art of transmitting messages reliably over a noisy channel by adding redundancy to the message.,True,,False,False,False,False,False,False,False,False,False,False,False,False,False,False,False,False,False,False,False,False,False,,False,,False,,False,,False,,False,,False,False,False,False,False,False,False,False
42317,coenology,Noun,The study of coenoses,True,,False,False,False,False,False,False,False,False,False,False,False,False,False,False,False,False,False,False,False,False,False,,False,,False,,False,,False,,False,,False,False,False,False,False,False,False,False
45642,colorimetry,Noun,The science of measuring colours and assigning them numeric values.,True,,False,False,False,False,False,False,False,False,False,False,False,False,False,False,False,False,False,False,False,False,False,,False,,False,,False,,False,,False,,False,False,False,False,False,False,False,False
47099,cometology,Noun,The branch of astronomy that deals with comets.,True,,False,False,False,False,False,False,False,False,False,False,False,False,False,False,False,False,False,False,False,False,False,,False,,False,,False,,False,,False,,False,False,False,False,False,False,False,False
48840,commutative algebra,Noun,The branch of algebra concerned with commutative rings and objects related to them (such as ideals and modules),True,"1992, R. Keith Dennis, Claudio Pedrini, Michael R. Stein (editors), Algebraic K-theory, Commutative Algebra, and Algebraic Geometry: Proceedings of the Joint Seminar, American Mathematical Society. 1992, Cornelius Greither, Cyclic Galois Extensions of Commutative Rings, Springer, page vii, The subject of these notes is a part of commutative algebra, and is also closely related to certain topics in algebraic number theory and algebraic geometry. 2003, Ragnar-Olaf Buchweitz, Morita contexts, idempotents, and Hochschild cohomology with applications to invariant rings, Luchezar L. Avramov, Marcel Morales, Marc Chardin, Claudia Polini (editors), Commutative Algebra: Interactions with Algebraic Geometry: International Conference, American Mathematical Society, page 27, It is not until section 7 that we deal with commutative algebra proper, whereas the sections leading up to it should be seen as advocacy that excursions into noncommutative algebra can help to shed light on problems in commutative algebra.",False,False,False,False,False,False,False,False,False,False,False,False,False,False,False,False,False,False,False,False,False,,False,,False,,False,,False,,False,,False,False,False,False,False,False,False,False
49143,company law,Noun,the branch of law which deals with the formation and running of companies.,True,,False,False,False,False,False,False,False,False,False,False,False,False,False,False,False,False,False,False,False,False,False,,False,,False,,False,,False,,False,,False,False,False,False,False,False,False,False
49198,comparative anatomy,Noun,the study of similarities and differences in the anatomy of organisms,True,,False,False,False,False,False,False,False,False,False,False,False,False,False,False,False,False,False,False,False,False,False,,False,,False,,False,,False,,False,,False,False,False,False,False,False,False,False
49854,complementology,Noun,The branch of immunology that deals with complement (one of four proteolytic cascades in blood),True,"2007, Janos Szebeni, The Complement System: Novel Roles in Health and Disease, ISBN:The chapters from prominent experts cover the essentials as well as the hottest issues in complementology. 2008, Richard A. Kaslow, Janet McNicholl, Adrian V. S. Hill, Genetic Susceptibility to Infectious Diseases, ISBN, page 156:This led to many reports of increased frequency of infections among complement-deficient patients and to the legitimization of complementology as a bona fide part of immunology. 2012, Klaus Rother Gerd Till, The Complement System, ISBN, page 239:Nevertheless, the obvious similarities in killing by complement and by lymphocytes were considered early [126] and led to continuous cross-fecundation between complementology and cellular immunology.",False,False,False,False,False,False,False,False,False,False,False,False,False,False,False,False,False,False,False,False,False,,False,,False,,False,,False,,False,,False,False,False,False,False,False,False,False
49950,complex analysis,Noun,The branch of mathematics that studies holomorphic functions.,True,,False,False,False,False,False,False,False,False,False,False,False,False,False,False,False,False,False,False,False,False,False,,False,,False,,False,,False,,False,,False,False,False,False,False,False,False,False
50794,computability theory,Noun,The branch of the theory of computation that studies which problems are computationally solvable using different models.,True,,False,False,False,False,False,False,False,False,False,False,False,False,False,False,False,False,False,False,False,False,False,,False,,False,,False,,False,,False,,False,False,False,False,False,False,False,False
50852,computer architecture,Noun,The science of computer design.,True,,False,False,False,False,False,False,False,False,False,False,False,False,False,False,False,False,False,False,False,False,False,,False,,False,,False,,False,,False,,False,False,False,False,False,False,False,False
50886,computer science,Noun,"The study of computers and their architecture, languages, and applications, in all aspects, as well as the mathematical structures that relate to computers and computation.",True,,False,False,False,False,False,False,False,False,False,False,False,False,False,False,False,False,False,False,False,False,False,,False,,False,,False,,False,,False,,False,False,False,False,False,False,False,False
51705,conchology,Noun,"the study of molluscs and their shells 2011, John Jeremiah Sullivan, Pulphead, The least dreadful among the essays stacked and waiting to be corrected would be that of young Master Jefferson Davis, who when imprisoned by Andrew Johnson in 1866 will ask his physician at Fortress Monroe to procure a few volumes of ""conchology, geology, or botany,"" he desiring to commune with the interests of more innocent days.",True,,False,False,False,False,False,False,False,False,False,False,False,False,False,False,False,False,False,False,False,False,False,,False,,False,,False,,False,,False,,False,False,False,False,False,False,False,False
53400,conformational analysis,Noun,The study of the arrangement in space of the constituent atoms of a molecule that may undergo rotation about one or more single bonds,True,,False,False,False,False,False,False,False,False,False,False,False,False,False,False,False,False,False,False,False,False,False,,False,,False,,False,,False,,False,,False,False,False,False,False,False,False,False
54290,conjuncturalism,Noun,The study of the conjunctures that influence interacting cultures.,True,,False,False,False,False,False,False,False,False,False,False,False,False,False,False,False,False,False,False,False,False,False,,False,,False,,False,,False,,False,,False,False,False,False,False,False,False,False
54512,connectomics,Noun,The study of the connectivity of synapses in the brain,True,,False,False,False,False,False,False,False,False,False,False,False,False,False,False,False,False,False,False,False,False,False,,False,,False,,False,,False,,False,,False,False,False,False,False,False,False,False
54841,conscientiology,Noun,The study of consciousness.,True,,False,False,False,False,False,False,False,False,False,False,False,False,False,False,False,False,False,False,False,False,False,,False,,False,,False,,False,,False,,False,False,False,False,False,False,False,False
55611,conspiratology,Noun,The study of conspiracies.,True,,False,False,False,False,False,False,False,False,False,False,False,False,False,False,False,False,False,False,False,False,False,,False,,False,,False,,False,,False,,False,False,False,False,False,False,False,False
56326,contact linguistics,Noun,The study of language contact,True,,False,False,False,False,False,False,False,False,False,False,False,False,False,False,False,False,False,False,False,False,False,,False,,False,,False,,False,,False,,False,False,False,False,False,False,False,False
57048,continuum theory,Noun,"The branch of topology devoted to the study of continua, a type of metric space.",True,,False,False,False,False,False,False,False,False,False,False,False,False,False,False,False,False,False,False,False,False,False,,False,,False,,False,,False,,False,,False,False,False,False,False,False,False,False
63273,cosmetic dentistry,Noun,The branch of dentistry that deals with the appearance of teeth,True,"Common cosmetic dental treatments include whitening or tooth bleaching, enamel shaping, bonding, veneers, and gum lift.",False,False,False,False,False,False,False,False,False,False,False,False,False,False,False,False,False,False,False,False,False,,False,,False,,False,,False,,False,,False,False,False,False,False,False,False,False
63294,cosmeticology,Noun,The science of cosmetic products; cosmetology.,True,,False,False,False,False,False,False,False,False,False,False,False,False,False,False,False,False,False,False,False,False,False,,False,,False,,False,,False,,False,,False,False,False,False,False,False,False,False
63302,cosmetology,Noun,the science of cosmetics,True,,False,False,False,False,False,False,False,False,False,False,False,False,False,False,False,False,False,False,False,False,False,,False,,False,,False,,False,,False,,False,False,False,False,False,False,False,False
63363,cosmochemistry,Noun,"The branch of chemistry that deals with the creation of the elements, and their isotopic distribution, in the universe; also with the synthesis and reactions of simple molecules in interstellar space.",True,,False,False,False,False,False,False,False,False,False,False,False,False,False,False,False,False,False,False,False,False,False,,False,,False,,False,,False,,False,,False,False,False,False,False,False,False,False
63366,cosmochronology,Noun,The science of determining timescales for astrophysical objects and events.,True,,False,False,False,False,False,False,False,False,False,False,False,False,False,False,False,False,False,False,False,False,False,,False,,False,,False,,False,,False,,False,False,False,False,False,False,False,False
63374,cosmoclimatology,Noun,The study of the effects of cosmic rays on the Earth's climate (and weather),True,,False,False,False,False,False,False,False,False,False,False,False,False,False,False,False,False,False,False,False,False,False,,False,,False,,False,,False,,False,,False,False,False,False,False,False,False,False
63405,cosmogony,Noun,"The study of the origin, and sometimes the development, of the universe or the solar system, in astrophysics, religion, and other fields.",True,,False,False,False,False,False,False,False,False,False,False,False,False,False,False,False,False,False,False,False,False,False,,False,,False,,False,,False,,False,,False,False,False,False,False,False,False,False
63421,cosmography,Noun,The study of the size and geometry of the universe and changes in those with cosmic time.,True,,False,False,False,False,False,False,False,False,False,False,False,False,False,False,False,False,False,False,False,False,False,,False,,False,,False,,False,,False,,False,False,False,False,False,False,False,False
63425,cosmokinematics,Noun,"The study of the motion or the universe 2015, Orlando Luongo, Giovanni Battista Pisani, Antonio Troisi, Cosmological degeneracy versus cosmography: a cosmographic dark energy model, in arXiv[1]:In this work we use cosmography to alleviate the degeneracy among cosmological models, proposing a way to parameterize matter and dark energy in terms of cosmokinematics quantities.",True,,False,False,False,False,False,False,False,False,False,False,False,False,False,False,False,False,False,False,False,False,False,,False,,False,,False,,False,,False,,False,False,False,False,False,False,False,False
63460,cosmology,Noun,"The study of the physical universe, its structure, dynamics, origin and evolution, and fate",True,"2012 January 1, Robert L. Dorit, Rereading Darwin, in American Scientist[1], volume 100, number 1, page 23:We live our lives in three dimensions for our threescore and ten allotted years. Yet every branch of contemporary science, from statistics to cosmology, alludes to processes that operate on scales outside of human experience: the millisecond and the nanometer, the eon and the light-year.",False,False,False,False,False,False,False,False,False,False,False,False,False,False,False,False,False,False,False,False,False,,False,,False,,False,,False,,False,,False,False,False,False,False,False,False,False
69142,craniology,Noun,The study of the physical characteristics of the human skull.,True,,False,False,False,False,False,False,False,False,False,False,False,False,False,False,False,False,False,False,False,False,False,,False,,False,,False,,False,,False,,False,False,False,False,False,False,False,False
69155,craniometrics,Noun,The science of craniometry,True,,False,False,False,False,False,False,False,False,False,False,False,False,False,False,False,False,False,False,False,False,False,,False,,False,,False,,False,,False,,False,False,False,False,False,False,False,False
70875,creolistics,Noun,The branch of linguistics concerned with the study of creole languages and literatures.,True,,False,False,False,False,False,False,False,False,False,False,False,False,False,False,False,False,False,False,False,False,False,,False,,False,,False,,False,,False,,False,False,False,False,False,False,False,False
71642,criminology,Noun,"The study of crime and criminals, especially their behaviour.",True,,False,False,False,False,False,False,False,False,False,False,False,False,False,False,False,False,False,False,False,False,False,,False,,False,,False,,False,,False,,False,False,False,False,False,False,False,False
72026,criteriology,Noun,The study of the validity of reasoning and the criteria necessary to achieve knowledge,True,"1991, Ernest Sosa, Knowledge in Perspective: Selected Essays in Epistemology, ISBN, page 129:But it seems otherwise with reasoning as viewed by criteriology. 1996, Luciano Floridi, Scepticism Ant the Foundation of Epistemology, ISBN:According to Mercier, criteriology should demonstrate the fallacy of two forms of scepticism: one that casts doubts on each of the acts of the human reason and one that casts doubts on the very possibility of arriving at a knowledge of the truth. 2015, Paul Rigby, The Theology of Augustine's Confessions, ISBN, page 17:In the other kind of knowledge, reflection develops a criteriology of the divine to judge whether or not consciousness is testifying to the true God or some phantasm of the divine.",False,False,False,False,False,False,False,False,False,False,False,False,False,False,False,False,False,False,False,False,False,,False,,False,,False,,False,,False,,False,False,False,False,False,False,False,False
75023,crustaceology,Noun,The branch of zoology dealing with crustaceans.,True,,False,False,False,False,False,False,False,False,False,False,False,False,False,False,False,False,False,False,False,False,False,,False,,False,,False,,False,,False,,False,False,False,False,False,False,False,False
75286,cryobiology,Noun,the study of the effects of low temperature on living organisms,True,,False,False,False,False,False,False,False,False,False,False,False,False,False,False,False,False,False,False,False,False,False,,False,,False,,False,,False,,False,,False,False,False,False,False,False,False,False
